2006-08-12T12:23:00.000Z	nekostar		mm interesting lostsync
2006-08-12T12:23:00.000Z	nekostar		could i attach second hdd
2006-08-12T12:23:00.000Z	nekostar		boot via live cd
2006-08-12T12:23:00.000Z	nekostar		make the partitions on the second hdd i need
2006-08-12T12:23:00.000Z	nekostar		and then mv folders over ?
2006-08-12T12:23:00.000Z	nekostar		and then turn off
2006-08-12T12:23:00.000Z	nekostar		take out first hdd
2006-08-12T12:23:00.000Z	nekostar		and boot to second and do the grub fix ?
2006-08-12T12:24:00.000Z	gekko`	nekostar	don't mv them, just cp them over to your new hdd
2006-08-12T12:24:00.000Z	nekostar		i can cp then ?
2006-08-12T12:24:00.000Z	nekostar		and just do grub fix ?
2006-08-12T12:24:00.000Z	nekostar		so i wouldnt have to reinstall <3 ??
2006-08-12T12:24:00.000Z	nekostar		ive got a 40 gig and a 200 gig installed now
2006-08-12T12:24:00.000Z	nekostar		installing new 200 gig :D
2006-08-12T12:25:00.000Z	nekostar		though admittedly
2006-08-12T12:25:00.000Z	nekostar		its tempting to make my ubuntu install all one partition [plus swap]  and just do an rsync of /home or something
2006-08-12T12:25:00.000Z	gekko`	nekostar	well, I'd rather use dd if=/dev/hda1 of=/dev/hdb1 etc, for each partition
2006-08-12T12:25:00.000Z	gekko`	nekostar	but before read man dd
2006-08-12T12:25:00.000Z	nekostar	gekko`	dd ?
