2007-03-06T06:17:00.000Z	utilisateur		hi evervy one, having problems compiling every thing
2007-03-06T06:17:00.000Z	utilisateur		cannot create executables..
2007-03-06T06:19:00.000Z	utilisateur		in a fresh ubuntu install
2007-03-06T06:19:00.000Z	Flannel	utilisateur	grab 'build-essential'
2007-03-06T06:19:00.000Z	utilisateur	Flannel	already did
2007-03-06T06:20:00.000Z	Flannel	utilisateur	build-essential is enough.  You sure you're still getting the same error?
2007-03-06T06:20:00.000Z	utilisateur	Flannel	yes
2007-03-06T06:23:00.000Z	Flannel	utilisateur	And whats the exact error message?
2007-03-06T06:24:00.000Z	utilisateur	Flannel	cannot create executables
2007-03-06T06:24:00.000Z	Flannel	utilisateur	theres more than just that in the error message
2007-03-06T08:31:00.000Z	Flannel	utilisateur	sudo apt-get install build-essential
2007-03-06T08:31:00.000Z	Flannel	utilisateur	use apt-cdrom to add the CD you do have to your repositories, then sudo apt-get install build-essential
2007-03-06T08:34:00.000Z	Flannel	utilisateur	What command did you give to get that error?
2007-03-06T08:34:00.000Z	Flannel	utilisateur	sounds like it
2007-03-06T08:40:00.000Z	Flannel	utilisateur	which CD do you have?
2007-03-06T08:41:00.000Z	Flannel	utilisateur	Grab a real CD.  The alternate, or server.  It's a real repository on there.  And, the server has LAMP on it in packages.
2007-03-06T08:41:00.000Z	Flannel	utilisateur	I think the alternate has all those packages too.  Let me check for you.
2007-03-06T08:42:00.000Z	Flannel	utilisateur	right.  Download and burn the alternate CD.
2007-03-06T08:42:00.000Z	Flannel	utilisateur	Then use apt-cdrom to add the alternate CD to your repositories, and apache et al are in it.
