2005-12-08T12:04:00.000Z	nExy		dont mean to be a rude one either
2005-12-08T12:04:00.000Z	nExy		but there already installed
2005-12-08T12:04:00.000Z	nExy		:)
2005-12-08T12:05:00.000Z	nExy		yah? and....
2005-12-08T12:05:00.000Z	nExy		everything is already turned up
2005-12-08T12:05:00.000Z	nExy		i get an error when i try playing a MP3
2005-12-08T12:05:00.000Z	nExy		Playing MPEG stream from 20050828210929.mp3 ...
2005-12-08T12:05:00.000Z	nExy		MPEG 1.0 layer III, 192 kbit/s, 44100 Hz stereo
2005-12-08T12:05:00.000Z	nExy		Can't find a suitable libao driver. (Is device in use?)
2005-12-08T12:05:00.000Z	nExy		 Can't find a suitable libao driver. (Is device in use?)
2005-12-08T12:06:00.000Z	michele	nExy	what program are you using to play?
2005-12-08T12:07:00.000Z	michele	nExy	try with aplay to check if alsa is ok
2005-12-08T12:07:00.000Z	nExy		mpg321
2005-12-08T12:07:00.000Z	nExy		i just run aplay from console ?
2005-12-08T12:08:00.000Z	nExy		i dont have esd running
2005-12-08T12:08:00.000Z	nExy		cah i use aplay
2005-12-08T12:09:00.000Z	nExy		puss whats sftp ?
2005-12-08T12:12:00.000Z	nExy		it dosnt play again when i run aplay
2005-12-08T12:15:00.000Z	nExy	michele	aplay dosnt work
