2006-07-26T05:23:00.000Z	ContinuumXLS		Does anyone know why when I try to add the Debian menu item to my menu alacarte won't let me? I click and nothing happens
2006-07-26T05:24:00.000Z	ContinuumXLS		Have you tryed Automatix?
2006-07-26T05:24:00.000Z	ContinuumXLS		go on the ubuntu forums and search for automatix
2006-07-26T05:25:00.000Z	ContinuumXLS		Does anyone know why when I try to add the Debian menu item to my menu alacarte won't let me? I click and nothing happens
2006-07-26T05:26:00.000Z	ContinuumXLS		Yes
2006-07-26T05:26:00.000Z	ContinuumXLS		menu?
2006-07-26T05:27:00.000Z	ContinuumXLS		ill search for menu
2006-07-26T05:28:00.000Z	ContinuumXLS		yes, both of them are isntalled. How do i make it say your name in red?
2006-07-26T05:30:00.000Z	Amaranth	ContinuumXLS	what's wrong?
2006-07-26T05:30:00.000Z	ContinuumXLS	Amaranth	i can't enable the debian menu item with alacarte. I click and nothing happens
2006-07-26T05:31:00.000Z	Amaranth	ContinuumXLS	it's empty
2006-07-26T05:31:00.000Z	ContinuumXLS	Amaranth	You're right I think
2006-07-26T05:31:00.000Z	Amaranth	ContinuumXLS	sudo apt-get install menu menu-xdg && sudo update-menu
2006-07-26T05:31:00.000Z	ContinuumXLS	Amaranth	Ihave both of those packages installed, but ill try updating the menu
2006-07-26T05:33:00.000Z	ContinuumXLS	Amaranth	sudo apt-get install menu menu-xdg && sudo update-menu
2006-07-26T05:33:00.000Z	Amaranth	ContinuumXLS	err, yeah
2006-07-26T05:33:00.000Z	ContinuumXLS	Amaranth	sorrry, i meant udate-menu command wasnt found
2006-07-26T05:34:00.000Z	Amaranth	ContinuumXLS	I don't want to run it here so I don't know what the command is.
2006-07-26T05:34:00.000Z	ContinuumXLS	Amaranth	That's cool. Thanks for the help
