2005-03-16T14:52:00.000Z	johnnybe1ak		dont mess with the pentiums baby
2005-03-16T14:53:00.000Z	johnnybe1ak		what do you use crimsun
2005-03-16T14:54:00.000Z	crimsun	johnnybe1ak	for?
2005-03-16T14:54:00.000Z	crimsun	johnnybe1ak	I generally stick to bittorrent (btdownloadcurses)
2005-03-16T14:54:00.000Z	johnnybe1ak	crimsun	cool
2005-03-16T14:56:00.000Z	crimsun	johnnybe1ak	which cpu?
2005-03-16T14:56:00.000Z	crimsun	johnnybe1ak	make sure you enable multiverse
2005-03-16T14:58:00.000Z	crimsun	johnnybe1ak	there appear to be mplayer-altivec, mplayer-powerpc, and mplayer-g4 packages
2005-03-16T14:59:00.000Z	johnnybe1ak	crimsun	yeah i tried the powerpc and g4
2005-03-16T14:59:00.000Z	johnnybe1ak	crimsun	no love
2005-03-16T15:04:00.000Z	crimsun	johnnybe1ak	what errors do you get regarding attempting to install mplayer?
2005-03-16T15:05:00.000Z	crimsun	johnnybe1ak	are they missing dependencies? If so, did you add the requisite debian-marillat/mirror repo(s)?
2005-03-16T15:07:00.000Z	johnnybe1ak	crimsun	marillat doesnt have ppc
2005-03-16T15:07:00.000Z	crimsun	johnnybe1ak	http://debian.video.free.fr/
2005-03-16T15:08:00.000Z	crimsun	johnnybe1ak	in particular, deb http://honk.physik.uni-konstanz.de/~agx/linux-ppc/debian/ mplayer/
2005-03-16T15:08:00.000Z	johnnybe1ak	crimsun	thanks ill check it out
2005-03-16T15:24:00.000Z	crimsun	johnnybe1ak	sudo apt-get remove libavcodec-dev
2005-03-16T15:24:00.000Z	johnnybe1ak	crimsun	thanks man
2005-11-10T14:14:00.000Z	crimsun	johnnybe1ak	you can use the Character Palette utility (add it to the Panel) and/or set a Compose key in System> Preferences> Keyboard> Layout Options> Compose key position
