2005-03-01T15:54:00.000Z	Yawboy2		hi I'm new to ubuntu
2005-03-01T15:54:00.000Z	Yawboy2		anyone available to give me support?
2005-03-01T15:55:00.000Z	Yawboy2		ok njan
2005-03-01T15:56:00.000Z	Yawboy2		I've downloaded a package from the mysql site but can't have them installed
2005-03-01T15:57:00.000Z	Yawboy2		the packages are MySQL-client-4.1.10-0.i386.rpm,  MySQL-server-4.1.10-0.i386.rpm,  MySQL-shared-compat-4.1.10-0.i386.rpm
2005-03-01T15:58:00.000Z	Yawboy2		nope I'm not aware
2005-03-01T15:58:00.000Z	fsc	Yawboy2	use search in synaptic
2005-03-01T15:58:00.000Z	fsc	Yawboy2	you want debs
2005-03-01T15:59:00.000Z	fsc	Yawboy2	or as a last resort use alien for those rpms to convert them to debs
2005-03-01T16:00:00.000Z	fsc	Yawboy2	don't worry about alien right now
2005-03-01T16:00:00.000Z	fsc	Yawboy2	open up synaptic and do a search for mysqul
2005-03-01T16:04:00.000Z	Yawboy2	fsc	yes but that one is only MySQL commons
2005-03-01T16:04:00.000Z	fsc	Yawboy2	did you just install ubuntu - and what version are you using?
2005-03-01T16:04:00.000Z	fsc	Yawboy2	I see client and server in there
2005-03-01T16:04:00.000Z	Yawboy2	fsc	so how do I get MySQL running.  I new to dis ubuntu stuff
2005-03-01T16:05:00.000Z	fsc	Yawboy2	I don't know anything about mysql.  your first step is to install it
2005-03-01T16:06:00.000Z	Yawboy2	fsc	mine only shows MySQL common
2005-03-01T16:07:00.000Z	Yawboy2	fsc	thanks.  I'll see what I can do
2005-03-01T16:07:00.000Z	fsc	Yawboy2	check settings and respotiories
