2004-11-25T10:03:00.000Z	GSA917		does anyone here use ndiswrapper?
2004-11-25T10:03:00.000Z	ogra	GSA917	see what the bot said (bonobo)
2004-11-25T10:07:00.000Z	ogra	GSA917	look at the website, you dont need to compile anything in ubuntu
2004-11-25T10:08:00.000Z	GSA917	ogra	thanks i will check it out
2004-11-25T10:09:00.000Z	ogra	GSA917	just get the package... on a floppy or so... to get it to your other pc
2004-11-25T10:11:00.000Z	GSA917	ogra	once i get the package to a floppy, do i just double-click them to install them?
2004-11-25T10:11:00.000Z	ogra	GSA917	nope....
2004-11-25T10:11:00.000Z	GSA917	ogra	i opologize for my lack of knowledge
2004-11-25T10:12:00.000Z	ogra	GSA917	copy it to your homedir and run im a terminal: sudo dpkg -i packagename.deb
2004-11-25T10:13:00.000Z	GSA917	ogra	thanks for your patience.
2004-11-25T10:23:00.000Z	GSA917	ogra	so is there an ftp site or something
2004-11-25T10:39:00.000Z	ogra	GSA917	better http://archive.ubuntulinux.org/ubuntu/pool/main/l/linux-meta/
2004-11-25T10:44:00.000Z	GSA917	ogra	so "linux-image-2.6.8.1-3-386" and "linux-image-686_2.6.8.1-13_i386.deb " are the same thing?
2004-11-25T10:59:00.000Z	GSA917	ogra	i have that folder too... so is i guess i have the ability to setup ndiswrapper now?
2004-11-25T11:00:00.000Z	ogra	GSA917	the ndiswrapper-utils package should be enough....i think you should try the command: uname -a
2004-11-25T11:00:00.000Z	ogra	GSA917	to determine your kernel version
2004-11-25T11:01:00.000Z	GSA917	ogra	ok
2004-11-25T11:01:00.000Z	GSA917	ogra	2.6.8.1-3-386
2004-11-25T11:04:00.000Z	GSA917	ogra	night
