2004-11-23T06:49:00.000Z	xukun		if gcc is installed in warty, then way is this? sudo dpkg -s gcc Package `gcc' is not installed and no info is available.
2004-11-23T06:49:00.000Z	xukun		I must be doing something wrong
2004-11-23T06:49:00.000Z	Treenaks	xukun	it's not installed by default
2004-11-23T06:49:00.000Z	Treenaks	xukun	you should install build-essential
2004-11-23T06:49:00.000Z	Treenaks	xukun	it could also be that the package is called gcc-3.3 or something
2004-11-23T06:51:00.000Z	xukun	Treenaks	apt-get install build-essential?
2004-11-23T06:52:00.000Z	Treenaks	xukun	yes
2004-11-23T08:38:00.000Z	Treenaks	xukun	those shuold have loaded automatically
2004-11-23T08:39:00.000Z	xukun	Treenaks	I have no sound and my second 3com network card is not there?
2004-11-23T08:40:00.000Z	Treenaks	xukun	IRQ problems?
2004-11-23T08:41:00.000Z	xukun	Treenaks	cat /proc/interrupts does not show anything
2004-11-23T08:41:00.000Z	Treenaks	xukun	you don't need isapnptools anymore, that's 2.2 kernel work
2004-11-23T08:41:00.000Z	Treenaks	xukun	new drivers should just hotplug
2004-11-23T08:42:00.000Z	xukun	Treenaks	that is what everybody is saying but then where is my sound card and network which are onboard?
2004-11-23T08:43:00.000Z	xukun	Treenaks	its an old p3 system
2004-11-23T08:43:00.000Z	Treenaks	xukun	what does 'lspnp' tell you?
2004-11-23T08:43:00.000Z	Treenaks	xukun	does it show the cards?
2004-11-23T08:43:00.000Z	xukun	Treenaks	sec
2004-12-07T14:58:00.000Z	Treenaks	xukun	use cdrecord dev=/dev/hdc or something
