2004-12-15T11:53:00.000Z	Vigilanty		i still can't get libdvdcss2
2004-12-15T11:53:00.000Z	Vigilanty		help plz...
2004-12-15T11:54:00.000Z	Vigilanty		it didnt tell me how
2004-12-15T11:54:00.000Z	Vigilanty		dunno how to add repository to it...
2004-12-15T11:55:00.000Z	linux_galore	Vigilanty	you wont find it on an official server your going to have to look on  www.google.com/linux for an unofficial debian server
2004-12-15T13:10:00.000Z	linux_galore	Vigilanty	some have dcss restrictions also beware some dvd players dont play dvd-r +/- cd's
2004-12-15T13:11:00.000Z	linux_galore	Vigilanty	yeah the CD's have DRM on them
2004-12-15T13:12:00.000Z	linux_galore	Vigilanty	need a player that is setup for libdcss
2004-12-15T13:13:00.000Z	linux_galore	Vigilanty	totem wont play my dcss stuff
2004-12-15T13:14:00.000Z	linux_galore	Vigilanty	wont be unless you add an unofficial server
2004-12-15T13:15:00.000Z	linux_galore	Vigilanty	I usually look one up on google.com/linux
2004-12-15T13:16:00.000Z	linux_galore	Vigilanty	naaw  something like  ftp debian libdcss codecs unofficial
2004-12-15T13:19:00.000Z	linux_galore	Vigilanty	zarb.org one is for Mandrake
2004-12-15T13:20:00.000Z	linux_galore	Vigilanty	plf people are a mandrake community useless to you
2004-12-15T13:22:00.000Z	linux_galore	Vigilanty	rpm's
2004-12-15T13:30:00.000Z	linux_galore	Vigilanty	libdvdcss is here ftp://ftp.nerim.net/debian-marillat/dists/stable/main/binary-i386  didnt you add it before ftp://ftp.nerim.net/debian-marillat/
2004-12-15T13:30:00.000Z	linux_galore	Vigilanty	to synaptic
2004-12-15T13:34:00.000Z	linux_galore	Vigilanty	well the first link has the package
2004-12-15T13:34:00.000Z	linux_galore	Vigilanty	index.html file is there ftp://ftp.nerim.net/debian-marillat/
