2006-07-03T15:42:00.000Z	kordokuvas		not with fdisk of uglq Slackware
2006-07-03T15:42:00.000Z	kordokuvas		ugly
2006-07-03T15:44:00.000Z	kordokuvas		redguy?
2006-07-03T15:44:00.000Z	kordokuvas		what help can u give me,u r just chatting
2006-07-03T15:45:00.000Z	kordokuvas		i didn't get any help here sinse now
2006-07-03T15:46:00.000Z	kordokuvas		yeah,whatever,if u say so
2006-07-03T15:46:00.000Z	kordokuvas		u may need to check dictonaru for a Newbie or amateur and how to laugh at him really loud
2006-07-03T15:47:00.000Z	kordokuvas		hahahah,look at this lamer windows user
2006-07-03T15:47:00.000Z	kordokuvas		u c now why windows will be in the 1st place in 200 years of time from now on
2006-07-03T15:48:00.000Z	kordokuvas		whatever,i'm disapointed
2006-07-03T15:48:00.000Z	Dr_Willis	kordokuvas	 we are dissapointed in you also.
2006-07-03T15:49:00.000Z	Dr_Willis	kordokuvas	 well youve convinced most  of us to not  want to help you.. now...
2006-07-03T15:49:00.000Z	Dr_Willis	kordokuvas	 'sudo apt-get install somthing'
2006-07-03T15:51:00.000Z	Dr_Willis	kordokuvas	 'you call this  being receptive to help' ?
2006-07-03T15:52:00.000Z	Dr_Willis	kordokuvas	 right there in the menus for me...
2006-07-03T15:54:00.000Z	Dr_Willis	kordokuvas	 then go back to windows if you are that hopeless.
2006-07-04T16:02:00.000Z	Dr_Willis	kordokuvas	  Tip #5 - when asking a question, dont be vague and rambling.
2006-07-04T16:02:00.000Z	Dr_Willis	kordokuvas	 lack of effort on your part is not a failure of the os.
2006-07-04T16:03:00.000Z	Dr_Willis	kordokuvas	 we see how 'thoughtfull' you are.
