2011-01-07T13:26:00.000Z	upsla		duron23:i will try it.
2011-01-07T13:27:00.000Z	upsla		duron23:cbe
2011-01-07T13:27:00.000Z	duron23	upsla	cbe ?
2011-01-07T13:07:00.000Z	duron23	upsla	just ask mention your issue, don't ask to ask
2011-01-07T13:14:00.000Z	duron23	upsla	I guess you need tha AT command to connect
2011-01-07T13:15:00.000Z	duron23	upsla	which you get from your service provider
2011-01-07T13:21:00.000Z	duron23	upsla	hey airtel, you from india ? I am from bangalore
2011-01-07T13:22:00.000Z	duron23	upsla	is your modem detected by ubuntu ?
2011-01-07T13:23:00.000Z	duron23	upsla	haaa, its just the at commnad issue
2011-01-07T13:23:00.000Z	duron23	upsla	hang on a sec
2011-01-07T13:26:00.000Z	upsla	duron23	r u there ?.
2011-01-07T13:26:00.000Z	duron23	upsla	follow this http://www.ubuntugeek.com/setting-up-dial-up-connection-in-ubuntu.html  from Configuring a Dial-Up Connection using gnome-ppp
2011-01-07T13:26:00.000Z	duron23	upsla	you are from where ?
2011-01-07T13:30:00.000Z	upsla	duron23	hey ur link says about dial up modem. In my computer that doesn't show up.
2011-01-07T13:31:00.000Z	duron23	upsla	where are you from ?
2011-01-07T13:31:00.000Z	duron23	upsla	and which make is your modem ?
2011-01-07T13:32:00.000Z	duron23	upsla	and the modem
2011-01-07T13:33:00.000Z	upsla	duron23	r u there ?
2011-01-07T13:34:00.000Z	duron23	upsla	I need to know you modem model
