2010-04-25T03:10:00.000Z	linux_is_my_hero		how do i get invited to #hardware?
2010-04-25T03:11:00.000Z	xangua	linux_is_my_hero	you need to be registered i believe
2010-04-28T08:49:00.000Z	linux_is_my_hero	xangua	now i have the JRE bin file but i dont know how to install it :-(
2010-04-28T08:34:00.000Z	xangua	linux_is_my_hero	i believe frostwire is not in the repositories
2010-04-28T08:44:00.000Z	xangua	linux_is_my_hero	you can install java from the repositories
2010-04-28T08:44:00.000Z	linux_is_my_hero	xangua	sudo apt-get install java?
2010-04-28T08:45:00.000Z	xangua	linux_is_my_hero	if you want it for the browser install 'sun-java6-plugin' package
2010-04-28T08:48:00.000Z	linux_is_my_hero	xangua	I've installed java like you said but when i run frostwire sudo from the terminal it gives me there errors
2010-05-13T09:08:00.000Z	xangua	linux_is_my_hero	did you removed notification area¿ if not in terminal: nm-applet
2010-05-13T09:09:00.000Z	linux_is_my_hero	xangua	it says its already running
2010-05-13T09:10:00.000Z	linux_is_my_hero	xangua	i did not, it left on its own
2010-10-15T08:39:00.000Z	xangua	linux_is_my_hero	added a ppa¿
2010-10-15T08:39:00.000Z	linux_is_my_hero	xangua	not since the problem
2010-10-29T08:18:00.000Z	xangua	linux_is_my_hero	since limeware closed i don't thin frostwire is lognr aviable
2010-10-29T08:19:00.000Z	linux_is_my_hero	xangua	what file sharing software would you recommend?
2010-10-29T08:20:00.000Z	linux_is_my_hero	xangua	on ubuntu 10.04 x64?
2010-10-29T08:20:00.000Z	xangua	linux_is_my_hero	torrent
2011-03-31T05:55:00.000Z	xangua	linux_is_my_hero	install pidgin-libnotify
2011-03-31T05:55:00.000Z	linux_is_my_hero	xangua	much thanks :-)
