2010-04-09T07:22:00.000Z	randal		How do you update your Bios in Linux plz help
2010-04-09T07:23:00.000Z	randomusr_	randal	um do what?
2010-04-09T07:23:00.000Z	randal	randomusr_	 Update my laptop bios
2010-04-09T07:23:00.000Z	randomusr_	randal	most manufacturers allow you to create a bootcd or bootfloppy to flash the bios
2010-04-09T07:24:00.000Z	randomusr_	randal	are you 100% confident that you understand the risks of updating the bios?
2010-04-09T07:25:00.000Z	randal	randomusr_	 its usually not that hard yes i understand the risks
2010-04-09T07:26:00.000Z	randal	randomusr_	 is there a program for linux to flsh the bios or something
2010-04-09T07:26:00.000Z	randomusr_	randal	go to a windows machine and download the iso image or boot floppy for your computer then boot from that
2010-04-09T07:26:00.000Z	randal	randomusr_	 the think is its a netbook i dont have a cd drive or floppy
2010-04-09T07:27:00.000Z	randal	randomusr_	thing*
2010-04-09T07:27:00.000Z	randomusr_	randal	I believe those offer a usb flash drive option, or you can use a 2.5 usb floppy drive
2010-04-09T07:30:00.000Z	randal	randomusr_	 im on the asus support website i cant find any prgoram that can flash bios exept for windows
2010-04-09T07:31:00.000Z	randomusr_	randal	give me a moment and I'll see if I can pull it up
2010-04-09T07:32:00.000Z	randomusr_	randal	is that just eee or is there a model or something?
2010-04-09T07:34:00.000Z	randomusr_	randal	is that just eee pc?
2010-04-09T07:34:00.000Z	randomusr_	randal	what country did you buy it in?
2010-04-09T07:36:00.000Z	randal	randomusr_	its a eee pc 1008 ha
2010-04-09T07:39:00.000Z	randomusr_	randal	I was able to find it without issue
2010-04-09T07:40:00.000Z	randomusr_	randal	still here?
