2010-08-19T22:53:00.000Z	qwe		Hello
2010-08-19T22:54:00.000Z	qwe		Has anyone used Spam-assasin?
2010-08-19T22:54:00.000Z	KE1HA	qwe	yes but t's been a long time.
2010-08-19T22:55:00.000Z	qwe	KE1HA	sipior: Could you give poper detail instruction about it?
2010-08-19T22:55:00.000Z	KE1HA	qwe	What is the specific quesiotn you ahve ?
2010-08-19T22:56:00.000Z	KE1HA	qwe	You want to configure spam-assassin with Postfix or something ?
2010-08-19T22:58:00.000Z	KE1HA	qwe	More details: http://townx.org/blog/elliot/simple_spamassassin_setup_with_postfix_and_dovecot_on_ubuntu_breezy
2010-08-19T23:33:00.000Z	KE1HA	qwe	Disconnect from the ISO, and reconnect to ISO-2
2010-08-19T23:33:00.000Z	qwe	KE1HA	i am using iso iages on HD
2010-08-19T23:34:00.000Z	KE1HA	qwe	Best blace for virtual box quesiotn is in the #vbox channel
2010-08-19T23:35:00.000Z	qwe	KE1HA	Thank you
2010-08-19T23:37:00.000Z	qwe	KE1HA	Hey...
2010-08-19T23:38:00.000Z	KE1HA	qwe	Yes?
2010-08-19T23:39:00.000Z	qwe	KE1HA	Hey... there is small panel below the running screen whihc indicates HS usage, USB selection and even CD/DVD ...there one can find the option to switching to previously selected option. There exactly is the option for changing CD...oversight :-)
2010-08-19T23:39:00.000Z	qwe	KE1HA	*which *HD
2010-08-19T23:41:00.000Z	KE1HA	qwe	I dont know what screen your on. Best place for virtual box quesiotns is #vbox channel
2010-08-19T23:44:00.000Z	qwe	KE1HA	Thank you.. i was conveying the solution alone
2010-08-19T23:45:00.000Z	KE1HA	qwe	I dont have a VBOX install on this Workstation, and don't have all the screens committed to memory, sri.
2010-08-19T23:45:00.000Z	qwe	KE1HA	Thank you for all the help till date :-)
