2012-03-31T11:53:00.000Z	lalalelelulu		hELLO
2012-03-31T11:53:00.000Z	lalalelelulu		meee help
2012-03-31T11:54:00.000Z	lalalelelulu		meee need help
2012-03-31T11:54:00.000Z	lalalelelulu		but me not get help
2012-03-31T11:54:00.000Z	lalalelelulu		why me not help
2012-03-31T11:55:00.000Z	bazhang	lalalelelulu	whats the question
2012-03-31T11:57:00.000Z	lalalelelulu	bazhang	why can he say bad words about me
2012-03-31T11:58:00.000Z	bazhang	lalalelelulu	do you have an ubuntu support question?
2012-03-31T11:58:00.000Z	bazhang	lalalelelulu	then ask it, all on ONE line
2012-03-31T11:58:00.000Z	bazhang	lalalelelulu	ONE line
2012-03-31T11:59:00.000Z	bazhang	lalalelelulu	read those links First
2012-03-31T11:59:00.000Z	bazhang	lalalelelulu	read the links...
2012-03-31T12:01:00.000Z	bazhang	lalalelelulu	whats your native language
2012-03-31T12:01:00.000Z	bazhang	lalalelelulu	and you read those links?
2012-03-31T12:02:00.000Z	lalalelelulu	bazhang	yes but some difficul words about ubuntu i do not udnerstand!!!
2012-03-31T12:03:00.000Z	bazhang	lalalelelulu	read that manual, it's much easier
2012-03-31T12:04:00.000Z	bazhang	lalalelelulu	then ask it
2012-03-31T12:07:00.000Z	lalalelelulu	bazhang	shouldnt i say something about me???
2012-03-31T12:08:00.000Z	bazhang	lalalelelulu	this is ubuntu support. what is your ubuntu support question
