2009-04-24T13:04:00.000Z	jeeva11		how to compile c programs in terminal..i used gcc but i am getting errors as stdio.h:no file or directory found
2009-04-24T13:06:00.000Z	liquidmeson	jeeva11	you need gcc
2009-04-24T13:07:00.000Z	liquidmeson	jeeva11	to compile c programss
2009-04-24T13:08:00.000Z	liquidmeson	jeeva11	not sure im in 9.04
2009-04-24T13:13:00.000Z	liquidmeson	jeeva11	just type in the program you wan tto compile... "gcc foo"
2009-04-24T13:13:00.000Z	liquidmeson	jeeva11	you might need g++ for c++
2009-04-24T13:14:00.000Z	liquidmeson	jeeva11	"sudo gcc programtocompile"?
2009-04-24T13:16:00.000Z	liquidmeson	jeeva11	are you doing thin in like geany?
2009-04-24T13:16:00.000Z	jeeva11	liquidmeson	i don't know about geany
2009-04-24T13:17:00.000Z	liquidmeson	jeeva11	if you try compiling a simple hello world, what do you get?
2009-04-24T13:21:00.000Z	liquidmeson	jeeva11	what criten said
2009-04-24T13:22:00.000Z	jeeva11	liquidmeson	may be to install gcc we need that command
2009-04-24T13:23:00.000Z	liquidmeson	jeeva11	type in "sudo apt-get install build-essential" into the terminal and then try compiling again?
2009-04-24T13:55:00.000Z	liquidmeson	jeeva11	try compiling your program in geany,.. its a nice development program you can get from the add remove menu
2009-04-24T13:56:00.000Z	jeeva11	liquidmeson	i don't have geany i don't know how to install that
2009-04-24T13:59:00.000Z	liquidmeson	jeeva11	new c source file
2009-04-24T14:00:00.000Z	liquidmeson	jeeva11	and then copy your program in there
2009-04-24T14:01:00.000Z	liquidmeson	jeeva11	save the file somewere
2009-04-24T14:01:00.000Z	liquidmeson	jeeva11	and then try compiling it some were
