2012-07-16T07:23:00.000Z	RaverX3X		from the ubuntu homepage
2012-07-16T07:24:00.000Z	RaverX3X		its the same pen drive that i used to install it to my laptop
2012-07-16T07:24:00.000Z	RaverX3X		which is fine by the way been fine on that for months lol
2012-07-16T07:24:00.000Z	RaverX3X		i just got tired of windows on my pc
2012-07-16T07:26:00.000Z	RaverX3X		i installed ubuntu then after it installed it said i had to reboot at that point i removed the usb stick
2012-07-16T07:26:00.000Z	RaverX3X		then rebooted once it rebooted it just sits at the _ flashing
2012-07-16T07:27:00.000Z	RaverX3X		well it said to remove it lol
2012-07-16T07:27:00.000Z	RaverX3X		so i did
2012-07-16T07:27:00.000Z	RaverX3X		never had a issue with grub not being detected a t boot time
2012-07-16T07:28:00.000Z	RaverX3X		tell now
2012-07-16T07:29:00.000Z	Fyodorovna	RaverX3X	have you tried the usb and seen if it boots regular, could grub of been put on it?
2012-07-16T07:30:00.000Z	Fyodorovna	RaverX3X	so you can get to the installs desktop with the usb correct?
2012-07-16T07:31:00.000Z	Fyodorovna	RaverX3X	when you say OS whwt do you mean?
2012-07-16T07:32:00.000Z	Fyodorovna	RaverX3X	use the tab complete with user names here so we know who you are talking to. You can install grub to the mbr from the OS.
2012-07-16T07:36:00.000Z	Fyodorovna	RaverX3X	sudo grub-install /dev/sdX   X is the HD check it with sudo fdisk -l
2012-07-16T07:36:00.000Z	Fyodorovna	RaverX3X	then run sudo update-grub
2012-07-16T07:41:00.000Z	Fyodorovna	RaverX3X	can you pastebin sudo fdisk -lu    http://paste.ubuntu.com/
2012-07-16T07:44:00.000Z	Fyodorovna	RaverX3X	from a terminal on the OS sudo grub-install /dev/sde   then sudo update grub  Do you still get a no mbr with these.
2012-07-16T07:46:00.000Z	Fyodorovna	RaverX3X	sorry sudo update-grub  hehe you probably know that already.
