2009-03-28T05:21:00.000Z	FernandoF		hello
2009-03-28T05:21:00.000Z	FernandoF		I have a less than 10 seconds error session I can not solve with forums
2009-03-28T05:21:00.000Z	FernandoF		can someone help me please
2009-03-28T05:21:00.000Z	FernandoF		error log is http://paste.ubuntu.com/139278/
2009-03-28T05:22:00.000Z	yoshimit	FernandoF	are you using ldap for auth ?
2009-03-28T05:23:00.000Z	FernandoF	yoshimit	i am typing in a machine and trying to get back my main machine... but what was your point...sorry i am not that used with all this terms
2009-03-28T05:24:00.000Z	FernandoF	yoshimit	 I think for auth i am using .ICEauthority
2009-03-28T05:24:00.000Z	FernandoF	yoshimit	 could it be?
2009-03-28T05:24:00.000Z	yoshimit	FernandoF	well, by your log error is a different error that I got last night... so I started to google it... sorry
2009-03-28T05:25:00.000Z	yoshimit	FernandoF	https://bugs.launchpad.net/ubuntu/+bug/300028
2009-03-28T05:26:00.000Z	yoshimit	FernandoF	boa sorte!
2009-03-28T05:27:00.000Z	FernandoF	yoshimit	thx ... ihope i will not be back :)
2009-03-28T05:27:00.000Z	FernandoF	yoshimit	where r u from?
2009-03-28T05:28:00.000Z	yoshimit	FernandoF	DF
2009-03-28T05:29:00.000Z	yoshimit	FernandoF	this one seems to have a solution: https://bugs.launchpad.net/ubuntu/+source/kdebase-workspace/+bug/287488
2009-03-28T05:35:00.000Z	FernandoF	yoshimit	i can not see a suitable solution in the post you sent ...
2009-03-28T05:44:00.000Z	yoshimit	FernandoF	the post didnt help you ?
2009-03-28T05:44:00.000Z	yoshimit	FernandoF	too bad. sorry.
2009-03-28T05:45:00.000Z	FernandoF	yoshimit	No problem, appreciated anyway
