2008-11-13T02:00:00.000Z	matthew		I use it just because :D
2008-11-13T02:01:00.000Z	matthew		who likes 8.10 ?
2008-11-13T02:02:00.000Z	matthew		my gtk 2.x themes don't work in 8.10
2008-11-13T02:03:00.000Z	matthew		and I don't like ubuntu classic look
2008-11-13T02:03:00.000Z	matthew		spectral do sudo apt-get install startupmanager
2008-11-13T02:04:00.000Z	matthew		it will be under system > admin
2008-11-13T02:05:00.000Z	matthew		have to tried it locally
2008-11-13T02:05:00.000Z	matthew		on your lan
2008-11-13T02:07:00.000Z	matthew		wish I remembered the vnc program I used years back
2008-11-13T02:09:00.000Z	matthew		does vnc use tcp or udp ?
2008-11-13T02:09:00.000Z	joaopinto	matthew	tcp
2008-11-13T02:21:00.000Z	joaopinto	matthew	could you please move the off-topic chat to #ubuntu-offtopic ?
2008-11-13T02:22:00.000Z	matthew	joaopinto	will you ?
2008-11-14T01:06:00.000Z	joaopinto	matthew	I Already warned you in the past, for random chat please join #ubuntu-offtopic
2008-11-14T01:07:00.000Z	matthew	joaopinto	your don't scare me I help out here as much as you so bite me
2008-11-14T01:08:00.000Z	joaopinto	matthew	I am not trying to scare you, I am being respectful and asking you to stop doing random chat on the channel
2008-11-14T01:09:00.000Z	matthew	joaopinto	please don't waste my time and your time with random bs ok help people leave me alone
2008-11-15T03:33:00.000Z	joaopinto	matthew	not really, unless you are on the US
2008-11-15T03:34:00.000Z	matthew	joaopinto	it was a joke
