2008-02-13T10:34:00.000Z	Xabriel		I'm having trouble getting gutsy to update, or install anything. It finds new updates, but when I click install, all it does is search for updates  again and asks me if I want to install them.
2008-02-13T10:34:00.000Z	Xabriel		and when I try to install something, I get a random error
2008-02-13T10:35:00.000Z	badkitty	Xabriel	Is this from the GUI?
2008-02-13T10:35:00.000Z	Xabriel	badkitty	yes
2008-02-13T10:35:00.000Z	badkitty	Xabriel	Just for fun, try from the CLI
2008-02-13T10:35:00.000Z	Xabriel	badkitty	you'll probably have to walk me through it
2008-02-13T10:36:00.000Z	badkitty	Xabriel	No problem open a terminal
2008-02-13T10:36:00.000Z	Xabriel	badkitty	ok
2008-02-13T10:36:00.000Z	badkitty	Xabriel	ok now type this: sudo apt-get upgrade
2008-02-13T10:37:00.000Z	badkitty	Xabriel	what does it do?
2008-02-13T10:37:00.000Z	Xabriel	badkitty	hmm, it's saying "must be setuid root"
2008-02-13T10:37:00.000Z	Xabriel	badkitty	it used to ask for my password
2008-02-13T10:37:00.000Z	badkitty	Xabriel	hmm anyone know what that means?
2008-02-13T10:37:00.000Z	badkitty	Xabriel	you aren't running a root session are you
2008-02-13T10:38:00.000Z	Xabriel	badkitty	no
2008-02-13T10:38:00.000Z	badkitty	Xabriel	Hmm I dont know offhand what that means
2008-02-13T10:38:00.000Z	badkitty	Xabriel	Did yu try to reboot (windows fix lol)
2008-02-13T10:39:00.000Z	Xabriel	badkitty	lol yea
2008-02-13T10:39:00.000Z	badkitty	Xabriel	^^ what stroyan said, hes smarter than me
