2012-02-18T03:44:00.000Z	Uncle_Fester		i get sound in windows
2012-02-18T03:46:00.000Z	Uncle_Fester		yes there is only one
2012-02-18T03:46:00.000Z	ActionParsnip	Uncle_Fester	can you give the output of: wget -O alsa-info.sh http://www.alsa-project.org/alsa-info.sh && chmod +x ./alsa-info.sh && ./alsa-info.sh
2012-02-18T03:49:00.000Z	ActionParsnip	Uncle_Fester	sudo add-apt-repository ppa:ubuntu-audio-dev/ppa;  sudo apt-get update;sudo apt-get dist-upgrade; killall pulseaudio; rm -r ~/.pulse*
2012-02-18T03:50:00.000Z	ActionParsnip	Uncle_Fester	personally I wouldn't bother, Maverick is EOL in April, I'd install a later release like Oneiric and it may help
2012-02-18T03:52:00.000Z	ActionParsnip	Uncle_Fester	https://answers.launchpad.net/ubuntu/+source/alsa-driver/+question/149126
2012-02-18T03:53:00.000Z	ActionParsnip	Uncle_Fester	why, what's wrong with Natty?
2012-02-18T03:53:00.000Z	ActionParsnip	Uncle_Fester	after April you will get no updates and no support here
2012-02-18T03:56:00.000Z	ActionParsnip	Uncle_Fester	if you use xubuntu, it will look the same as Gnome2
2012-02-18T03:57:00.000Z	ActionParsnip	Uncle_Fester	latest is 11.10 but 12.04 is out in April and is LTS
2012-02-18T03:57:00.000Z	ActionParsnip	Uncle_Fester	the Unity desktop is default in Gnome based Ubuntu, you can use XFCE and your Gnome apps will run just fine
2012-02-18T03:58:00.000Z	ActionParsnip	Uncle_Fester	you can update, or clean install. An upgrade will keep the apps. The PPA I gave may fix your sound issue in the present install
2012-02-18T04:00:00.000Z	ActionParsnip	Uncle_Fester	I would, yes
2012-02-18T04:08:00.000Z	ActionParsnip	Uncle_Fester	the latest stable, yes
2012-02-18T04:08:00.000Z	ActionParsnip	Uncle_Fester	there is a KDE variant, an LXDE variant and an XFCE variant as well as The Gnome one....
2012-02-18T04:10:00.000Z	ActionParsnip	Uncle_Fester	looks like this: http://imag.malavida.com/mvimgbig/download/kubuntu-5920-1.jpg
2012-02-18T04:11:00.000Z	ActionParsnip	Uncle_Fester	xfce looks like this: http://linuxlibrary.org/wp-content/uploads/2012/01/xubuntu-11-10-3.jpg
2012-02-18T04:12:00.000Z	ActionParsnip	Uncle_Fester	the gnome desktop has the toolbars at the top...
2012-02-18T04:13:00.000Z	ActionParsnip	Uncle_Fester	you can if you want
