2009-01-09T15:38:00.000Z	jonaskoelker		:)
2009-01-09T15:38:00.000Z	jonaskoelker		windows sucks
2009-01-09T15:38:00.000Z	ActionParsnip	jonaskoelker	it has far better driver support than linux
2009-01-09T15:38:00.000Z	jonaskoelker	ActionParsnip	what, I have to base my opinion on _fact_? :O
2009-01-09T15:39:00.000Z	ActionParsnip	jonaskoelker	its all individual, i dont mind windows. I prefer BSD to linux personally
2009-01-09T15:39:00.000Z	ActionParsnip	jonaskoelker	its a tool for a job
2009-01-09T15:39:00.000Z	jonaskoelker	ActionParsnip	we found a fanboy! may we burn him?
2009-01-09T15:40:00.000Z	ActionParsnip	jonaskoelker	i'm far from it. I dont use 1 OS, I use many to achieve my goals. The statement "windows sucks" is less than meaningless
2009-01-09T15:41:00.000Z	ActionParsnip	jonaskoelker	I could rattle off a tonne of reasons why linux sucks and a good many why bsd sucks
2009-04-02T17:40:00.000Z	jonaskoelker	ActionParsnip	hey.  You suggested I used blkid to see my device UUIDs.  I did, they all match everything in /etc/fstab and /etc/crypttab.  Got any idea why my boot fails with "ALERT! /dev/disk/by-uuid/xxxxxxxx-xxxx-etc. not found"?
2009-04-02T17:41:00.000Z	ActionParsnip	jonaskoelker	you could resetup grub to make it use the right IDs
2009-04-02T17:42:00.000Z	jonaskoelker	ActionParsnip	how do I do that?
2009-04-02T17:42:00.000Z	ActionParsnip	jonaskoelker	read the factoid
2009-04-02T17:42:00.000Z	jonaskoelker	ActionParsnip	also, where does grub store UUIDs?
2009-04-02T17:42:00.000Z	ActionParsnip	jonaskoelker	in /etc/fstab. it may be a bug, are you using jaunty?
2009-04-02T17:43:00.000Z	jonaskoelker	ActionParsnip	yep
2009-04-02T17:43:00.000Z	ActionParsnip	jonaskoelker	then you know what factoid i'm gonna fire then dont you :0
2009-04-02T17:43:00.000Z	jonaskoelker	ActionParsnip	well, if /etc/fstab agrees with blkid, what would updating grub change?
2009-04-02T17:43:00.000Z	ActionParsnip	jonaskoelker	not sure, maybe jaunty does things differently. head into #ubuntu+1
