2007-12-26T08:01:00.000Z	mac_		"the folder contents could not be displayed, sorry couldn't display the contents of windows network:workgroup"
2007-12-26T08:01:00.000Z	mac_		its gives me above error msg
2007-12-26T08:02:00.000Z	mac_		they both are sharing a common wireless access point
2007-12-26T08:02:00.000Z	mac_		yep they do ping
2007-12-26T08:03:00.000Z	mac_		192.168.1.4
2007-12-26T08:04:00.000Z	mac_		ok, then
2007-12-26T08:05:00.000Z	mac_		yes added
2007-12-26T08:06:00.000Z	mac_		i dont know the workgroup of my windows laptop, there is no work group
2007-12-26T08:08:00.000Z	mac_		its my office laptop, the domian is something like corp.xyz.net
2007-12-26T08:09:00.000Z	mac_		there is no wins server running on it
2007-12-26T08:11:00.000Z	juano_1	mac_	sorry i got d/c
2007-12-26T08:11:00.000Z	juano_1	mac_	could you connect as i told you last message ?
2007-12-26T08:12:00.000Z	juano_1	mac_	ok, can you try this:  go to places ---> connect to server... then select windows share , then in server type in your windows laptop pcname
2007-12-26T08:14:00.000Z	juano_1	mac_	?
2007-12-26T08:21:00.000Z	juano_1	mac_	so you can connect to your windows pc with no errors?
2007-12-26T08:22:00.000Z	juano_1	mac_	emm, ok, waitain suggested earlier another thing , do this:  alt + f2 , then type smb://<windowsip> and hit enter
2007-12-26T08:38:00.000Z	juano_1	mac_	yes
2007-12-26T08:43:00.000Z	juano_1	mac_	that was for wilo_
2007-12-26T08:43:00.000Z	juano_1	mac_	messages for you say "mac_" at the beggining
