2007-05-22T08:33:00.000Z	Fivetwentysix		Sorry did anyone know why my screen went black after installing KDE?
2007-05-22T08:34:00.000Z	Fivetwentysix		I already installed my video drivers
2007-05-22T08:34:00.000Z	Fivetwentysix		It works on gnome
2007-05-22T08:35:00.000Z	Fivetwentysix		But it doesn't load my video settings in KDE
2007-05-22T08:35:00.000Z	Fivetwentysix		and spx2 you should be promoting Ubuntu not depromoting it :-P
2007-05-22T08:36:00.000Z	Fivetwentysix		OK well any link to get me started?
2007-05-22T08:37:00.000Z	Fivetwentysix		I like Ubunty
2007-05-22T08:37:00.000Z	Fivetwentysix		ubuntu
2007-05-22T08:37:00.000Z	dabaR	Fivetwentysix	what is your support question again? Sorry I just got here.
2007-05-22T08:40:00.000Z	Fivetwentysix	dabaR	you see my problem?
2007-05-22T08:41:00.000Z	dabaR	Fivetwentysix	is it black even in the console(alt-ctrl-f1)
2007-05-22T08:48:00.000Z	dabaR	Fivetwentysix	try sudo dpkg --reconfigure gdm. then sudo invoke-rc.d gdm restart
2007-05-22T08:50:00.000Z	dabaR	Fivetwentysix	try sudo dpkg --reconfigure gdm. then sudo invoke-rc.d gdm restart
2007-05-22T08:52:00.000Z	dabaR	Fivetwentysix	one moment, please.
2007-05-22T08:56:00.000Z	dabaR	Fivetwentysix	look for the kubuntu-desktop package.
2007-05-22T09:00:00.000Z	dabaR	Fivetwentysix	so logging into gnome works fine?
2007-05-22T09:00:00.000Z	Fivetwentysix	dabaR	yes
2007-05-22T09:00:00.000Z	Fivetwentysix	dabaR	I'm going to try loading kde up again brb.
2007-05-22T09:01:00.000Z	dabaR	Fivetwentysix	how about installing xnest, then running gdmflexiserver --xnest, and trying to log into KDE?
