2008-06-27T01:54:00.000Z	WhoNeedszzz		What's the apt line for canonical on hardy?
2008-06-27T01:54:00.000Z	WhoNeedszzz		a repo
2008-06-27T01:55:00.000Z	Jack_Sparrow	WhoNeedszzz	would it not be deb http://archive.canonical.com/ubuntu hardy partner
2008-06-27T01:55:00.000Z	WhoNeedszzz	Jack_Sparrow	I tried that, it isn't working
2008-06-27T01:55:00.000Z	Jack_Sparrow	WhoNeedszzz	did you sudo apt-get update after you made the change
2008-06-27T01:56:00.000Z	WhoNeedszzz	Jack_Sparrow	sure did
2008-06-27T01:57:00.000Z	Jack_Sparrow	WhoNeedszzz	no idea why it wouldnt work
2008-06-27T01:59:00.000Z	Jack_Sparrow	WhoNeedszzz	Try               deb http://archive.canonical.com/ubuntu/dists/ hardy partner
2008-06-27T02:00:00.000Z	WhoNeedszzz	Jack_Sparrow	Failed to fetch http://archive.canonical.com/ubuntu/dists/dists/hardy/partner/binary-i386/Packages.gz  404 Not Found
2008-06-27T02:02:00.000Z	Jack_Sparrow	WhoNeedszzz	Try               deb http://archive.canonical.com/ubuntu/ hardy partner  has to be right.. no idea why it isnt working for you
2008-06-27T02:02:00.000Z	WhoNeedszzz	Jack_Sparrow	i did that one and it doesn't give an error but none of the packages in the repo appear in synaptic
2008-06-27T02:06:00.000Z	WhoNeedszzz	Jack_Sparrow	oh! vmware-server isn't in the hardy repo of canonical yet
2008-06-27T02:06:00.000Z	WhoNeedszzz	Jack_Sparrow	ok so it did work, thanks
2008-06-27T02:07:00.000Z	Jack_Sparrow	WhoNeedszzz	np
2008-06-28T22:34:00.000Z	Jack_Sparrow	WhoNeedszzz	Please hold down on the repeats
2008-06-28T22:34:00.000Z	Jack_Sparrow	WhoNeedszzz	Try a little patience.
2008-06-28T22:35:00.000Z	Jack_Sparrow	WhoNeedszzz	being rude wont help either
2008-06-28T22:36:00.000Z	Jack_Sparrow	WhoNeedszzz	you are free to sign up for paid tech support
2008-09-22T03:57:00.000Z	Jack_Sparrow	WhoNeedszzz	offtopic  and patience
