2007-02-20T10:47:00.000Z	Logicbox		HELP: sudo apt-get update will not work
2007-02-20T10:48:00.000Z	Logicbox		Error reading from server - read (104 Connection reset by peer)
2007-02-20T10:48:00.000Z	Logicbox		on all the http:// sites
2007-02-20T10:48:00.000Z	Logicbox		REALLY
2007-02-20T10:48:00.000Z	Logicbox		i know that but why
2007-02-20T10:48:00.000Z	Logicbox		i have access
2007-02-20T10:49:00.000Z	Logicbox		sorry but this is really frustrating
2007-02-20T10:49:00.000Z	Logicbox		cause i been at this for 2 hours now
2007-02-20T10:50:00.000Z	Logicbox		fine
2007-02-20T10:50:00.000Z	jrib	Logicbox	pastebin the full error, maybe someone can help
2007-02-20T10:53:00.000Z	jrib	Logicbox	the whole thing there please, then just give us a link
2007-02-20T10:53:00.000Z	Logicbox	jrib	what
2007-02-20T10:54:00.000Z	jrib	Logicbox	did you read what ubotu said about pastebin?
2007-02-20T10:54:00.000Z	Logicbox	jrib	i dont know what that pastbin is
2007-02-20T10:54:00.000Z	jrib	Logicbox	visit http://paste.ubuntu-nl.org and copy and paste the full error output there.  Then give us a link
2007-02-20T10:59:00.000Z	Logicbox	jrib	did i need to dl the text file i pasted it all in to http://paste.ubuntu-nl.org
2007-02-20T11:00:00.000Z	jrib	Logicbox	nope, just give us the URL
2007-02-20T11:02:00.000Z	Logicbox	jrib	u see anything?
2007-02-20T11:02:00.000Z	jrib	Logicbox	join me in #ubuntu-classroom please?
