2006-12-19T08:11:00.000Z	Trixsey		Ever since I got XGL running on my machine, the display driver falls back to MESA even though I have the latest prop. driver (ATI 8.32)
2006-12-19T08:11:00.000Z	Trixsey		you guys have any ideas?
2006-12-19T08:12:00.000Z	Trixsey		Wait.. everyone tells me different things.. can someone please tell me what to use to get beryl working?
2006-12-19T08:12:00.000Z	Trixsey		NOTHING seems to work for me :(
2006-12-19T08:12:00.000Z	Trixsey		I tried AIGLX+fglrx = didnt work
2006-12-19T08:12:00.000Z	[3B	Trixsey	 let me give you a FAQ that worked fine for me
2006-12-19T08:13:00.000Z	Trixsey	[3B	you use xgl+fglrx?
2006-12-19T08:14:00.000Z	Trixsey	[3B	working stable?
2006-12-19T08:16:00.000Z	[3B	Trixsey	 i got ATI Raedon X1600PRO
2006-12-19T08:28:00.000Z	[3B	Trixsey	read pm
2006-12-19T08:30:00.000Z	[3B	Trixsey	 u there????
2006-12-19T08:31:00.000Z	Trixsey	[3B	why dont you answer in PM? :(
2006-12-19T08:32:00.000Z	[3B	Trixsey	 i have answered ya :S
2006-12-19T08:34:00.000Z	Trixsey	[3B	my xorg.conf looks strange
2006-12-19T08:36:00.000Z	[3B	Trixsey	 gimme ur msn in pm and ill add you
2006-12-19T08:39:00.000Z	[3B	Trixsey	 i have added ya, i dont see you online
2006-12-19T08:42:00.000Z	[3B	Trixsey	 add me again
2006-12-19T08:43:00.000Z	[3B	Trixsey	 ill be online in 1 minuto
2006-12-19T08:47:00.000Z	[3B	Trixsey	 mty fucking msn is fucked up, sorry for this long wait
