2006-10-30T09:20:00.000Z	Tim90		i cant find the link to launch limewire
2006-10-30T09:21:00.000Z	Tim90		its not
2006-10-30T09:21:00.000Z	Tim90		what you mean file ?
2006-10-30T09:22:00.000Z	Tim90		cd /home/timo900/Desktop/limewire
2006-10-30T09:22:00.000Z	Tim90		pradeep:cd /home/timo900/Desktop/limewire
2006-10-30T09:23:00.000Z	Tim90		that easy huh ?
2006-10-30T09:23:00.000Z	Tim90		timo900@timo900-desktop:~$ LimeWire
2006-10-30T09:23:00.000Z	Tim90		bash: LimeWire: command not found
2006-10-30T09:24:00.000Z	thandavarayan	Tim90	Do you set the path to the binary or
2006-10-30T09:26:00.000Z	thandavarayan	Tim90	Is limewire *.deb or ....
2006-10-30T09:29:00.000Z	thandavarayan	Tim90	regarding....
2006-10-30T09:30:00.000Z	thandavarayan	Tim90	you installed limewire from a installer...if so then it will installed in a directory which you specify during installation
2006-10-30T09:31:00.000Z	Tim90	thandavarayan	it didnt ask me for a directory
2006-10-30T09:31:00.000Z	thandavarayan	Tim90	you need to add that path to $PATH in your .profile or in .bashrc
2006-10-30T09:31:00.000Z	thandavarayan	Tim90	do you install as a root or
2006-10-30T09:32:00.000Z	thandavarayan	Tim90	If so, do you see any folder in your home directory
2006-10-30T09:34:00.000Z	Tim90	thandavarayan	i can see the shear folder and the Incomplete (all limewire download folders)
2006-10-30T09:34:00.000Z	thandavarayan	Tim90	Did you extract the packge or
2006-10-30T09:35:00.000Z	thandavarayan	Tim90	Does it create any directory after extraction
