2008-12-11T05:02:00.000Z	Wicked		after having firefox open for a day or so...flash geeks out and skips or wont play
2008-12-11T05:03:00.000Z	Wicked		i have flash
2008-12-11T05:03:00.000Z	Paddy_EIRE	Wicked	which version of flash are you using?
2008-12-11T05:03:00.000Z	Paddy_EIRE	Wicked	dont
2008-12-11T05:04:00.000Z	Paddy_EIRE	Wicked	that installs a lot of other cruft to
2008-12-11T05:08:00.000Z	Paddy_EIRE	Wicked	If you open "System > Administration > Software Sources" and look in the "Third-Party Software" and see if the "Partner Repository" is ticked/enabled.
2008-12-11T05:09:00.000Z	Wicked	Paddy_EIRE	no its not
2008-12-11T05:10:00.000Z	Wicked	Paddy_EIRE	do i want these enabled? or should i leave them disabled?
2008-12-11T05:10:00.000Z	Paddy_EIRE	Wicked	yes
2008-12-11T05:12:00.000Z	Paddy_EIRE	Wicked	ok open a terminal "Applications > Accessories > Terminal" and type "sudo apt-get install adobe-flashplugin" without the quotes of course.. or just copy paste and answer Yes to any questions
2008-12-11T05:13:00.000Z	Paddy_EIRE	Wicked	Got that?
2008-12-11T05:13:00.000Z	Wicked	Paddy_EIRE	ok doing now. thanks =)
2008-12-11T05:15:00.000Z	Wicked	Paddy_EIRE	well it usally takes a day or two of ff being open for it to mess up.....i hope this fixes this. thanks again
2008-12-11T05:21:00.000Z	Paddy_EIRE	Wicked	how are things going?
2008-12-11T05:22:00.000Z	Wicked	Paddy_EIRE	seem to be working fine
2008-12-11T05:22:00.000Z	Paddy_EIRE	Wicked	excellent.. I have had no problems with it myself
2008-12-11T05:22:00.000Z	Wicked	Paddy_EIRE	ah good. flash and linux have always been a struggle for me
2008-12-11T05:23:00.000Z	Paddy_EIRE	Wicked	its getting much much better
2008-12-11T05:23:00.000Z	Paddy_EIRE	Wicked	that is the latest release
