2006-09-15T10:34:00.000Z	Karmst		jack how do i edit the firewall from the command line?
2006-09-15T10:36:00.000Z	Karmst		How do I open up port 80 on my Ubuntu Server?
2006-09-15T10:36:00.000Z	fyrestrtr	Karmst	install something that listens on it, like apache
2006-09-15T10:37:00.000Z	Karmst	fyrestrtr	I think the firewall is preventing me from getting updates
2006-09-15T10:37:00.000Z	fyrestrtr	Karmst	not likely.
2006-09-15T10:37:00.000Z	Karmst		what could it be then?
2006-09-15T10:37:00.000Z	fyrestrtr		how is it preventing you?
2006-09-15T10:38:00.000Z	Karmst		well when I run "apt-get updates" it goes through a whole list of ERR
2006-09-15T10:38:00.000Z	Karmst		I've changed the repo's now 12 times!
2006-09-15T10:38:00.000Z	fyrestrtr		can you browse the web?
2006-09-15T10:38:00.000Z	Karmst		I can ping google
2006-09-15T10:38:00.000Z	fyrestrtr		!grub > LeoStewart
2006-09-15T10:39:00.000Z	fyrestrtr	Karmst	can you browse it?
2006-09-15T10:39:00.000Z	Karmst		I don't have a GUI
2006-09-15T10:39:00.000Z	fyrestrtr	Karmst	telnet google.com 80
2006-09-15T10:39:00.000Z	fyrestrtr		what do you get?
2006-09-15T10:40:00.000Z	Karmst		connected to
2006-09-15T10:40:00.000Z	Karmst		it connects
2006-09-15T10:40:00.000Z	fyrestrtr	Karmst	then the problem is not with a firewall.
