2007-03-21T09:20:00.000Z	erfdain		Hey there.  Can anyone help me with Firefox help?  I can get movies or flash movies to play.
2007-03-21T09:20:00.000Z	erfdain		can = can't
2007-03-21T09:21:00.000Z	erfdain		Can anyone help me with Firefox
2007-03-21T09:21:00.000Z	erfdain		Please?
2007-03-21T09:23:00.000Z	erfdain		:cheers his ATI READON X700 PRO on sucking power
2007-03-21T09:23:00.000Z	erfdain		can anyone PLEASE HELP WITH FIREFOX setup?
2007-03-21T09:24:00.000Z	erfdain		What you say willberfan?  JK
2007-03-21T09:24:00.000Z	erfdain		OKAY EVERYONE Jesus was black, 911 was a cover up and Reagan was black
2007-03-21T09:25:00.000Z	erfdain		do de do de do
2007-03-21T09:26:00.000Z	erfdain		I NEED HELP
2007-03-21T09:26:00.000Z	poningru	erfdain	ask your question
2007-03-21T09:27:00.000Z	poningru	erfdain	how did you setup gstreamer?
2007-03-21T09:27:00.000Z	poningru	erfdain	how did you install it?
2007-03-21T09:28:00.000Z	poningru	erfdain	download manager?
2007-03-21T09:28:00.000Z	poningru	erfdain	which package did you install?
2007-03-21T09:29:00.000Z	poningru	erfdain	what app are you trying to use to play the vids?
2007-03-21T09:30:00.000Z	poningru	erfdain	swf will not work either
2007-03-21T09:30:00.000Z	poningru	erfdain	avi should have worked
2007-03-21T09:30:00.000Z	poningru	erfdain	you can watch wmv9 movies
2007-03-21T09:30:00.000Z	poningru	erfdain	you can watch wmv10 in vlc
2007-03-21T09:31:00.000Z	poningru	erfdain	for swf you need the flash plugin and watch it in firefox
