2009-07-12T10:24:00.000Z	ricardo_		i dont understand a thing in my grub
2009-07-12T10:25:00.000Z	ricardo_		# on /dev/sda1
2009-07-12T10:25:00.000Z	ricardo_		title  Microsoft Windows XP Professional
2009-07-12T10:25:00.000Z	ricardo_		rootnoverify (hd0,0)
2009-07-12T10:25:00.000Z	ricardo_		savedefault
2009-07-12T10:25:00.000Z	ricardo_		chainloader +1
2009-07-12T10:25:00.000Z	ricardo_		oh, ok sorry for flooding
2009-07-12T10:25:00.000Z	ricardo_		i dont understand, why it says sda1 and hd0,0
2009-07-12T10:25:00.000Z	ricardo_		i though that hd0,0 is sda0
2009-07-12T10:26:00.000Z	lf4	ricardo_	there is no sda0
2009-07-12T10:36:00.000Z	lf4	ricardo_	what is your issue with grub?
2009-07-12T10:37:00.000Z	ricardo_	lf4	i cannot enter to windows, i get starting up... and  sounds a beep
2009-07-12T10:38:00.000Z	lf4	ricardo_	mind showing your menu.lst file?
2009-07-12T10:38:00.000Z	ricardo_	lf4	i pasted it a few minutes ago here
2009-07-12T10:38:00.000Z	lf4	ricardo_	alright checking for it...
2009-07-12T10:41:00.000Z	lf4	ricardo_	that is all your menu.lst has? lol how did you boot to linux?
2009-07-12T10:41:00.000Z	ricardo_	lf4	is only the windows part
2009-07-12T10:42:00.000Z	lf4	ricardo_	yeah it sounds like part of the partition got corrupted.
2009-07-12T10:42:00.000Z	lf4	ricardo_	its rare but can happen.
2009-07-12T10:48:00.000Z	lf4	ricardo_	Is this a fresh install of ubuntu?
2009-07-12T10:50:00.000Z	lf4	ricardo_	you might just have to recover the partition with a windows cd.
