2009-02-04T22:32:00.000Z	KenBW2		i want to get my TV card working with Ubuntu, but don't know where to start. Can anyone help?
2009-02-04T22:33:00.000Z	jim_p	KenBW2	by identifying it perhaps...          pastebin the output of lspci
2009-02-04T22:34:00.000Z	KenBW2	jim_p	miha: http://www.nomorepasting.com/getpaste.php?pasteid=24032
2009-02-04T22:35:00.000Z	jim_p	KenBW2	give me a sec to google
2009-02-04T22:36:00.000Z	KenBW2	jim_p	jami: on Windows i founbd out it was AverMedia DVB-T 771
2009-02-04T22:37:00.000Z	jim_p	KenBW2	doesnt the bttv module work for it?                sudo modprobe bttv                      and open a video capture app live tvtime to check
2009-02-04T22:37:00.000Z	KenBW2	jim_p	sudo modprobe bttv outputs nothing#
2009-02-04T22:38:00.000Z	jim_p	KenBW2	good!
2009-02-04T22:38:00.000Z	jim_p	KenBW2	open a video capture app like tvtime and check
2009-02-04T22:39:00.000Z	KenBW2	jim_p	jami: how will i know if it's working?
2009-02-04T22:40:00.000Z	jim_p	KenBW2	with some video capturing app like tvtime!!!
2009-02-04T22:40:00.000Z	KenBW2	jim_p	i have it open
2009-02-04T22:40:00.000Z	jim_p	KenBW2	doesnt it have options? i never had a tvcard on my pc to tell you how each app works
2009-02-04T22:41:00.000Z	KenBW2	jim_p	does tvtime have DVB?
2009-02-04T22:41:00.000Z	jim_p	KenBW2	i dont know
2009-02-04T22:42:00.000Z	KenBW2	jim_p	it's scanning the channels but picking nothing up
2009-02-04T22:42:00.000Z	jim_p	KenBW2	is it connected to some antenna?
2009-02-04T22:42:00.000Z	KenBW2	jim_p	yea
2009-02-04T22:43:00.000Z	jim_p	KenBW2	then i cant help more
2009-02-04T22:45:00.000Z	KenBW2	jim_p	thanks anyway
2009-02-04T22:45:00.000Z	jim_p	KenBW2	you are welcome
