2007-09-21T10:50:00.000Z	gttyz		Hmm, im gonna test this os on some servers
2007-09-21T10:51:00.000Z	gttyz		Hmm, theres no "Gubuntu" ?
2007-09-21T10:52:00.000Z	gttyz		We feel that KDE except K3b is very much inferior to GNOME
2007-09-21T10:52:00.000Z	gttyz		GW on k3b btw!
2007-09-21T10:52:00.000Z	gttyz		What image do i DL if i want the latest gnome ?
2007-09-21T10:54:00.000Z	Pici	gttyz	Gnome 2.20 will be in gutsy, but no packages for feisty.
2007-09-21T10:54:00.000Z	gttyz	Pici	which one of Gutsy or Feisty the latest release ?
2007-09-21T10:55:00.000Z	Pici	gttyz	Gutsy has the latest, but Gutsy is not yet released.
2007-09-21T10:56:00.000Z	gttyz	Pici	Appreciate it, thanks!
2007-09-21T10:57:00.000Z	gttyz	Pici	We have some Debian, Slack, Fedora, RH, etc running but i want Ubuntu too
2007-09-21T10:58:00.000Z	gttyz	Pici	Can you paste an url to the lastest  of ubuntu for me ?
2007-09-21T10:59:00.000Z	Pici	gttyz	Latest stable? http://www.ubuntu.com/download
2007-09-21T10:59:00.000Z	gttyz	Pici	No, id like the latest beta/unstable if i may
2007-09-21T11:00:00.000Z	gttyz	Pici	My apps are in all of the dists including *bsd so i wish to test them all if i can
2007-09-21T11:01:00.000Z	Pici	gttyz	http://cdimage.ubuntu.com/daily-live/current/
2007-09-21T11:02:00.000Z	Pici	gttyz	If it doesnt work, go up to the root dir and find the release/alternate cd.
2007-09-21T11:02:00.000Z	gttyz	Pici	Thanks Irken, ill run a few copies and help where i can.
2007-09-21T11:02:00.000Z	Pici	gttyz	Help/support/etc for that version ios in #ubuntu+1
2007-09-21T11:03:00.000Z	gttyz	Pici	I also build my own systems from scratch for fun and pun so i wont need it but thanks anyway!
2007-09-21T11:03:00.000Z	Pici	gttyz	I know, but if you want to discuss bugs or whatnot, thats the place to go.
2007-09-21T11:04:00.000Z	gttyz	Pici	Thanks, will do
