2007-04-26T06:55:00.000Z	py_geek		how can i get rid of the kde files in ubuntu?
2007-04-26T06:56:00.000Z	py_geek		kde programs*
2007-04-26T06:57:00.000Z	py_geek		how can i remove files from the ubuntu menu on the top?
2007-04-26T06:57:00.000Z	jrib	py_geek	right click on the ubuntu icon > edit menus
2007-05-12T08:48:00.000Z	jrib	py_geek	bugs.ubuntu.com get to work :)
2007-05-28T15:44:00.000Z	jrib	py_geek	system -> preferences -> hardware information  as well
2007-05-30T05:53:00.000Z	jrib	py_geek	what doesn't work exactly?
2007-05-30T05:54:00.000Z	py_geek	jrib	when I try to play runescape (a MASSIVE java game) it says i need to install plugins but java is already installed and enabled... supposedly...
2007-05-30T05:55:00.000Z	jrib	py_geek	visit http://www.java.com/en/download/installed.jsp  and click on "verify installation".  Does it work?
2007-05-30T05:56:00.000Z	py_geek	jrib	no, it dosent...
2007-05-30T05:56:00.000Z	jrib	py_geek	what version of ubuntu?
2007-05-30T05:57:00.000Z	py_geek	jrib	feisty
2007-05-30T05:57:00.000Z	jrib	py_geek	what does this command return for the "Installed" line: apt-cache policy sun-java6-plugin
2007-05-30T05:58:00.000Z	py_geek	jrib	W: Unable to locate package sun-java6-plugin
2007-05-30T05:58:00.000Z	jrib	py_geek	what architecture are you using?
2007-05-30T05:58:00.000Z	py_geek	jrib	x86
2007-05-30T05:59:00.000Z	jrib	py_geek	you need to enable multiverse
2007-05-30T06:07:00.000Z	py_geek	jrib	i did not see what you wanted me to do... when i tried what jordan u said, to do some sudo stuff... well it didnt work.
2007-05-30T06:07:00.000Z	jrib	py_geek	did you manage to enable multiverse?
2007-05-30T06:07:00.000Z	jrib	py_geek	did you receive a private message from ubotu with instructions?
2007-05-30T06:18:00.000Z	jrib	py_geek	after you enable multiverse, you want to install the "sun-java6-plugin" package
