2007-02-18T16:15:00.000Z	daum		does ubuntu not come with ssh installed?
2007-02-18T16:15:00.000Z	ompaul	daum	not the sever
2007-02-18T16:15:00.000Z	ompaul	daum	simple command line, sudo apt-get install openssh-server
2007-02-18T16:16:00.000Z	daum	ompaul	thanks, trying to help my friend remotely install an ubuntu, and i'm a gentoo person-p
2007-02-18T16:18:00.000Z	ompaul	daum	using synaptic by any chance?
2007-02-18T16:18:00.000Z	daum	ompaul	yeah he was...just close it i take it?
2007-02-18T16:19:00.000Z	ompaul	daum	you can only use one install tool
2007-02-18T16:19:00.000Z	daum	ompaul	alright.
2007-02-18T16:19:00.000Z	ompaul	daum	so choose command line or tools
2007-02-18T16:22:00.000Z	daum	ompaul	apt-get install ssh-server installed it too right?
2007-02-18T16:22:00.000Z	ompaul	daum	no   >>>>> sodo apt-get install openssh-server <<<<<
2007-02-18T16:23:00.000Z	daum	ompaul	aye well he was already sudo'd
2007-02-18T16:23:00.000Z	daum	ompaul	shouldn't it be sudo apt-get install openssh-server ?
2007-02-18T16:23:00.000Z	ompaul	daum	I'll just say this - better to issue sudo prior to commands
2007-02-18T16:23:00.000Z	ompaul	daum	you win
2007-02-18T16:24:00.000Z	daum	ompaul	ubuntu you start it via /etc/init.d/sshd start?
2007-02-18T16:24:00.000Z	ompaul	daum	it starts on install
2007-02-18T16:24:00.000Z	daum	ompaul	thanks
2007-02-18T16:24:00.000Z	ompaul	daum	debian idea - if you install it the o/s wants you to use it
2007-02-18T16:24:00.000Z	daum	ompaul	never used debian, been a gentoo boy for my entire life basically
2007-02-18T16:26:00.000Z	ompaul	daum	use wiki.ubuntu.com and help.ubuntu.com and the first search is for "repos" have fun
