2006-12-31T17:27:00.000Z	sekondchakra		anyone know if there's a "moblock" channel somewhere?
2006-12-31T15:52:00.000Z	sekondchakra		what's the secret to getting Amarok to play audio CDs?
2006-12-31T15:53:00.000Z	sekondchakra		I've configured the device(s), and I can connect...but nothing displays
2006-12-31T15:54:00.000Z	sekondchakra		I can play CDs with other progs...
2006-12-31T15:54:00.000Z	sekondchakra		why not Amarok??
2006-12-31T15:54:00.000Z	cc77	sekondchakra	what happens when you try it with amarok?
2006-12-31T15:54:00.000Z	sekondchakra		It does everything else really well...even plays stuff off the ipod...
2006-12-31T15:55:00.000Z	sekondchakra	cc77	I see nothing in that leftmost window...  ie nothing on the CD is displayed
2006-12-31T15:55:00.000Z	sekondchakra		it even says "device successfuly connected... but nothing displays
2006-12-31T15:56:00.000Z	cc77	sekondchakra	it happens with all cd's?
2006-12-31T15:56:00.000Z	sekondchakra		hmmm...ok...  let me try a different one...
2006-12-31T15:57:00.000Z	sekondchakra		"Device successfully connected", but nuthin'...
2006-12-31T15:57:00.000Z	cc77		It only happens with amorok? sekondchakra?
2006-12-31T15:57:00.000Z	sekondchakra		yeah...so far...
2006-12-31T15:58:00.000Z	sekondchakra		I was able to access via Audacious...
2006-12-31T15:59:00.000Z	sekondchakra		Rhythmbox instantly recognized the CD...
2006-12-31T15:59:00.000Z	cc77		but the music plays when you hit the play button. sekondchakra?
2006-12-31T15:59:00.000Z	sekondchakra	cc77	no...not in Amarok
2006-12-31T15:59:00.000Z	sekondchakra	cc77	it plays in the others....
2006-12-31T16:00:00.000Z	cc77	sekondchakra	check the sound server/mixer in amarok and the internet music database.
2006-12-31T16:01:00.000Z	sekondchakra	cc77	  keep in mind that Amarok will play OTHER files...I just can't get it to see an audio CD...
