2006-09-02T13:27:00.000Z	raster		most curious
2006-09-02T13:28:00.000Z	raster		edgey uses a live cd boot to install
2006-09-02T13:28:00.000Z	raster		most curious
2006-09-02T13:30:00.000Z	raster		and frankly
2006-09-02T13:30:00.000Z	raster		burning that much to media
2006-09-02T13:30:00.000Z	raster		means the media is signficiantly out of date by the time you ever use a package
2006-09-02T13:30:00.000Z	raster		so downloading them from a repository is much saner
2006-09-02T13:30:00.000Z	raster		:)
2006-09-02T13:31:00.000Z	brendonjt	raster	agree  downloading iso's that big  is painfull
2006-09-02T13:35:00.000Z	raster	brendonjt	well its not that bad - takes a few minutes. it just is a waste of media.
2006-09-02T13:35:00.000Z	raster	brendonjt	well its not painful when your dsl is 100mbit. :)
2006-09-02T13:36:00.000Z	brendonjt	raster	new Zealand is still at adsl 7mbit  that is the fatest
2006-09-02T13:36:00.000Z	raster	brendonjt	and u have download limits - right?
2006-09-02T13:37:00.000Z	brendonjt	raster	yip once we reach our caps  we are droped back to dialup speeds
2006-09-02T13:39:00.000Z	raster	brendonjt	ouchies!
2006-09-02T13:39:00.000Z	raster	brendonjt	i knew there was a reason i left .au :)
2006-09-02T13:39:00.000Z	brendonjt	raster	hehe  i'm .nz
2006-09-02T13:40:00.000Z	raster	brendonjt	i know - but .nz is just .au's seventh state :) hehehehe
2006-09-02T13:40:00.000Z	brendonjt	raster	our  telecom offer there lowest price is 1gb for $39.95 NZD
2006-09-02T13:40:00.000Z	raster	brendonjt	but seriously - nz'd intenret scene is not dissimilar to .au's
2006-09-02T13:43:00.000Z	brendonjt	raster	 bugga ae grrr bloody nz telecom
