2005-10-08T13:03:00.000Z	vengeful		erm
2005-10-08T13:03:00.000Z	vengeful		search for fluxbox
2005-10-08T13:03:00.000Z	vengeful		click it
2005-10-08T13:03:00.000Z	vengeful		apply marked changes
2005-10-08T13:03:00.000Z	vengeful		and done
2005-10-08T13:04:00.000Z	vengeful		you might need to with flixbox actually
2005-10-08T13:04:00.000Z	vengeful		flux*
2005-10-08T13:04:00.000Z	vengeful		if you fancy a change xfce4 works well in ubuntu
2005-10-08T13:06:00.000Z	vengeful		try xfce , gdorn
2005-10-08T13:06:00.000Z	vengeful		i cant decide which to use actually...gnome or xfce
2005-10-08T13:06:00.000Z	nalioth	vengeful	why not enlightenment?
2005-10-08T13:07:00.000Z	vengeful	nalioth	i used to use it in mdnrake
2005-10-08T13:09:00.000Z	nalioth	vengeful	e17 will change your opinion
2005-10-16T13:23:00.000Z	nalioth	vengeful	that will change
2005-10-16T13:29:00.000Z	vengeful	nalioth	any idea with this? http://pastebin.com/389883    trying to help a friend with debian problems
2005-10-16T13:30:00.000Z	nalioth	vengeful	what are y'all tryin to do?
2005-10-16T13:31:00.000Z	nalioth	vengeful	is the system still up?
2005-10-16T13:32:00.000Z	nalioth	vengeful	if you can't write to the HD, the system will fail shortly
2005-10-16T13:52:00.000Z	nalioth	vengeful	did you get that box sorted?
2005-10-18T13:37:00.000Z	vengeful	nalioth	kick pder in the head will you
2005-10-18T13:39:00.000Z	nalioth	vengeful	one line of opinion is not a bad thing, but repetitive offtopic yakking is
