2005-09-10T06:20:00.000Z	sml12		I have a file that is in use and locked. what is the command to check the app using the file?
2005-09-10T06:20:00.000Z	aftertaf	sml12	 what is the file?
2005-09-10T06:21:00.000Z	sml12	aftertaf	my usual apt problem again ... /var/cache/debconf/config.dat :(
2005-09-10T06:23:00.000Z	aftertaf	sml12	 maybe
2005-09-10T06:24:00.000Z	sml12	aftertaf	i had this problem and couldn't work it out :(  i will try killing that one
2005-09-10T06:26:00.000Z	aftertaf	sml12	 try dpkg-reconfigure debconf, after a reboot...
2005-09-10T06:27:00.000Z	sml12	aftertaf	ok thanks. will try it and be back.
2005-09-10T06:31:00.000Z	sml12	aftertaf	tried that dpkg-reconfigure debconf and the 'file is locked' :(
2005-09-10T06:44:00.000Z	aftertaf	sml12	 hmmm. what is the exact error message?
2005-09-10T06:47:00.000Z	sml12	aftertaf	debconf: DbDriver "config": /var/cache/debconf/config.dat is locked by another process
2005-09-10T06:52:00.000Z	aftertaf	sml12	 does lsof give you anything?
2005-09-10T06:54:00.000Z	sml12	aftertaf	yes ... frontend 6944 root    4rW  REG    8,1 65404 4423896 /var/cache/debconf/config.dat
2005-09-10T06:55:00.000Z	sml12	aftertaf	the frontend app cannot seem to be killed
2005-09-10T06:56:00.000Z	aftertaf	sml12	 if you reinit to level 1, can you rename the .dat file??
2005-09-10T06:59:00.000Z	sml12	aftertaf	hhmm not sure exactly what you mean. hmm might work on this tomorrow! chat later
2005-09-11T05:42:00.000Z	aftertaf	sml12	 you are on breezy?
2005-09-11T05:42:00.000Z	sml12	aftertaf	hi again! :)   still a problem !!
2005-09-11T05:42:00.000Z	sml12	aftertaf	yes
2005-09-11T05:43:00.000Z	sml12	aftertaf	it was a build from a week or two ago - now trying to update to the latest files
2005-09-11T05:43:00.000Z	sml12	aftertaf	just burnt my copy of kubuntu daily iso ... about to bail on ubuntu :)  one last try for help
2005-09-11T05:46:00.000Z	aftertaf	sml12	 you should maybe go with hoary
