2007-01-08T11:33:00.000Z	Flannel		!caps | mena
2007-01-08T11:34:00.000Z	mena	Flannel	I AM NOT SHOUTING
2007-01-08T13:36:00.000Z	Flannel	mena	yes, automatix is not a safe thing to use
2007-01-08T13:36:00.000Z	mena	Flannel	how to install wine i dont any way exz\cept throw automatrix
2007-01-08T13:37:00.000Z	Flannel	mena	everything in automatix is available manually,
2007-01-08T13:37:00.000Z	Flannel	mena	there's a wine in the repositories, see that page for a more current versin
2007-01-08T13:38:00.000Z	mena	Flannel	i entered it and it telling not recmened to install newest version of wine
2007-01-08T13:38:00.000Z	Flannel	mena	alright, that wiki page knows best.  I haven't looked at it in a while.  It'll get you all setup though
2007-01-08T13:38:00.000Z	mena	Flannel	okay
2007-01-08T13:41:00.000Z	mena	Flannel	i have a problem with parental cntrol with ubuntu CE is there any way to remove it
2007-01-08T14:43:00.000Z	mena	Flannel	i am realy sorry sorry sorrry plz
2007-01-13T14:37:00.000Z	Flannel	mena	you want to share it through windows sharing?
2007-01-13T14:38:00.000Z	mena	Flannel	Windows share how do i share itthrow it ..i was going to share it mormally
2007-01-13T14:38:00.000Z	Flannel	mena	er... through the network, right?
2007-01-13T14:38:00.000Z	mena	Flannel	Normaly
2007-01-13T14:38:00.000Z	mena	Flannel	yes
2007-01-13T14:39:00.000Z	mena	Flannel	okay but if i share it with ext3 do will others see it and they have a Xp OS
2007-01-13T14:40:00.000Z	mena	Flannel	in any way i wil lsee it and try thnaks
