2007-01-04T06:24:00.000Z	aN1	Astaroth_	 if u compile ur own u will loose supprot from ubuntu updates
2007-01-04T06:24:00.000Z	aN1		the kernel part atleast
2007-01-04T06:24:00.000Z	Astaroth_		so well
2007-01-04T06:24:00.000Z	Astaroth_		i'm using the generic kernel
2007-01-04T06:25:00.000Z	Astaroth_		sound was working while i used the 386 kernel
2007-01-04T06:25:00.000Z	Astaroth_		but smp wasnt, nvidia driver were not working, now i fixed it and i can boot with the generic kernel
2007-01-04T06:26:00.000Z	Astaroth_		but since the first boot sound doesnt work anymore
2007-01-04T06:26:00.000Z	aN1		Astaroth to have smp u need to pic the write cd to install from but there is another way
2007-01-04T06:26:00.000Z	Astaroth_		i'm using a terratec aureon 5.1 usb mkii / usb-audio
2007-01-04T06:26:00.000Z	aN1		hold on i have a post deep somewhere
2007-01-04T06:26:00.000Z	Astaroth_	aN1	it already works now
2007-01-04T06:27:00.000Z	Astaroth_		the generic kernel supports smp, so that problem is solved
2007-01-04T06:27:00.000Z	Astaroth_		there's just my sound issue remaining
2007-01-04T06:28:00.000Z	Astaroth_		the sound config in gnome recongnizes the soundcard but there's just no sound output
2007-01-04T06:28:00.000Z	Astaroth_		i'm getting error messages, sec
2007-01-04T06:28:00.000Z	aN1		Astaroth, sudo apt-get install linux-686-smp
2007-01-04T06:29:00.000Z	aN1		Astaroth, http://ubuntuforums.org/showthread.php?t=85917
2007-01-04T06:29:00.000Z	Astaroth_	aN1	i'm using the generic kernel, no need for a patch, but thanks ;)
