2006-07-21T10:59:00.000Z	nin----jaaa		...what is a good program to encode  different fileformats..like M-3 to wave???
2006-07-21T11:00:00.000Z	Toma-	nin----jaaa	m-3?
2006-07-21T11:00:00.000Z	nin----jaaa	Toma-	mp3**
2006-07-21T11:00:00.000Z	Toma-	nin----jaaa	soundconvertor is in the repos and does a good job
2006-07-21T11:01:00.000Z	nin----jaaa	Toma-	how would i get it im a linux noob..lol..
2006-07-21T11:02:00.000Z	Toma-	nin----jaaa	have you enabled universe in Synaptic?
2006-07-21T11:03:00.000Z	nin----jaaa	Toma-	how would i check
2006-07-21T11:04:00.000Z	nin----jaaa	Toma-	?
2006-07-21T11:04:00.000Z	Toma-	nin----jaaa	run "sudo apt-get install soundconverter" and if it doesnt install, then you dont have universe enabled
2006-07-21T11:05:00.000Z	nin----jaaa	Toma-	got it thanks..i was bein dumb and had synaptic open wihile runnin the command
2006-07-21T11:09:00.000Z	nin----jaaa	Toma-	what does it mean when it says no tags in soundconvertor
2006-07-21T11:09:00.000Z	Toma-	nin----jaaa	means you dont have any infomation tags (artist, album name) in the file
2006-07-21T11:10:00.000Z	nin----jaaa	Toma-	so it wont convert
2006-07-21T11:10:00.000Z	Toma-	nin----jaaa	it wont? whats it saying?
2006-07-21T11:10:00.000Z	nin----jaaa	Toma-	nothing
2006-07-21T11:11:00.000Z	Toma-	nin----jaaa	so whats the error?
2006-07-21T11:11:00.000Z	nin----jaaa	Toma-	it doesnt say anything..when i hit the convert button nothing happens
2006-07-21T11:12:00.000Z	Toma-	nin----jaaa	have you installed the mp3 codec?
