2006-06-27T10:36:00.000Z	nightstalker07		does anyone know of any errors with usplash....upon boot, my laptop just displays a black screen up to the login screen?...thanx
2006-06-27T10:37:00.000Z	polpak	nightstalker07	you probably need to change the framebuffer args in your menu.lst
2006-06-27T10:38:00.000Z	nightstalker07	polpak	where do i find that in the file?...i'm a n00b
2006-06-27T10:39:00.000Z	polpak	nightstalker07	what's the resolution on your laptop?
2006-06-27T10:39:00.000Z	nightstalker07	polpak	1280x800
2006-06-27T10:40:00.000Z	polpak	nightstalker07	well you can try a couple of things.. Lemme check
2006-06-27T10:51:00.000Z	nightstalker07	polpak	i don't see where the splash option is
2006-06-27T10:45:00.000Z	polpak	nightstalker07	ok, edit /boot/grub/menu.lst
2006-06-27T10:48:00.000Z	nightstalker07	polpak	would you like me to pastebin my menu.lst file
2006-06-27T10:50:00.000Z	polpak	nightstalker07	nah.. you can just add vga=789 to your kernel options
2006-06-27T10:50:00.000Z	polpak	nightstalker07	right after the splash option
2006-06-27T10:51:00.000Z	polpak	nightstalker07	just be sure to backup the file first
2006-06-27T10:51:00.000Z	polpak	nightstalker07	you see the lines starting with kernel    /boot/......
2006-06-27T10:52:00.000Z	nightstalker07	polpak	yes
2006-06-27T10:52:00.000Z	polpak	nightstalker07	add vga=789 to the end of the first one of those
2006-06-27T10:52:00.000Z	polpak	nightstalker07	with a space between that and the splash option
2006-06-27T10:54:00.000Z	nightstalker07	polpak	thanx let me just log in as root and i'll give it a shot.....see ya in a few
2006-06-27T11:08:00.000Z	nightstalker07	polpak	thanks for the help, it worked
