2012-10-01T19:43:00.000Z	goddard		haha i like shopping with Google Chrome hahah
2012-10-01T19:44:00.000Z	nbf	goddard	I like being able to hit super and instantly search
2012-10-01T19:45:00.000Z	goddard	nbf	Gnome Shell does the same thing and it doesn't have any of the stupid lens and stuff and Gnome Shell beats Unity benchmarks
2012-10-01T19:45:00.000Z	nbf		yeah gnome shell is okay, I was using it for a while
2012-10-01T19:45:00.000Z	nbf		the latest ubuntu unity is very nice though (quantal)
2012-10-01T19:45:00.000Z	nbf		the performance is much better on my ivy bridge syste
2012-10-01T19:45:00.000Z	goddard	nbf	i like unity i just like Gnome Shell more
2012-10-01T19:46:00.000Z	goddard	nbf	in Gnome Shell 3.6 it has the universal app menu like unity
2012-10-01T19:47:00.000Z	goddard	nbf	there is also an extension to make gnome shell have a doc
2012-10-01T19:47:00.000Z	goddard		dock*
2012-10-01T19:47:00.000Z	nbf		I'm very familiar with gnome 3 :)
2012-10-01T19:48:00.000Z	goddard	nbf	i was surprised they added the overall menu in 3.6 that was the feature I was missing so now I'm happy
2012-10-01T19:48:00.000Z	nbf		it's a great release
2012-10-01T19:48:00.000Z	nbf		I upgraded all of out previous LTS servers to 12.04
2012-10-01T19:50:00.000Z	goddard		nice
2012-10-01T19:50:00.000Z	goddard		i need to do that
2012-10-01T19:51:00.000Z	goddard		why do they have ubuntu remixes when you can just install any DE in ubuntu?
2012-10-01T19:52:00.000Z	nbf	goddard	less setup work
