2005-11-22T09:47:00.000Z	sethrd		It will randomly jump around and open programs and stuff.
2005-11-22T09:47:00.000Z	sethrd		This install is less then 2 days old.
2005-11-22T09:48:00.000Z	sethrd		I looked on forums, and no one has a solution yet.
2005-11-22T09:49:00.000Z	gepatino	sethrd	does your mouse have a wheel/third button?
2005-11-22T09:49:00.000Z	sethrd		Wheel, yes.
2005-11-22T09:49:00.000Z	sethrd		I'm not using it when the system locks up though.
2005-11-22T09:51:00.000Z	gepatino	sethrd	try using IM/PS2 as the mouse module in xorg.conf, and restart X
2005-11-22T09:52:00.000Z	sethrd	gepatino	Where am I looking? For option protocol, IMPS/2 is already set.
2005-11-22T09:52:00.000Z	gepatino	sethrd	 are you loking at /etc/X11/xorg.xonf?
2005-11-22T09:53:00.000Z	sethrd	gepatino	Yes.
2005-11-22T09:53:00.000Z	sethrd		/etc/X11/xorg.conf
2005-11-22T09:53:00.000Z	gepatino	sethrd	Option "Emulate3Buttons" "off"
2005-11-22T09:54:00.000Z	gepatino	sethrd	Option "ZAxisMapping" "4 5"
2005-11-22T09:54:00.000Z	gepatino	sethrd	Option "Buttons" "3"
2005-11-22T09:54:00.000Z	sethrd	gepatino	Off or false? It's set to true right now.
2005-11-22T09:55:00.000Z	gepatino	sethrd	try setting it to false
2005-11-22T09:56:00.000Z	sethrd	gepatino	Be back in a moment.
2005-11-22T10:01:00.000Z	sethrd	gepatino	Nope, still locking up.
