2006-09-20T07:50:00.000Z	The_Knowledge		Hey  Guys how are u all
2006-09-20T07:50:00.000Z	The_Knowledge		?
2006-09-20T07:50:00.000Z	The_Knowledge		I need help
2006-09-20T07:51:00.000Z	The_Knowledge		Can anyone tell me  how to access the drives on my harddisk.I click on computer then drives where there but i can't access them erro"unble to mount something like that"
2006-09-20T07:53:00.000Z	The_Knowledge		 Can anyone tell me  how to access the drives on my harddisk.I click on computer then drives where there but i can't access them erro"unble to mount something like that"
2006-09-20T07:53:00.000Z	The_Knowledge		 Can anyone tell me  how to access the drives on my harddisk.I click on computer then drives where there but i can't access them erro"unble to mount something like that"
2006-09-20T07:53:00.000Z	The_Knowledge		 Can anyone tell me  how to access the drives on my harddisk.I click on computer then drives where there but i can't access them erro"unble to mount something like that"
2006-09-20T07:54:00.000Z	surface	The_Knowledge	 go teminal and try type mount
2006-09-20T07:54:00.000Z	surface	The_Knowledge	 did ur hdd mount point there?
2006-09-20T07:54:00.000Z	surface	The_Knowledge	 did u see ur hdd there?
2006-09-20T07:55:00.000Z	surface	The_Knowledge	so now u r in ubuntu live cd or windows?
2006-09-20T07:56:00.000Z	surface	The_Knowledge	so what is ur problem in windows?
2006-09-20T07:56:00.000Z	surface	The_Knowledge	xchat
2006-09-20T07:56:00.000Z	surface	The_Knowledge	ok i get u
2006-09-20T07:56:00.000Z	surface	The_Knowledge	 usually all mount point is at /mnt
2006-09-20T07:57:00.000Z	surface	The_Knowledge	 let say u have partition of windows it suppose to be mounted at /mnt
2006-09-20T07:58:00.000Z	surface	The_Knowledge	 but i am not sure whether ubuntu do auto mount the partition of windows or not. but slax does
2006-09-20T08:00:00.000Z	surface	The_Knowledge	 you may want to learn more commands if u digs deep for linux, www.linuxbyexample.co.nr might help
