2005-07-27T15:50:00.000Z	aptloverg		hey all wheres the latest apt repos?
2005-07-27T15:52:00.000Z	Seveas	aptloverg	the ones on that side are a complete list, you should not add them, but use JUST them
2005-07-27T15:55:00.000Z	aptloverg	Seveas	oh do u mean its a list of wait is allready in source.1st ?
2005-07-27T15:57:00.000Z	aptloverg	Seveas	so its just a case of unhashing them in sources.1st ? not pasting them in?
2005-07-27T15:57:00.000Z	Seveas	aptloverg	by default multiverse is not listed in sources.list
2005-07-27T15:58:00.000Z	aptloverg	Seveas	so i do have to add them?
2005-07-27T15:59:00.000Z	Seveas	aptloverg	or simply: wget http://paste.ubuntulinux.nl/pastebin.php?download=38 -O /etc/apt/sources.list
2005-07-27T16:02:00.000Z	aptloverg	Seveas	great! ill overwrite that my soures.list with the one you spefied :)
2005-07-27T16:24:00.000Z	aptloverg	Seveas	um
2005-07-27T16:26:00.000Z	aptloverg	Seveas	there are some "amendments" on the  http://paste.ubuntulinux.nl/pastebin.php?download=38 page are they better:?
2005-07-27T16:26:00.000Z	Seveas	aptloverg	they are there because people made mistakes :)
2005-07-27T16:27:00.000Z	aptloverg	Seveas	so which one is the most revised?
2005-07-27T16:27:00.000Z	Seveas	aptloverg	/38
2005-07-27T16:30:00.000Z	aptloverg	Seveas	so the fact that i've delete my old source.lst with like the ubntu cd repo now delete is fine?
2005-07-27T16:36:00.000Z	aptloverg	Seveas	so the fact that i've delete my old source.lst with like the ubntu cd repo now delete is fine?
2005-07-27T16:36:00.000Z	Seveas	aptloverg	yes
2005-07-27T16:38:00.000Z	aptloverg	Seveas	and can I put my contry suffix at the front of the urls?
2005-07-27T16:39:00.000Z	Seveas	aptloverg	you can
