2005-06-13T12:10:00.000Z	ilba7r		is there a page on configuring 802.1g wirless card for ubuntu does not seem even to see it when i check network configuration
2005-06-13T12:11:00.000Z	cafuego	ilba7r	is the card supported by the Linux kernel?
2005-06-13T12:11:00.000Z	ilba7r	cafuego	it runs perfect on mepis i used the live cd
2005-06-13T12:12:00.000Z	cafuego	ilba7r	mepis isn't Ubuntu. Did you check which driver mepis uses for it? Did you check if you have that driver installed?
2005-08-11T08:37:00.000Z	cafuego	ilba7r	october '05
2005-11-22T07:06:00.000Z	cafuego	ilba7r	No.
2005-11-22T07:06:00.000Z	cafuego	ilba7r	What was in it? Just the windows one?
2005-11-22T07:07:00.000Z	cafuego	ilba7r	You can add that partiton into the grub menu
2005-11-22T07:07:00.000Z	cafuego	ilba7r	Check the grub examples, then add an entry for that aprtition (it's DOS or FreeDOS)
2005-12-02T06:27:00.000Z	cafuego	ilba7r	There isn't really one for Linux.
2006-01-14T10:57:00.000Z	cafuego	ilba7r	Just run 'dpkg-buildpackage -b', it will be fine.
2006-01-14T10:57:00.000Z	ilba7r	cafuego	just needed to know simple answer are deb rules diif then ubuntu and can i use use dh_make?
2006-01-14T10:58:00.000Z	cafuego	ilba7r	They're not normally different as far as I know.
2006-01-25T14:54:00.000Z	cafuego	ilba7r	There is a userid matching extension in iptables.
2006-01-25T14:55:00.000Z	ilba7r	cafuego	ok thanks
2006-01-29T07:07:00.000Z	ilba7r	cafuego	any idea why fglrx will give scrambled image running gdmflexiserver on my notebook
2006-01-29T07:08:00.000Z	cafuego	ilba7r	Short of "ATI are evil", no :-(
2006-01-29T07:09:00.000Z	ilba7r	cafuego	:) agree. It is just work with my external monitor but not my laptop. Am starting to think there is something wrong with tty8
