2005-01-12T12:02:00.000Z	bretzel		Please Who has KDE-3.3 and all related stuff actually installed on his debian ???
2005-01-12T12:02:00.000Z	Riddell	bretzel	most of KDE 3.3 is in hoary
2005-01-12T12:11:00.000Z	Riddell	bretzel	yes, it is available, using hoary
2005-01-12T12:13:00.000Z	bretzel	Riddell	OK but what URI to write in sources.list - Or other kind of setup to do  such as ... wait :-) going to ubuntu site ...
2005-01-14T09:22:00.000Z	Riddell	bretzel	kdelibs4 is not missing
2005-01-14T09:27:00.000Z	bretzel	Riddell	Di you know why Kdelibs4 always fails to install then ?? I have no clue...:-(
2005-02-08T11:14:00.000Z	Riddell	bretzel	yes
2005-02-10T11:28:00.000Z	bretzel	Riddell	Hoary :-)
2005-03-04T09:30:00.000Z	Riddell	bretzel	as ready as it is anywhere
2005-03-04T09:32:00.000Z	bretzel	Riddell	But why they have made "kynaptic" ? gnome/gtk is every where. I use KDE for dev and now for kopete but I can't live without Gnome :-)
2005-03-04T09:35:00.000Z	Riddell	bretzel	I added kynaptic because kubuntu won't use gnome
2005-03-04T09:36:00.000Z	Riddell	bretzel	no, it's not out yet
2005-03-04T09:37:00.000Z	bretzel	Riddell	Ah! about configure errors: I've got the same thing with QT installation. it cannot finds the libs too
2005-03-17T09:04:00.000Z	Riddell	bretzel	hmm?
2005-03-18T10:17:00.000Z	Riddell	bretzel	yes
2005-03-18T10:17:00.000Z	Riddell	bretzel	arts and libs are in hoary
2005-03-18T10:18:00.000Z	Riddell	bretzel	you can get the rest from  deb http://jasmine.19inch.net/~jr/away/kubuntu/ ./
2007-07-09T11:25:00.000Z	Riddell	bretzel	http://kubuntu.org/announcements/kde-357.php
