2005-03-23T10:08:00.000Z	reon	memer	had the same idea.
2005-03-23T10:16:00.000Z	memer	reon	i've already read numerous reviews that say linux is faster than os x on the same hardware
2005-03-23T10:20:00.000Z	reon	memer	yes but it does not work properly for amd64, there is a fix at http://www.ubuntuforums.org/showthread.php?t=16143&page=3  but i'm having hassles. I'm the last sod to post in that thread
2005-03-23T10:20:00.000Z	memer	reon	oh, is that right?
2005-03-23T10:21:00.000Z	memer	reon	ok, you're way beyond me. sounds cool tho
2005-03-23T10:22:00.000Z	reon	memer	trust me i'm not. thisis a steep learning curve for me :) I'm like a fish out of water here
2005-03-23T10:24:00.000Z	memer	reon	join the club ;-)
2005-03-23T10:24:00.000Z	reon	memer	looks like membership is free, lol. Thynis has left the house
2005-03-23T10:25:00.000Z	memer	reon	yeah, rats. just missed him. shit.
2005-03-23T10:25:00.000Z	reon	memer	you installed win codecs yet ?
2005-03-23T10:26:00.000Z	memer	reon	nope.  i haven't actually messed with my linux box in months now what with a move and laziness. i jammed libranet on there and it took care of everything. (you've got to try that amazing Adminmenu thing)
2005-03-23T10:27:00.000Z	reon	memer	tell me more ?
2005-03-23T10:27:00.000Z	memer	reon	juuust gettnig back into it again.
2005-03-23T10:27:00.000Z	memer	reon	well, it's basically debian but with their own installer and a kind of control area that you can use to set up sound, install java, flash, fix your resolution, wash your dishes...
2005-03-23T10:28:00.000Z	reon	memer	sounds like something for me ? got a link to a guide ?
2005-03-23T10:28:00.000Z	memer	reon	www.libranet.com
2005-03-23T10:30:00.000Z	reon	memer	thanks, I'll check it out now. is it a straight forward install on ubuntu ?
2005-03-23T10:30:00.000Z	memer	reon	coming
