2005-12-17T17:29:00.000Z	soldieruk400		what do you recomend me using for a new web brouser ?
2005-12-17T17:30:00.000Z	soldieruk400		im used to windows brousers to see lol
2005-12-17T17:30:00.000Z	soldieruk400		ok what is a good replace ment for firefox
2005-12-17T17:32:00.000Z	soldieruk400		lol im stuck then im on unbuntu lol
2005-12-17T17:32:00.000Z	soldieruk400		seems like i will have to sus me firefox out lol
2005-12-17T06:49:00.000Z	soldieruk400		hi im using a bt b/b router at this verry moment and sor some freeky reason it is working i have not installed anything.is that bad ?
2005-12-17T06:51:00.000Z	soldieruk400		any one providing help ?
2005-12-17T06:51:00.000Z	soldieruk400		telicom
2005-12-17T06:51:00.000Z	soldieruk400		telecome
2005-12-17T06:52:00.000Z	soldieruk400		i cant install the driver because there all windows
2005-12-17T06:52:00.000Z	thoreauputic	soldieruk400	if linux recognised it, it works
2005-12-17T06:53:00.000Z	thoreauputic	soldieruk400	what do you mean?
2005-12-17T06:54:00.000Z	thoreauputic	soldieruk400	how would they know or care ?
2005-12-17T06:55:00.000Z	thoreauputic	soldieruk400	sounds like you are used to windows where you have to install drivers all the time
2005-12-17T06:55:00.000Z	thoreauputic	soldieruk400	:)
2005-12-17T06:55:00.000Z	thoreauputic	soldieruk400	welcome to freedom :)
2005-12-17T06:58:00.000Z	thoreauputic	soldieruk400	that's a start - read the URLs ubotu sent you :)
2005-12-17T07:01:00.000Z	thoreauputic	soldieruk400	the help icon on your top panel contains much info too :)
