2010-07-21T07:04:00.000Z	Night_Fire		latest version of ubuntu is 10.04 now
2010-07-21T07:04:00.000Z	Night_Fire		u can either use update manager or go to ubuntu.com and get the latest version on CD
2010-07-21T07:05:00.000Z	Night_Fire		System>administration>update manager
2010-07-21T07:05:00.000Z	Night_Fire		np!
2010-07-21T07:07:00.000Z	Night_Fire		whats ur system arch 32 or 64 ?
2010-07-21T07:08:00.000Z	Night_Fire		multi orders at once or multi shells ?
2010-07-21T07:10:00.000Z	Night_Fire		nope gunzip them i guess there is no hidden files in .zip
2010-07-21T07:11:00.000Z	Night_Fire		ok easy way to get flash and java for ur web browser : go to youtube.com it asks for flash to play a video use ur web browser to install it same for java but u need a site that needs java to run
2010-07-21T07:12:00.000Z	Night_Fire		ok easy way to get flash and java for ur web browser : go to youtube.com it asks for flash to play a video use ur web browser to install it same for java but u need a site that needs java to run
2010-07-21T07:12:00.000Z	ChogyDan	Night_Fire	is that a question?  I just install u-r-e
2010-07-21T07:13:00.000Z	Night_Fire		nope some1 need flash plugin so im giving an easy way away from package manager and terminal
2010-07-21T07:14:00.000Z	Night_Fire		it worked for me fine so far
2010-07-21T07:16:00.000Z	Night_Fire		also if it dosent work for any1 u can always install ubuntu-restricted-extras package
2010-07-21T07:17:00.000Z	Night_Fire		how can i backup my current programs and packages when they're not in cache ?
2010-07-21T07:19:00.000Z	Night_Fire		nope i dun think so they just hate linux yes but they dont screw the sofware for linux
2010-07-21T07:19:00.000Z	Night_Fire		np uRock i'll find a way
2010-07-21T07:19:00.000Z	ChogyDan	Night_Fire	would you be good with just a listing?
2010-07-21T07:19:00.000Z	Night_Fire	ChogyDan	i dun understand :S
