2010-05-18T18:50:00.000Z	Oxford		hi.. i am trying to install adobe flash player on amd64
2010-05-18T18:50:00.000Z	Oxford		facing problems with it
2010-05-18T18:51:00.000Z	Dr_Willis	Oxford	 flashplugin-installer - Adobe Flash Player plugin installer
2010-05-18T18:51:00.000Z	Dr_Willis	Oxford	 'sudo apt-get install flashplugin-installer'
2010-05-18T18:53:00.000Z	Oxford	Dr_Willis	did that but it returned "couldnt finfd the package"
2010-05-18T18:53:00.000Z	Dr_Willis	Oxford	 check the spelling. use TAB to complete the name. What ubuntu release are you on exactly?
2010-05-18T18:55:00.000Z	Oxford	Dr_Willis	ubuntu10.04
2010-05-18T18:56:00.000Z	Dr_Willis	Oxford	 somthing is weird then. that is the package name
2010-05-18T18:56:00.000Z	Dr_Willis	Oxford	 check your spelling, be sure to 'sudo apt-get update'  befor hand also.
2010-05-18T19:01:00.000Z	Dr_Willis	Oxford	 you are best to uise the version in the repos i imagine.
2010-05-18T19:01:00.000Z	Dr_Willis	Oxford	 installing flash from the adobe site can sometimes not work properly
2010-05-18T19:44:00.000Z	Dr_Willis	Oxford	 try 'wget --help' to be sure its installed?
2010-05-18T19:45:00.000Z	Oxford	Dr_Willis	did that.... wget : not found
2010-05-18T19:45:00.000Z	Dr_Willis	Oxford	 so... instll wget..
2010-05-18T20:27:00.000Z	Dr_Willis	Oxford	 totally depends on what it is.
2010-05-18T20:28:00.000Z	Dr_Willis	Oxford	 a lot of your Q's may be answerd at -> http://sites.google.com/site/alucidfs/how-i-do
2010-05-21T17:55:00.000Z	Dr_Willis	Oxford	 im not sure it works in wine. check the wine app database
2010-05-21T17:57:00.000Z	Dr_Willis	Oxford	 the wine forums proberly have 100+ threads on using itunes with it.
