2010-06-28T10:42:00.000Z	Iraqi		how can play file " .flv"?? please
2010-06-28T10:43:00.000Z	_jesse_	Iraqi	VLC should be able to play flv's
2010-06-28T10:44:00.000Z	_jesse_	Iraqi	what SlikerT said :)
2010-06-28T10:50:00.000Z	_jesse_	Iraqi	edit /boot/grub/grub.cfg, but be careful
2010-06-28T10:55:00.000Z	_jesse_	Iraqi	hit alt-F2 and type gksudo gedit /boot/grub/menu.lst
2010-06-28T10:59:00.000Z	_jesse_	Iraqi	? if you have 10.04 it should be /boot/grub/grub.cfg
2010-06-28T11:00:00.000Z	_jesse_	Iraqi	ah then yes, you should be right, it is likely /boot/grub/menu.list
2010-06-28T11:01:00.000Z	_jesse_	Iraqi	with a text editor
2010-06-28T11:03:00.000Z	_jesse_	Iraqi	pastebin the file and I'll change it for you
2010-06-28T11:05:00.000Z	_jesse_	Iraqi	copy the file here http://pastebin.com/
2010-06-28T11:12:00.000Z	_jesse_	Iraqi	yes? you never gave me a link to the file
2010-06-28T11:13:00.000Z	_jesse_	Iraqi	right, now give me the link :)
2010-06-28T11:14:00.000Z	_jesse_	Iraqi	thank you :) one sec
2010-06-28T11:18:00.000Z	_jesse_	Iraqi	make a copy of your current file (type 'sudo cp /boot/grub/menu.list /boot/grub/ment.list.bak' and then replace the contents of /boot/grub/menu.list with http://pastebin.com/tmJ14svy
2010-06-28T11:21:00.000Z	_jesse_	Iraqi	right, I edited already, here: http://pastebin.com/tmJ14svy
2010-06-28T11:26:00.000Z	_jesse_	Iraqi	I don't understand
2010-06-28T11:29:00.000Z	_jesse_	Iraqi	copy from the box at the bottom of the webpage
2010-06-28T11:35:00.000Z	_jesse_	Iraqi	no problem :)
