2010-02-01T23:41:00.000Z	coz_	CAPcap	  sudo apt-ge
2010-02-01T23:41:00.000Z	coz_	CAPcap	 sudo apt-get install lxde  then log out and choose the lxde session
2010-02-01T23:42:00.000Z	CAPcap	coz_	 that goes beside right? i'll still have gnome yeah?
2010-02-01T23:42:00.000Z	coz_	CAPcap	 yep you just choose which session while you are on the login screen
2010-02-01T23:43:00.000Z	coz_	CAPcap	 lxde is very very fast   not quite up to par
2010-02-01T23:43:00.000Z	CAPcap	coz_	sweet. just like i did with kde. is it possible to uninstall these later?
2010-02-01T23:43:00.000Z	coz_	CAPcap	 with gnome
2010-02-01T23:43:00.000Z	coz_	CAPcap	 yep just sudo apt-get autoremove  lxde
2010-02-01T23:44:00.000Z	coz_	CAPcap	 lxde will take a day to get used to ..it is similar to xfce in ways
2010-02-01T23:44:00.000Z	coz_	CAPcap	 no to get rid of kde    sudo apt-get autoremove kubuntu-desktop
2010-02-01T23:44:00.000Z	CAPcap	coz_	i meant for installing
2010-02-01T23:44:00.000Z	coz_	CAPcap	 installing kde?
2010-02-01T23:45:00.000Z	coz_	CAPcap	  sudo apt-get install kubuntu-desktop
2010-02-01T23:45:00.000Z	CAPcap	coz_	yes and xfce
2010-02-01T23:45:00.000Z	coz_	CAPcap	 sudo apt-get install xubuntu-desktop
2010-03-19T05:15:00.000Z	coz_	CAPcap	 if no one can answer you here try the ##linux channel
2010-03-19T05:16:00.000Z	coz_	CAPcap	 they generally have a broader base of knowledge concerging linux issues
2010-03-19T05:16:00.000Z	CAPcap	coz_	thanks
