2010-09-20T02:16:00.000Z	SolarisBoy		id like upgrame vim to 7.3 can someone lend some advice on the safest procedure?
2010-09-20T02:16:00.000Z	SolarisBoy		s/upgrame/upgrade/
2010-09-20T02:18:00.000Z	SolarisBoy		is there anyone that can help with upgrading vim to 7.3? im on lucid 7.2 is in repos
2010-09-20T02:18:00.000Z	SolarisBoy		i have a deb install
2010-09-20T02:19:00.000Z	Sia--	SolarisBoy	let me know what is the difference?
2010-09-20T02:22:00.000Z	SolarisBoy	Sia--	is that good enough for some assistance sir? =)
2010-09-20T02:27:00.000Z	Sia--	SolarisBoy	did you try getdeb.net or ..etc? to install the new version?
2010-09-20T02:30:00.000Z	Sia--	SolarisBoy	dont remove vim just remove ~/.vim or .vimrc
2010-09-20T02:32:00.000Z	SolarisBoy	Sia--	what if i am trying mainly to preserve (what is preservable and compatible) from my scripts,plugins,dictionaries etc
2010-09-20T02:40:00.000Z	Sia--	SolarisBoy	undo in vim
2010-09-20T02:42:00.000Z	Sia--	SolarisBoy	u:
2010-09-20T02:43:00.000Z	Sia--	SolarisBoy	is vim installed or just a light version with ubuntu
2010-09-20T02:43:00.000Z	SolarisBoy	Sia--	its installed
2010-09-20T02:46:00.000Z	Sia--	SolarisBoy	:u mean pressing ESC to visualmode and press U
2010-09-20T02:47:00.000Z	Sia--	SolarisBoy	that is mean you saved the doc's before and quited vim
2010-09-20T02:49:00.000Z	Sia--	SolarisBoy	not true
2010-09-20T02:57:00.000Z	SolarisBoy	Sia--	i see the room but can't talk,, thanks for the help that feature is not in 7.2
2010-09-20T02:57:00.000Z	Sia--	SolarisBoy	then use the new version compile it package it ..etc
