2009-01-13T22:37:00.000Z	wolter		hcitools cannot detect my bluetooth
2009-01-13T22:37:00.000Z	pyrokay_	wolter	is it supported?
2009-01-13T22:38:00.000Z	wolter	pyrokay_	i don't know, i just got a dell xps m1530... how do i know if it is supported?
2009-01-13T22:41:00.000Z	wolter	pyrokay_	jinja-sheep: i get something about stopping bluetooth at boot in the syslog file =D
2009-01-13T22:42:00.000Z	wolter	pyrokay_	http://paste.ubuntu.com/104454/
2009-01-13T22:42:00.000Z	pyrokay_	wolter	do an lspci and lsusb and look for bluetoothy things
2009-01-13T22:44:00.000Z	wolter	pyrokay_	ok, but here is some more to the syslog thing http://paste.ubuntu.com/104456/
2009-01-13T22:46:00.000Z	wolter	pyrokay_	here is the lspci... i don't know if there is really something bluetooth http://paste.ubuntu.com/104457/plain/
2009-01-13T22:47:00.000Z	pyrokay_	wolter	i see nothing about bluetooth in there. try lsusb and pastebin that
2009-01-13T22:47:00.000Z	wolter	pyrokay_	http://paste.ubuntu.com/104459/
2009-01-13T22:48:00.000Z	wolter	pyrokay_	wait, the usbhci is nothing about bluetooth?
2009-01-13T22:48:00.000Z	pyrokay_	wolter	i can't see anything relating to bluetooth in there
2009-01-13T22:48:00.000Z	wolter	pyrokay_	i mean, the uhci in line 3 of http://paste.ubuntu.com/104457/plain/
2009-01-13T22:49:00.000Z	pyrokay_	wolter	no, sorry. that's just the usb ports
2009-01-13T22:49:00.000Z	pyrokay_	wolter	lsusb will give you info about attached usb devices, including intern al bluetooth
2009-01-13T23:27:00.000Z	pyrokay_	wolter	use google's cache to view them.
2009-01-13T23:28:00.000Z	pyrokay_	wolter	just do cache:www.<webpage>.com in a google search.
2009-01-13T23:30:00.000Z	wolter	pyrokay_	tough luck, today the last snapshot was taken
