2008-12-20T20:13:00.000Z	_Marko		I have a program installed from the source, I want to reinstall it using RPM
2008-12-20T20:13:00.000Z	_Marko		what shall I do ?
2008-12-20T20:14:00.000Z	_Marko		I mean DEB
2008-12-20T20:14:00.000Z	_Marko		what's the solution ?
2008-12-20T20:16:00.000Z	_Marko		Do you have a solution ?
2008-12-20T20:17:00.000Z	_Marko		I installed PHP using make, make install. I want to reinstall it using .deb
2008-12-20T20:18:00.000Z	_Marko		Do you have a solution ?
2008-12-20T20:18:00.000Z	_Marko		booooooot
2008-12-20T20:19:00.000Z	_Marko		u do :D
2008-12-20T20:19:00.000Z	mahfiaz	_Marko	pretty smart bot, isn't he?
2008-12-20T20:19:00.000Z	mahfiaz	_Marko	type sudo apt-get install php
2008-12-20T20:20:00.000Z	_Marko	mahfiaz	I'm affraid to do apt-get
2008-12-20T20:20:00.000Z	mahfiaz	_Marko	use synaptics then
2008-12-20T20:23:00.000Z	mahfiaz	_Marko	right-click on package name
2008-12-20T20:24:00.000Z	mahfiaz	_Marko	you could also try aptitude out then
2008-12-20T20:24:00.000Z	mahfiaz	_Marko	and ssh -X makes your remote server seem more near
2008-12-20T20:26:00.000Z	_Marko	mahfiaz	I didn't really get what u mean ?
2008-12-20T20:26:00.000Z	mahfiaz	_Marko	run simply aptitude, no additions
