2008-11-08T12:59:00.000Z	kostja_	maxxist	, i update has been made, but it's the same behavior
2008-11-08T12:59:00.000Z	maxxist	kostja_	is your whole network going down or just the ubuntu box?
2008-11-08T13:00:00.000Z	maxxist	kostja_	k that rules that out.
2008-11-08T13:01:00.000Z	maxxist	kostja_	you are using dhcp or auto right?  what kind of network card are you using?
2008-11-08T13:04:00.000Z	kostja_	maxxist	santa rose plattform, intel
2008-11-08T13:05:00.000Z	maxxist	kostja_	 you on a laptop?
2008-11-08T13:08:00.000Z	kostja_	maxxist	ASUS A8SC
2008-11-08T13:08:00.000Z	maxxist	kostja_	brb
2008-11-08T13:09:00.000Z	kostja_	maxxist	?
2008-11-08T13:11:00.000Z	maxxist	kostja_	are you using wireless?
2008-11-08T13:13:00.000Z	maxxist	kostja_	 i found this site.  http://www.linlap.com/wiki/Asus+A8SC
2008-11-08T13:15:00.000Z	kostja_	maxxist	all is worked with 8.04, without problems
2008-11-08T13:16:00.000Z	kostja_	maxxist	with cable it seems to work
2008-11-08T13:16:00.000Z	maxxist	kostja_	 i dunno what to tell ya man.  i was having problems with network earlier too with 8.10 x86-64.
2008-11-08T13:17:00.000Z	maxxist	kostja_	 that site shows how to install the wireless driver through repos.
2008-11-08T13:17:00.000Z	kostja_	maxxist	i will try it out moment
2008-11-08T13:23:00.000Z	kostja_	maxxist	over cable all does work
2008-11-08T13:25:00.000Z	maxxist	kostja_	 thats a good start then...
