2012-01-05T21:14:00.000Z	DoctorD		do you think home hosting is a good solution?
2012-01-05T21:15:00.000Z	DoctorD		let's say..for some website with no big traffic
2012-01-05T21:15:00.000Z	DoctorD		websites*
2012-01-05T21:15:00.000Z	DoctorD		well, my home connection is ok :). do you want to test it ? just to know if it works ?
2012-01-05T21:15:00.000Z	DoctorD		http://rop.sytes.net/
2012-01-05T21:16:00.000Z	DoctorD		oh, forgot about changing some things.
2012-01-05T21:16:00.000Z	DoctorD		wait a sec guys
2012-01-05T21:18:00.000Z	DoctorD		ok. now i think it might work: http://rop.sytes.net/
2012-01-05T21:19:00.000Z	DoctorD		so..it is working ?
2012-01-05T21:20:00.000Z	who_me	DoctorD	I can;t connect to it
2012-01-05T21:21:00.000Z	DoctorD	who_me	maybe has not been updated yet.
2012-01-05T21:22:00.000Z	who_me	DoctorD	works now :) Who's Ionica ? :P
2012-01-05T21:25:00.000Z	who_me	DoctorD	what kind of site do you want to host ?
2012-01-05T21:25:00.000Z	DoctorD	who_me	well, not a big one of course, something smaller, for my projects..maybe a blog or something similar
2012-01-05T21:26:00.000Z	who_me	DoctorD	got a dedicated machine for it or running in a VM ?
2012-01-05T21:27:00.000Z	who_me	DoctorD	for ubuntu ofc
2012-01-05T21:28:00.000Z	DoctorD	who_me	hm..a good idea..not bad..i will see :)
2012-01-05T21:31:00.000Z	who_me	DoctorD	I was just about to smash my trendnet 632BP to pieces, awful piece of rubbish that it is... I believe the DIR-600 is related :)
