2008-06-03T18:13:00.000Z	Lord-Azmodan		guys, what's with ubuntu and laptops HDDs?
2008-06-03T18:14:00.000Z	ikonia	Lord-Azmodan	in what way ?
2008-06-03T18:14:00.000Z	ikonia	Lord-Azmodan	do you mean the bug that damages the drives ?
2008-06-03T18:14:00.000Z	Lord-Azmodan	ikonia	yes,
2008-06-03T18:14:00.000Z	ikonia	Lord-Azmodan	have you read the bug report ?
2008-06-03T18:14:00.000Z	Lord-Azmodan	ikonia	yes
2008-06-03T18:14:00.000Z	ikonia	Lord-Azmodan	ok - so what are you asking then - the detail is in the bug report
2008-06-03T18:15:00.000Z	ikonia	Lord-Azmodan	what information do you want to know ?
2008-06-03T18:15:00.000Z	Lord-Azmodan	ikonia	if there's a fix?
2008-06-03T18:15:00.000Z	ikonia	Lord-Azmodan	is there a fix in the bug report.....
2008-06-03T18:15:00.000Z	ikonia	Lord-Azmodan	is there a fix in the bug report......
2008-06-03T18:15:00.000Z	Lord-Azmodan	ikonia	to remove the -h?
2008-06-03T18:15:00.000Z	ikonia	Lord-Azmodan	fyi: ubuntu does not use sysvinit
2008-06-03T18:16:00.000Z	ikonia	Lord-Azmodan	is there a fix documented and commited in the bug report you've read on launchapd
2008-06-03T18:16:00.000Z	Lord-Azmodan	ikonia	i was talking about debian based systems in general
2008-06-03T18:16:00.000Z	ikonia	Lord-Azmodan	well, ubuntu is not debian, so I suggest you look at the detail in the bug report
2008-06-03T18:16:00.000Z	Lord-Azmodan	ikonia	ok
2008-06-03T18:16:00.000Z	ikonia	Lord-Azmodan	you'll find that the problem is not "ubuntu" its to do with a kernal implimentation used by ubuntu,
