2008-03-11T19:21:00.000Z	amenado		kris_ph-> as opposed to known? how would you know who should be allowed?
2008-03-11T19:22:00.000Z	kris_ph	amenado	what do you mean with that?
2008-03-11T19:23:00.000Z	kris_ph	amenado	it is just one of the firewall entries in my wrt54g?
2008-03-11T19:25:00.000Z	kris_ph	amenado	if m going to enable Block Anonymous Internet Requests....would it interfere PPPOE type of connection?
2008-03-11T19:26:00.000Z	kris_ph	amenado	m running a web server...
2008-03-12T03:38:00.000Z	kris_ph	amenado	yeah.. this file cgi/php.ini
2008-03-12T03:39:00.000Z	kris_ph	amenado	but I cannot find cgi directory
2008-03-12T03:40:00.000Z	kris_ph	amenado	I just don't know what to include in the file....
2008-03-12T03:40:00.000Z	kris_ph	amenado	and why is it that I don't have CGI directory?
2008-03-12T03:41:00.000Z	kris_ph	amenado	BTW...m using php5
2008-03-12T03:43:00.000Z	kris_ph	amenado	can I just copy the folder /etc/php5/apache2/ where it has php.ini and I will just rename it to cgi?
2008-03-12T03:44:00.000Z	kris_ph	amenado	okay... let me ask this instead.. how to know that CGI is installed?
2008-03-12T03:47:00.000Z	kris_ph	amenado	I cannot find one there.. Is there a way to install it? how?
2008-03-12T03:49:00.000Z	kris_ph	amenado	okay...so how to install it?
2008-03-12T03:49:00.000Z	amenado	kris_ph	apache already have it..may i suggest a tutorial on apache?
2008-03-12T03:54:00.000Z	kris_ph	amenado	thanks for the idea.. :)
2008-03-15T18:54:00.000Z	kris_ph	amenado	sounds like you're against with light....
2008-03-15T19:01:00.000Z	kris_ph	amenado	yeah.. but I don't like to test it myself that's why I'm asking those who have experience with these two flavors...m sure linxeh is honest..
