2007-11-15T23:22:00.000Z	poule_magik		hello everybody
2007-11-15T23:24:00.000Z	poule_magik		when I create environment variable such as export DUMMY=something, why the variable DUMMY is only known in the terminal where I entered the previous command ? Why is it unknown if I open another terminal (echo $DUMMY remains void)
2007-11-15T23:26:00.000Z	fyrestrtr	poule_magik	because opening a new terminal only sets those variables that are in ~/.bashrc
2007-11-15T23:26:00.000Z	poule_magik	fyrestrtr	so how to fix my probleme ? no way ?
2007-11-15T23:27:00.000Z	fyrestrtr	poule_magik	echo 'export FOO=bar' >> ~/.bashrc
2007-11-15T23:27:00.000Z	poule_magik	fyrestrtr	it is temporary variable, I don't want to put it permanently in my .bashrc
2007-11-15T23:28:00.000Z	fyrestrtr	poule_magik	then write a script that sets it and launch the command that needs it.
2007-11-15T23:29:00.000Z	poule_magik	fyrestrtr	I saw a video where the variable are known in every terminal without writing in .bashrc, just with export FOO=bar in a terminal
2007-11-15T23:30:00.000Z	fyrestrtr	poule_magik	where did you see this video?
2007-11-15T23:32:00.000Z	poule_magik	fyrestrtr	do you want the URL?
2007-11-15T23:33:00.000Z	poule_magik	fyrestrtr	http://video.aircrack-ng.org/noclient/
2007-11-15T23:33:00.000Z	poule_magik	fyrestrtr	look at the setting up of the wifi card, variables are exported and then used in another terminal without any problem !
2007-11-15T23:35:00.000Z	poule_magik	fyrestrtr	have you seen it ?
2007-11-15T23:37:00.000Z	poule_magik	fyrestrtr	are you still here ?
2007-11-15T23:37:00.000Z	fyrestrtr	poule_magik	I don't see where there is another terminal?
2007-11-15T23:38:00.000Z	fyrestrtr	poule_magik	the video only shows one Konsole session.
2007-11-15T23:38:00.000Z	poule_magik	fyrestrtr	he opens 3 terminal in the video !
2007-11-15T23:39:00.000Z	poule_magik	fyrestrtr	have you seen it til the end ?
