2007-09-01T11:05:00.000Z	ironmatar		ok i have a error on startup after installing so i re inserted live cd and mounted that volume  does this mean if i run sudo i am working on the mounted volume?
2007-09-01T11:06:00.000Z	ironmatar		!wine
2007-09-01T11:07:00.000Z	ironmatar		or /j #wine
2007-09-01T11:07:00.000Z	ironmatar		er scuse /j #winehq
2007-09-01T11:08:00.000Z	ironmatar		ok i have a error on startup after installing so i re inserted live cd and mounted that volume  does this mean if i run sudo i am working on the mounted volume?
2007-09-01T11:09:00.000Z	ironmatar		i was hopeing that my q would be a easy ys or no kind of answer
2007-09-01T11:11:00.000Z	ironmatar		cedega
2007-09-01T11:11:00.000Z	ironmatar		buy it costs a little
2007-09-01T11:12:00.000Z	ironmatar		er not free
2007-09-01T11:12:00.000Z	ironmatar		ok i have a error on startup after installing so i re inserted live cd and mounted that volume  does this mean if i run sudo i am working on the mounted volume?
2007-09-01T11:14:00.000Z	z0rz	ironmatar	No You'll have to cd to where you mounted it .. and then work on the file system .. if you really want to work like you are "on the machine" you'll need to chroot it
2007-09-01T11:15:00.000Z	ironmatar	z0rz	 ok advice on that?
2007-09-01T11:15:00.000Z	z0rz	ironmatar	Yeah do this on a Terminal on the Live CD: http://z0rz.pastebin.com/d22def51c
2007-09-01T11:17:00.000Z	ironmatar	z0rz	 which is relevant the upper or lower part
2007-09-01T11:17:00.000Z	z0rz	ironmatar	They are the same ;) Just do one of them
2007-09-01T11:18:00.000Z	ironmatar	z0rz	 ok just checking as the text style was diffrent on top
2007-09-01T11:26:00.000Z	ironmatar	z0rz	 that rsets the machien to mounted volume?
2007-09-01T11:26:00.000Z	ironmatar	z0rz	just checking
