2007-04-28T05:37:00.000Z	Fidelix		Hello, how can i convert a ReiserFS partition to FAT 32 ?
2007-04-28T05:38:00.000Z	Fidelix		Hello, how can i convert a ReiserFS partition to FAT 32 ?
2007-04-28T05:38:00.000Z	Tomcat_	Fidelix	Did you try gparted?
2007-04-28T05:39:00.000Z	Fidelix		why sedra ?
2007-04-28T05:39:00.000Z	Fidelix	Tomcat_	gparted dont work in suse.
2007-04-28T05:39:00.000Z	Fidelix		and people there dont ask answers
2007-04-28T05:40:00.000Z	Tomcat_	Fidelix	Well, this is #ubuntu, right? :)
2007-04-28T05:40:00.000Z	Tomcat_	Fidelix	You can download a LiveCD, then run it from there.
2007-04-28T05:40:00.000Z	Fidelix	Tomcat_	i know, but people in #suse dont help
2007-04-28T05:40:00.000Z	Fidelix	Tomcat_	and i guess gparted dont convert ReiserFS to FAT does it ?
2007-04-28T05:40:00.000Z	Tomcat_	Fidelix	I don't want to sound rude, but we can't help anyone with any problem if it doesn't concern Ubuntu... :I
2007-04-28T05:40:00.000Z	Tomcat_	Fidelix	That's why I asked, I'm not sure... gparted can convert quite some partitions.
2007-04-28T05:41:00.000Z	Tomcat_	Fidelix	Let me look it up.
2007-04-28T05:41:00.000Z	Fidelix	Tomcat_	gparted convert, but it FORMATS the partition
2007-04-28T05:41:00.000Z	Tomcat_	Fidelix	That's not converting then. :D
2007-04-28T05:41:00.000Z	Fidelix		yeah
2007-04-28T05:41:00.000Z	Tomcat_	Fidelix	But you're probably right, I doubt it can do that.
2007-04-28T05:42:00.000Z	Tomcat_	Fidelix	In that case you need to manually do it... get external media, move data, format partition, move data. :I
