2007-04-21T05:42:00.000Z	Xyon		root@pbd1082:~# compiz --replace gconf
2007-04-21T05:42:00.000Z	Xyon		/usr/bin/compiz.real: No composite extension
2007-04-21T05:42:00.000Z	Xyon		Window manager warning: Screen 0 on display ":0.0" already has a window manager; try using the --replace option to replace the current window manager.
2007-04-21T05:43:00.000Z	Xyon		why cant i start compiz?
2007-04-21T05:43:00.000Z	magnetron	Xyon	do you have proper graphic drivers installed?
2007-04-21T05:44:00.000Z	Xyon		compiz for gnome
2007-04-21T05:44:00.000Z	Xyon		it wont replace my current x manager
2007-04-21T05:44:00.000Z	Xyon		i believe i have the correct video drivers installed
2007-04-21T05:44:00.000Z	Xyon		7.04
2007-04-21T05:44:00.000Z	Xyon		this is the first time i've tried to start compiz and i'm on 7.04
2007-04-21T05:45:00.000Z	Xyon		ATI X700
2007-04-21T05:45:00.000Z	Xyon		i've gone through all the crap in the tuts
2007-04-21T05:45:00.000Z	Xyon		https://help.ubuntu.com/community/CompositeManager/InstallingCompiz
2007-04-21T05:46:00.000Z	Xyon	gumjo	sounds like you need a window decorator
2007-04-21T05:46:00.000Z	magnetron	Xyon	new info about ATI on feisty: http://www.mikesplanet.net/2007/04/installing-ubuntu-704-ati-x-cards/
2007-04-21T05:46:00.000Z	Xyon		i dont know, i got my crap running by using sudo apt-get install xorg-driver-fglrx
2007-04-21T05:46:00.000Z	Xyon		correct?
2007-04-21T05:47:00.000Z	magnetron	Xyon	new info about ATI on feisty: http://www.mikesplanet.net/2007/04/installing-ubuntu-704-ati-x-cards/ , the  ATI X... bug
