2007-04-11T10:42:00.000Z	bonniefelixcat		hello.
2007-04-11T10:42:00.000Z	bonniefelixcat		Hello?
2007-04-11T10:42:00.000Z	bonniefelixcat		HELLO???
2007-04-11T10:42:00.000Z	geekytrent	bonniefelixcat	hi
2007-04-11T10:42:00.000Z	bonniefelixcat		Hey, geekytrent
2007-04-11T10:43:00.000Z	bonniefelixcat		this is the first time i've tried IRC ...
2007-04-11T10:43:00.000Z	geekytrent	bonniefelixcat	ah i see, well, welcome and enjoy :D
2007-04-11T10:43:00.000Z	bonniefelixcat	geekytrent	thank you.
2007-04-11T10:44:00.000Z	bonniefelixcat		what's the point of IRC, anyhow? is it technical help or something?
2007-04-11T10:44:00.000Z	bonniefelixcat		or just normal chat?
2007-04-11T10:44:00.000Z	geekytrent	bonniefelixcat	no, it is for tech help and just regular chat...
2007-04-11T10:44:00.000Z	bonniefelixcat		cool.
2007-04-11T10:45:00.000Z	bonniefelixcat		ooops... how do i change  channels?
2007-04-11T10:45:00.000Z	geekytrent	bonniefelixcat	you just have to find a channel (room) that discusses what you want to talk about
2007-04-11T10:45:00.000Z	bonniefelixcat		Ensign and Geekytrent, how can I change channels???
2007-04-11T10:46:00.000Z	bonniefelixcat		ensign and geekytrent, how can i change the channel?
2007-04-11T10:46:00.000Z	geekytrent	bonniefelixcat	click on the ubuntu servers at the top left, and then in there type /list to see the list of rooms...to change to a room, type in /join #roomname
2007-04-11T10:49:00.000Z	geekytrent	bonniefelixcat	think you understand? it might be a little confusing at first...the channel (room) names have a # before them
