2007-02-17T06:26:00.000Z	Jordan_U		!alien | Comrade-Sergei_
2007-02-17T06:27:00.000Z	Comrade-Sergei_	Jordan_U	yes i know but do you have to down load it
2007-02-17T06:28:00.000Z	Jordan_U	Comrade-Sergei_	What application are you trying to install, chances are it is available as a .deb somewhere ?
2007-02-17T06:29:00.000Z	Comrade-Sergei_	Jordan_U	http://art4linux.org/pages/gnome.html
2007-02-17T06:29:00.000Z	Comrade-Sergei_		the web foot one
2007-02-17T06:32:00.000Z	Jordan_U	Comrade-Sergei_	That isn't an RPM
2007-02-17T06:32:00.000Z	Comrade-Sergei_	Jordan_U	yes it is a tar.z
2007-02-17T06:33:00.000Z	Jordan_U	Comrade-Sergei_	tar.gz is not RPM
2007-02-17T06:33:00.000Z	Jordan_U	Comrade-Sergei_	Just open it with login window preferences
2007-02-17T06:33:00.000Z	Comrade-Sergei_	Jordan_U	yes i know cant you use alien for that
2007-02-17T06:33:00.000Z	Jordan_U	Comrade-Sergei_	No.
2007-02-17T06:34:00.000Z	Jordan_U	Comrade-Sergei_	Nor would you need to
2007-02-17T06:34:00.000Z	Jordan_U	Comrade-Sergei_	It is already in the format you need it to be
2007-02-17T06:34:00.000Z	Comrade-Sergei_	Jordan_U	how would you do it then
2007-02-17T06:34:00.000Z	Comrade-Sergei_		i run ubuntu
2007-02-17T06:34:00.000Z	Jordan_U	Comrade-Sergei_	Just open it with login window preferences
2007-02-17T06:34:00.000Z	Comrade-Sergei_		how?
2007-02-17T06:35:00.000Z	Jordan_U	Comrade-Sergei_	System -> Administration -> Login Window then click the Add button
