2012-11-30T08:19:00.000Z	AlexWebr		do i need openbsd modules
2012-11-30T08:19:00.000Z	AlexWebr		i am wondering if i can use ssh to hack minix into ubuntu
2012-11-30T08:19:00.000Z	AlexWebr		is it possible?
2012-11-30T08:19:00.000Z	AlexWebr		you dont understsand
2012-11-30T08:20:00.000Z	AlexWebr		i want minix kernel in ubuntu
2012-11-30T08:20:00.000Z	AlexWebr		i tar the source code and it doesnt work
2012-11-30T08:20:00.000Z	AlexWebr		i do
2012-11-30T08:21:00.000Z	AlexWebr		'./kern.c' and it says '-bash: ./kern.c: Permission denied
2012-11-30T08:22:00.000Z	AlexWebr		how do i fix my error?
2012-11-30T08:23:00.000Z	AlexWebr		why does nobody help me
2012-11-30T08:23:00.000Z	Sazhen86	AlexWebr	 You can run a .c file, you have to compile it first
2012-11-30T08:24:00.000Z	Sazhen86	AlexWebr	 Can't
2012-11-30T08:24:00.000Z	AlexWebr	Sazhen86	what is compile?
2012-11-30T08:24:00.000Z	Sazhen86	AlexWebr	 A compiler turns source code into executable code
2012-11-30T08:25:00.000Z	AlexWebr	Sazhen86	oh, i know c
2012-11-30T08:25:00.000Z	Sazhen86	AlexWebr	 Getting a Minix kernel into Linux could take a lot of work though
2012-11-30T08:26:00.000Z	Sazhen86	AlexWebr	  Not me!  I'm happy with the Linux kernel
2012-11-30T08:27:00.000Z	AlexWebr	Sazhen86	you shodnlt be because microkernel is superior
2012-11-30T08:28:00.000Z	AlexWebr	Sazhen86	linux is complet shit
2012-11-30T08:28:00.000Z	Sazhen86	AlexWebr	That's a step too far, I fear
2012-11-30T08:28:00.000Z	AlexWebr	Sazhen86	because it is written on top of mach
2012-11-30T08:30:00.000Z	Sazhen86	AlexWebr	You compile it first
2012-11-30T08:37:00.000Z	Sazhen86	AlexWebr	  http://www.tldp.org/LDP/lkmpg/2.6/html/lkmpg.html
2012-11-30T08:39:00.000Z	Sazhen86	AlexWebr	 Objects and classes are a C++, Java etc. concept, not C and bytecode is a c# or Java concept, again not C
