2008-04-03T15:30:00.000Z	kelvin911		why MSoffice in ubuntu?
2008-04-03T15:31:00.000Z	kelvin911		in save as choose doc
2008-04-03T15:32:00.000Z	kelvin911		make sure it's office 2000 or office xp doc
2008-04-03T15:32:00.000Z	kelvin911		yes pdf always work
2008-04-03T15:33:00.000Z	kelvin911		my resume is always in pdf
2008-04-03T15:33:00.000Z	kelvin911		so the other end no one can changes it
2008-04-03T15:33:00.000Z	kelvin911		what kinda unveristy is that?
2008-04-03T15:34:00.000Z	kelvin911		most university uses unix in computer lab
2008-04-03T15:36:00.000Z	kelvin911		nvidia is the best
2008-04-03T15:37:00.000Z	Lamego	kelvin911	on some EU countries Windows is more used at univs
2008-04-03T15:38:00.000Z	kelvin911	Lamego	wow didnt know that, maybe those university doesnt have computer department
2008-04-03T15:38:00.000Z	Lamego	kelvin911	they do, IT Eng Univs
2008-04-18T17:55:00.000Z	Lamego	kelvin911	and your question related to Ubuntu.. is ?
2008-04-18T17:58:00.000Z	Lamego	kelvin911	in the wild, no
2008-04-18T18:01:00.000Z	Lamego	kelvin911	yes, using kill
2008-04-18T18:02:00.000Z	Lamego	kelvin911	man killall
2008-04-18T18:02:00.000Z	Lamego	kelvin911	open a terminal, and type, man killall
2008-04-22T19:17:00.000Z	Lamego	kelvin911	what error do you get when isntalling it ?
2008-04-22T19:20:00.000Z	Lamego	kelvin911	change to a different mirror
2008-04-22T19:25:00.000Z	Lamego	kelvin911	because there is some issue with that server, just change ca. to us. or whatever, on your sources.list
2008-04-22T19:25:00.000Z	kelvin911	Lamego	when does it happen?
2008-04-22T19:25:00.000Z	kelvin911	Lamego	because i can install wine from there like 3 hrs ago
2008-04-22T19:26:00.000Z	Lamego	kelvin911	it happens when the server or the network to it fails
2008-04-22T19:28:00.000Z	Lamego	kelvin911	gksudo gedit /etc/apt/sources.list
