2008-03-04T20:39:00.000Z	Ir1		Is tjis the place i can ask help if faq does not help?
2008-03-04T20:39:00.000Z	Slart	Ir1	yes
2008-03-04T20:40:00.000Z	Slart	Ir1	you've come to the right place.. what is the problem?
2008-03-04T20:41:00.000Z	Slart	Ir1	mozilla bluins? what is that?
2008-03-04T20:42:00.000Z	Slart	Ir1	ok.. you've got some mozilla plugin that doesn't work... which plugin is it?
2008-03-04T20:43:00.000Z	Slart	Ir1	are you really using mozilla? not firefox?
2008-03-04T20:44:00.000Z	Slart	Ir1	ok.. and how do you try to install adblock?
2008-03-04T20:45:00.000Z	Slart	Ir1	and what happened?
2008-03-04T20:47:00.000Z	Slart	Ir1	ah.. is your computer connected to internet?
2008-03-04T20:53:00.000Z	Slart	Ir1	ah.. sorry.. didn't see your reply there.. please put my nick in the front of the line so it lights up here at my end..
2008-03-04T20:53:00.000Z	Slart	Ir1	and run this in a terminal "sudo apt-get update"
2008-03-04T20:59:00.000Z	Ir1	Slart	i still dont get it :/
2008-03-04T20:59:00.000Z	Ir1	Slart	i dunno what i should do with theese aplications caus this is first linux expiriense for me
2008-03-04T21:01:00.000Z	Slart	Ir1	apt-get update didn't work?
2008-03-04T21:01:00.000Z	Slart	Ir1	or rather.. "sudo apt-get update"
2008-03-04T21:05:00.000Z	Slart	Ir1	open a terminal/console.. type in this: sudo apt-get update
2008-03-04T21:09:00.000Z	Slart	Ir1	open a terminal/console.. type in this: sudo apt-get update     <--- did you do this? do you need help opening a terminal?
2008-03-04T21:10:00.000Z	Slart	Ir1	any output? errors?
2008-03-04T21:11:00.000Z	Slart	Ir1	ahh.. you haven't enabled the internet repos.. that explains it.. don't paste anything else
2008-03-04T21:12:00.000Z	Slart	Ir1	open System, Administration, Software sources
2008-03-04T21:12:00.000Z	Slart	Ir1	make sure the five options on the first page has a checkmark next to them
2008-03-04T21:13:00.000Z	Slart	Ir1	and the "Download from:" pulldown menu should say something like "Server for Finland".. or main server
2008-03-04T21:13:00.000Z	Slart	Ir1	nope.. that's the problem.. just click the box so they are checked
2008-03-04T21:15:00.000Z	Slart	Ir1	yes.. and when it's done the add/remove thingy should work too
