2008-03-08T06:52:00.000Z	Bradley		another question what is Ubuntu better on... FAT32 or NTFS
2008-03-08T06:53:00.000Z	Bradley		?
2008-03-08T06:53:00.000Z	Bradley		yes
2008-03-08T06:53:00.000Z	Bradley		i have windows vista and can it install fine with NTFS on the same harddisk?
2008-03-08T06:54:00.000Z	Bradley		how, all Windows Vista has is NTFS
2008-03-08T06:54:00.000Z	leo_rockw	Bradley	ntfs == poo
2008-03-08T06:55:00.000Z	leo_rockw	Bradley	you could take care of it, or you can use gparted on the ubuntu live cd
2008-03-08T06:59:00.000Z	leo_rockw	Bradley	linux doesn't need defraggers, so i doubt anyone knows about ntfs defraggers here
2008-03-08T07:00:00.000Z	Bradley	leo_rockw	: why doesnt it need defraggers
2008-03-08T07:00:00.000Z	leo_rockw	Bradley	read this http://www.whylinuxisbetter.net/items/defragment/index.php?lang=
2008-03-08T07:38:00.000Z	leo_rockw	Bradley	do you really need windows?
2008-03-08T07:39:00.000Z	Bradley	leo_rockw	lol, yes... for about everything i do... I Luv Microsoft Word... Powerpoint... Itunes, C++ etc
2008-03-08T07:39:00.000Z	leo_rockw	Bradley	openoffice, amarok. C++
2008-03-08T07:40:00.000Z	Bradley	leo_rockw	right, but Visual C++ is a must, for stuff im doing... im just trying to test some applications under multibal OS's
2008-03-08T07:43:00.000Z	leo_rockw	Bradley	frostwire > limewire
2008-03-08T07:43:00.000Z	Bradley	leo_rockw	what is the diffrence, dont they use the same network
2008-03-08T07:43:00.000Z	leo_rockw	Bradley	limewire is capped, unless you get pro
2008-03-08T07:45:00.000Z	Bradley	leo_rockw	wow, that sucks... frostwire it is... lol, does it
2008-03-08T09:07:00.000Z	leo_rockw	Bradley	ubuntu 7.10
2008-03-08T10:29:00.000Z	leo_rockw	Bradley	yes
2008-03-08T10:31:00.000Z	leo_rockw	Bradley	i don't use a virtual machine, i don't need winbugs at all
2008-03-08T10:32:00.000Z	leo_rockw	Bradley	if anything, i use wine
2008-03-08T10:32:00.000Z	leo_rockw	Bradley	the only win app i use is a map of my city
2008-03-08T10:33:00.000Z	leo_rockw	Bradley	wine is a linux implementation of window$ apis
