2007-04-23T13:15:00.000Z	ferronica		worth to buy FOXCONN motherboard
2007-04-23T13:15:00.000Z	ferronica		worth to buy FOXCONN motherboard????
2007-04-23T13:15:00.000Z	kahrytan	ferronica	I would like to know
2007-04-23T13:19:00.000Z	kahrytan	ferronica	did you check Newegg reviews?
2007-04-23T13:20:00.000Z	ferronica	kahrytan	whats there???
2007-04-23T13:20:00.000Z	kahrytan	ferronica	Every manufacturer has their crap boards. Including Asus.
2007-04-23T13:20:00.000Z	kahrytan	ferronica	Newegg sells computer components cheap.
2007-04-23T13:21:00.000Z	kahrytan	ferronica	I plan to buy Asrock transitional board from Newegg.com soon.
2007-04-23T13:21:00.000Z	ferronica	kahrytan	second hand components
2007-04-23T13:21:00.000Z	ferronica	kahrytan	give me the link
2007-04-23T13:22:00.000Z	kahrytan	ferronica	Newegg.com  DVD Burners start at $35-$40. 250gb hdd for around $70.
2007-04-23T13:22:00.000Z	ferronica	kahrytan	why they sell so cheap, are they used item
2007-04-23T13:23:00.000Z	kahrytan	ferronica	They are either new or OEM (no extras, software)
2007-04-23T13:24:00.000Z	ferronica	kahrytan	Do i need credit card to buy
2007-04-23T13:26:00.000Z	kahrytan	ferronica	Newegg's slogan is "Once you know, You newegg." True once you experience their prices and shipping.  Always 3-day business ups. Of course. Paypal works too. You can pre-pay with MO, Cashier's check.
2007-04-23T13:28:00.000Z	ferronica	kahrytan	newegg only for USA?
2007-04-23T13:28:00.000Z	kahrytan	ferronica	Yeah.
2007-04-23T13:29:00.000Z	ferronica	kahrytan	oh
2007-04-23T13:30:00.000Z	kahrytan	ferronica	I guess you aren't in US?
2007-04-23T13:32:00.000Z	ferronica	kahrytan	nope
2007-04-23T13:33:00.000Z	ferronica	kahrytan	how to remove LAN CARD details from ubuntu 7.04
2007-04-23T13:33:00.000Z	ferronica	kahrytan	changed my MOBO with onboard LAN
2007-04-23T13:34:00.000Z	ferronica	kahrytan	Previous mobo without onboard LAN
2007-04-23T13:34:00.000Z	kahrytan	ferronica	Tigerdirect.com has International ordering.
