2007-07-06T05:22:00.000Z	hende		hey somebody refered me to a thread but what its telling me to do is not working would somebody mind helping??? the thread is http://ubuntuforums.org/showthread.php?t=190177 its about wifi with broadcom 4318
2007-07-06T05:23:00.000Z	Jordan_U	hende	have you tried fwcutter before ndis wrapper?
2007-07-06T05:25:00.000Z	Jordan_U	hende	Why on another channel?
2007-07-06T05:26:00.000Z	Jordan_U	hende	Undo whatever those instructions said to do and then install bcm43xx-fwcutter from synaptic
2007-07-06T05:33:00.000Z	Jordan_U	hende	Do you know how to undo what those instructions say?
2007-07-06T05:41:00.000Z	Jordan_U	hende	What GPU?
2007-07-06T05:42:00.000Z	Jordan_U	hende	What Video card do you have?
2007-07-06T05:43:00.000Z	Jordan_U	hende	intel?
2007-07-06T05:43:00.000Z	Jordan_U	hende	What is the output of "glxinfo | grep direct" ?
2007-07-06T05:47:00.000Z	Jordan_U	hende	What is the output of "glxinfo | grep direct" ?
2007-07-06T05:48:00.000Z	Jordan_U	hende	It should be just one line, like "direct rendering = yes"
2007-07-06T05:50:00.000Z	Jordan_U	hende	Are you sure you type it in correctly?
2007-07-06T05:51:00.000Z	Jordan_U	hende	There is a space after "grep"
2007-07-06T05:51:00.000Z	Jordan_U	hende	glxinfo | grep direct
2007-07-06T05:52:00.000Z	Jordan_U	hende	What does hardware info say your graphics card is?
2007-07-06T05:55:00.000Z	Jordan_U	hende	try running: "sudo dpkg-reconfigure xserver-xorg -phigh" and choose i810 when asked for a driver
2007-07-06T05:57:00.000Z	Jordan_U	hende	as for your wireless problems, do you know how to undo the instructions that you followed on ubuntuforums.org ?
2007-07-06T05:59:00.000Z	Jordan_U	hende	If that would be easier for you sure
2007-07-06T05:59:00.000Z	Jordan_U	hende	Let me check, what is the link again?
2007-07-06T06:04:00.000Z	Jordan_U	hende	If you havn't got any important data then sure
2007-07-06T06:11:00.000Z	Jordan_U	hende	#ubuntu-classroom is for low traffic support
2007-07-06T06:12:00.000Z	Jordan_U	hende	I am already there :)
2007-07-06T06:36:00.000Z	Jordan_U	hende	never left :)
2007-07-06T07:03:00.000Z	Jordan_U	hende	First lets make it so that your firmware will be updated automatically when new versions come out, open synaptic and install bcm43xx-fwcutter
