2005-11-29T07:46:00.000Z	csezol		how do i update my package list ? Isnt the command apt-get update ?
2005-11-29T07:47:00.000Z	csezol		how to update my apt-get list ?
2005-11-29T07:47:00.000Z	thoreauputic	csezol	yes, with sudo in front of it :)
2005-11-29T07:47:00.000Z	thoreauputic	csezol	 sudo apt-get update
2005-11-29T07:48:00.000Z	csezol	thoreauputic	yes.. but it has to do a lot of things i think.. and it only echoes two rows of text.. ( note: i installed hoary hedgehog today, not yet updated anything.. )
2005-11-29T07:48:00.000Z	thoreauputic	csezol	did you install on a box not connected to the net?
2005-11-29T07:49:00.000Z	csezol	thoreauputic	what do you think ?
2005-11-29T07:49:00.000Z	thoreauputic	csezol	OK you are on hoary now, I take it - so your sources.list is incomplete for some reason I suspect
2005-11-29T07:50:00.000Z	thoreauputic	csezol	have a look at ubotu's URLs below
2005-11-29T07:53:00.000Z	csezol	thoreauputic	what should i do now ?
2005-11-29T07:54:00.000Z	thoreauputic	csezol	use one of those lists and put in /etc/apt/sources.list with , say,  gksudo gedit
2005-11-29T07:54:00.000Z	thoreauputic	csezol	if you are on hoary use the hoary list of course
2005-11-29T08:05:00.000Z	thoreauputic	csezol	to upgrade your whole install, type  sudo apt-get update && sudo apt-get upgrade
2005-11-29T08:06:00.000Z	csezol	thoreauputic	and if i have that package already ? do i have to remove it first ?
2005-11-29T08:06:00.000Z	thoreauputic	csezol	no
2005-11-29T08:07:00.000Z	thoreauputic	csezol	if it's the latest , apt will tell you - else it will upgrade it for you
2005-11-29T08:07:00.000Z	csezol	thoreauputic	thanks
2005-11-29T08:07:00.000Z	thoreauputic	csezol	np :)
2005-11-29T08:09:00.000Z	thoreauputic	csezol	did youmean you wanted to change from hoary to breezy ? (5.10)
2005-11-29T08:09:00.000Z	thoreauputic	csezol	if so that's different
2005-11-29T08:09:00.000Z	csezol	thoreauputic	if possible even to 6.04 f. 1
2005-11-29T08:10:00.000Z	thoreauputic	csezol	ah in that case read the upgrade guide ubotu will spit out
2005-11-29T08:14:00.000Z	thoreauputic	csezol	edubuntu installs educational packages :)
2005-11-29T08:16:00.000Z	csezol	thoreauputic	got it..:)
