2005-03-18T10:54:00.000Z	tsume		how does ubuntu install files?
2005-03-18T10:54:00.000Z	tsume		I mean by the hier
2005-03-18T10:54:00.000Z	tsume		if it installs a package, where does the package go?
2005-03-18T10:55:00.000Z	tsume		 /usr, /usr/local?
2005-03-18T10:55:00.000Z	thoreauputic	tsume	usually /usr
2005-03-18T10:57:00.000Z	thoreauputic	tsume	stuff you build yourself (for instance) can be put in /usr/local
2005-03-18T11:04:00.000Z	thoreauputic	tsume	you can choose manual partitioning
2005-03-18T06:11:00.000Z	tsume	thoreauputic	heh :)
2005-03-31T13:51:00.000Z	thoreauputic	tsume	are you a Puritan or something ? (joking)
2005-03-31T13:51:00.000Z	tsume	thoreauputic	I think you mean.. Omish..
2005-03-31T13:52:00.000Z	thoreauputic	tsume	no, I meant Puritan - but never mind - comparative theology is probably not your subject ;)
2005-03-31T13:52:00.000Z	tsume	thoreauputic	its not my strong area :)
2005-03-31T13:52:00.000Z	tsume	thoreauputic	science leaves no room for poppycock
2005-03-31T13:53:00.000Z	thoreauputic	tsume	ah, well - Einstei liked to play the violin and ride bicycles :)
2005-03-31T14:01:00.000Z	thoreauputic	tsume	so I assume you run Hoary?
2005-03-31T14:01:00.000Z	tsume	thoreauputic	affirmative
2005-03-31T14:02:00.000Z	tsume	thoreauputic	better updated software gets the job done faster than old software
2005-03-31T14:02:00.000Z	thoreauputic	tsume	yes, well - assuming it doesn't crash and burn.... ;-)
2005-03-31T14:02:00.000Z	tsume	thoreauputic	it doesnt
2005-03-31T14:03:00.000Z	thoreauputic	tsume	that's nice
2005-03-31T14:06:00.000Z	thoreauputic	tsume	Australia sucks but, say, Alaska doesn't ? heheh
2005-03-31T14:06:00.000Z	tsume	thoreauputic	not as much
2005-03-31T14:06:00.000Z	tsume	thoreauputic	I like all weather, I just currently feel like being in alaska
2005-12-04T11:02:00.000Z	thoreauputic	tsume	I tend to agree :)
