2004-12-21T07:22:00.000Z	mojo		now I just removed bin version
2004-12-21T07:22:00.000Z	mojo		but the Helix Player entry is still there, not deleted yet
2004-12-21T07:23:00.000Z	mojo		....tough question heh?
2004-12-21T07:24:00.000Z	mojo		please show me the command
2004-12-21T07:24:00.000Z	mojo		I don't know how to use 'grep' and ls
2004-12-21T07:24:00.000Z	mojo		oh
2004-12-21T07:24:00.000Z	mojo		let me try
2004-12-21T07:25:00.000Z	mojo		excuse me
2004-12-21T07:25:00.000Z	mojo		in search tool
2004-12-21T07:25:00.000Z	mojo		what do I type for the file name
2004-12-21T07:25:00.000Z	sayao	mojo	right click the file, and then choose properties
2004-12-21T07:25:00.000Z	sayao	mojo	then go to the "Open with" tab
2004-12-21T07:25:00.000Z	mojo		do I use '*.*'?
2004-12-21T07:25:00.000Z	mojo		oh
2004-12-21T07:26:00.000Z	sayao	mojo	select helix player and click remove
2004-12-21T07:26:00.000Z	mojo	sayao	I know what u mean, but my eintries can't be deleted, the Remove button is disabled
2004-12-21T07:26:00.000Z	sayao		humm
2004-12-21T07:26:00.000Z	mojo		I think
2004-12-21T07:26:00.000Z	mojo		in the next version
2004-12-21T07:27:00.000Z	mojo		GNOME should resolve this issue
2004-12-21T07:27:00.000Z	sayao		maybe its a permission problem
2004-12-21T07:27:00.000Z	sayao		try it with sudo nautilus
2004-12-21T07:27:00.000Z	mojo		I'm still searching for files contains Helix word
2004-12-21T07:27:00.000Z	mojo	sayao	I did, it won't butch
