2010-02-19T18:37:00.000Z	jackbrown		guys i'm experiencing problems with usb-creator-gtk ? Can anyone help me ?
2010-02-19T18:38:00.000Z	jackbrown		usb-creator-gtk i'm running Ubuntu 9.10 when i hope USB Creator the GUI appears but i'm unable to add an .iso image (it's a linux distro )
2010-02-19T18:39:00.000Z	jackbrown		?
2010-02-19T18:39:00.000Z	Dr_Willis	jackbrown	 is it a Ubuntu/varuabt disrto?
2010-02-19T18:39:00.000Z	jackbrown	Dr_Willis	thanks for answer no it's Anonymous OS Linux.iso
2010-02-19T18:40:00.000Z	Dr_Willis	jackbrown	 I think that tool only works with ubuntu relateive
2010-02-19T18:40:00.000Z	Dr_Willis	jackbrown	 try unetbootin
2010-02-19T18:40:00.000Z	jackbrown	Dr_Willis	thanks may be you are right
2010-02-19T18:41:00.000Z	jackbrown	Dr_Willis	can't find the package for ubuntu 9.10 https://launchpad.net/~gezakovacs/+archive/ppa
2010-02-19T18:42:00.000Z	Dr_Willis	jackbrown	 did you do a 'sudo apt-get update' 'sudo apt-get upgrade' THEN try installing it with 'sudo apt-get install wvdial' ?
2010-02-19T18:42:00.000Z	jackbrown	Dr_Willis	no iu willl try to use these commands tnx
2010-02-19T18:43:00.000Z	Dr_Willis	jackbrown	 thats why i said to update/upgrade/try again
2010-02-19T18:43:00.000Z	jackbrown	Dr_Willis	first step sudo apt-get update is workgin
2010-02-21T14:25:00.000Z	jackbrown	Dr_Willis	could u give me an help too ?
2010-02-21T14:26:00.000Z	Dr_Willis	jackbrown	 is there some specific issue with your sources.list?
2010-02-21T14:27:00.000Z	jackbrown	Dr_Willis	yes i'm unable to upgrade packages correctly,
2010-02-21T14:28:00.000Z	Dr_Willis	jackbrown	 so what happens if you 'sudo apt-get update' 'sudo apt-get upgrade' ?
2010-02-21T14:33:00.000Z	jackbrown	Dr_Willis	i got this error trying to upgrade http://www.pastebin.com/d5cc3899c
2010-02-21T14:34:00.000Z	Dr_Willis	jackbrown	 looks like the server may haev a bad file.
2010-02-21T14:34:00.000Z	jackbrown	Dr_Willis	did u take a look to my sources.list ?
2010-02-21T14:35:00.000Z	Dr_Willis	jackbrown	 the sources list wont make a single file itd downloading bad..
2010-02-21T14:35:00.000Z	Dr_Willis	jackbrown	 if the server has a bad/goofed up file.. well the server has a bad file. Try a diffrent server for archive.ubuntu.com
