2009-06-26T08:53:00.000Z	ctmjr	sebsebseb	since when when is banshee small and lite?
2009-07-21T08:40:00.000Z	ctmjr	sebsebseb	thanks you have them memorized?
2009-07-21T08:41:00.000Z	sebsebseb	ctmjr	well I didn't know what language  he was speaking, but then you gave it away
2009-07-24T02:28:00.000Z	sebsebseb	ctmjr	dosn't mention the repo for KDE 3, or  not clearly if it does
2009-07-24T02:29:00.000Z	ctmjr	sebsebseb	http://www.kde.org/info/3.5.10.php
2009-07-31T01:38:00.000Z	ctmjr	sebsebseb	really wow
2009-07-31T01:39:00.000Z	sebsebseb	ctmjr	something that we may agree on though, is how KDE4 is bloated
2009-09-22T07:07:00.000Z	sebsebseb	ctmjr	no he is still here
2009-09-22T07:08:00.000Z	ctmjr	sebsebseb	yea wrong factoid my mistake
2009-09-22T07:09:00.000Z	sebsebseb	ctmjr	np
2009-10-02T04:19:00.000Z	sebsebseb	ctmjr	still about?
2009-10-02T04:20:00.000Z	ctmjr	sebsebseb	yes
2009-10-02T04:21:00.000Z	sebsebseb	ctmjr	You know about  configuring web cams in Ubuntu and also cheese yes?   If so  hopefuly you can help  sadrolla
2009-10-02T04:23:00.000Z	sebsebseb	ctmjr	lsusb ==> Bus 002 Device 003: ID 0c45:613a Microdia PC Camera (SN9C120)
2009-12-01T04:01:00.000Z	sebsebseb	ctmjr	thank them for that why what?
2009-12-01T04:06:00.000Z	ctmjr	sebsebseb	use to be you watch a tv show on the internet it stored a copy in a tmp file to speed up buffering then you just copied the file to another dir and renamed it you then had a copy of the show but hulu and apple do not store acopy on your computer and most every other site followed
2009-12-01T04:06:00.000Z	sebsebseb	ctmjr	oh right well copyright etc
2009-12-01T04:07:00.000Z	ctmjr	sebsebseb	exactly
2009-12-17T00:36:00.000Z	ctmjr	sebsebseb	the bot is lagging pretty bad might have something to do with the problems freenode is having
2009-12-17T00:36:00.000Z	sebsebseb	ctmjr	it said that the bot left
2009-12-17T00:37:00.000Z	ctmjr	sebsebseb	oh ok i turned off join/parts do to all the netsplits
2009-12-17T00:38:00.000Z	sebsebseb	ctmjr	oh ok,  well yes it will flood with peoples name when they leave or re join, but  it could be useful to see that, so you know if things are working properly or not
