2009-10-27T12:07:00.000Z	ubuntunewbie		hi , anyone know how to update ubuntu kernel using command line at terminal ?
2009-10-27T12:07:00.000Z	ubuntunewbie		thank you
2009-10-27T12:09:00.000Z	kenyon	ubuntunewbie	sudo aptitude update && sudo aptitude full-upgrade
2009-10-27T12:10:00.000Z	ubuntunewbie	kenyon	how do I check my kernel version on terminal ?
2009-10-27T12:11:00.000Z	kenyon	ubuntunewbie	uname -a
2009-10-27T12:11:00.000Z	ubuntunewbie	kenyon	oh , thanks what is sudo aptitude full-upgrade ? is it upgrade my version of ubuntu ?
2009-10-27T12:11:00.000Z	ubuntunewbie	kenyon	I am using ubuntu 8.04
2009-10-27T12:12:00.000Z	kenyon	ubuntunewbie	it upgrades packages, but not your ubuntu version
2009-10-27T12:18:00.000Z	ubuntunewbie	kenyon	Do you know how to fix ubutu if the kernel is corrupted ?
2009-10-27T12:19:00.000Z	kenyon	ubuntunewbie	define "kernel is corrupted"
2009-10-27T12:20:00.000Z	ubuntunewbie	kenyon	yesterday my ubuntu crash so I press reset button then , I can't boot to ubuntu .I choose recovery and things get worst .whne I boot all the chracter are in square unreadable http://img76.imageshack.us/i/screenshot1ye7.png.
2009-10-27T12:21:00.000Z	kenyon	ubuntunewbie	404 - Not Found
2009-10-27T12:24:00.000Z	ubuntunewbie	kenyon	sorry http://img48.imageshack.us/i/screenshotml0.png
2009-10-27T12:24:00.000Z	kenyon	ubuntunewbie	404 - Not Found
2009-10-27T12:25:00.000Z	ubuntunewbie	kenyon	 http://img48.imageshack.us/img48/9766/screenshotml0.png try again
2009-10-27T12:26:00.000Z	ubuntunewbie	kenyon	this one work http://img48.imageshack.us/img48/9766/screenshotml0.png
2009-10-27T12:27:00.000Z	ubuntunewbie	kenyon	all character are in square , I can't read anything at all
2009-10-27T12:27:00.000Z	kenyon	ubuntunewbie	I see it. I know it has nothing to do with the kernel, but I don't know how to fix that.
2009-10-27T12:28:00.000Z	ubuntunewbie	kenyon	uhm... so anyway to understand what cause of the problem ?
2009-10-27T12:28:00.000Z	kenyon	ubuntunewbie	looks like some kind of problem with the fonts
2009-10-27T12:28:00.000Z	ubuntunewbie	kenyon	anyway to fix it ?
2009-10-27T12:29:00.000Z	ubuntunewbie	kenyon	I did modified the font to segoe UI fonts , how t oreset it to be default?
