2008-12-08T02:21:00.000Z	garganeoiii		i have a problem with my graphic card drivers: there seems to be a problem with the nvidia 71... drivers so i have to isntall them manually (thats written in many forums) I downloaded them and launched the installation after shutting down the X server
2008-12-08T02:21:00.000Z	garganeoiii		but i get this error
2008-12-08T02:21:00.000Z	garganeoiii		no kernel interface was found
2008-12-08T02:21:00.000Z	garganeoiii		and it tries to download
2008-12-08T02:22:00.000Z	garganeoiii		kernel interface from nvidia ftp site but
2008-12-08T02:22:00.000Z	garganeoiii		at the end
2008-12-08T02:22:00.000Z	garganeoiii		i get this error
2008-12-08T02:22:00.000Z	garganeoiii		unable to build the NVIDIA kernel module
2008-12-08T02:22:00.000Z	garganeoiii		please help :S
2008-12-08T02:22:00.000Z	jrib	garganeoiii	use the repositories luke
2008-12-08T02:23:00.000Z	garganeoiii	jrib	what is this ?
2008-12-08T02:23:00.000Z	jrib	garganeoiii	just use System -> Administration -> Hardware Drivers to install nvidia drivers
2008-12-08T02:24:00.000Z	garganeoiii	jrib	 i tried this
2008-12-08T02:31:00.000Z	jrib	garganeoiii	so what happened when you tried Hardware Drivers?
2008-12-08T02:32:00.000Z	garganeoiii	jrib	 well ... as far as i know there is a problem with this very same video card - the drivers should be installed manually
2008-12-08T02:32:00.000Z	jrib	garganeoiii	what card?  And how do you know this?
2008-12-08T02:33:00.000Z	garganeoiii	jrib	 geforce2 mx/mx 400 and i know this because ive been reading forums since yesterday :S
2008-12-08T02:33:00.000Z	jrib	garganeoiii	what version of ubuntu?
2008-12-08T02:33:00.000Z	jrib	garganeoiii	is your card mentioned in the release notes?
2008-12-08T02:34:00.000Z	garganeoiii	jrib	 hmmm i dont know
2008-12-08T02:38:00.000Z	garganeoiii	jrib	 Thanks alot : my video card seems to be too old and the drivers that 8.10 provides do not support 3d .... But there is something else i would like to ask you
2008-12-08T02:39:00.000Z	jrib	garganeoiii	you need to give the exact error
