2009-01-29T14:25:00.000Z	mib		hi
2009-01-29T14:25:00.000Z	mib		anyone knows what happen when i try to transfer a file from one drive to another
2009-01-29T14:25:00.000Z	mib		and it gives me the error
2009-01-29T14:25:00.000Z	mib		Operation not suported
2009-01-29T14:26:00.000Z	mib		i have umount and mounted using ntfs-3g
2009-01-29T14:26:00.000Z	mib		pls advise
2009-01-29T14:26:00.000Z	dayo	mib	how are u transfering?
2009-01-29T14:27:00.000Z	dayo	mib	from where to where?
2009-01-29T14:28:00.000Z	dayo	mib	where are u executing from?
2009-01-29T14:28:00.000Z	dayo	mib	what is the fs type and the ext hdd fs type?
2009-01-29T14:29:00.000Z	dayo	mib	u're trying to output to the ext hdd?
2009-01-29T14:29:00.000Z	dayo	mib	type: mount
2009-01-29T14:29:00.000Z	dayo	mib	in your terminal
2009-01-29T14:31:00.000Z	mib	dayo	, im trying to copy the output to an external file within the fs
2009-01-29T14:32:00.000Z	dayo	mib	ok, u're copying from within ubuntu to another spot within ubuntu?
2009-01-29T14:34:00.000Z	dayo	mib	i don't get how the external comes into play, though. what are the directories u're copying from/to? did u check the permissions?
2009-01-29T14:35:00.000Z	dayo	mib	paste the exact command u're using
2009-01-29T14:37:00.000Z	dayo	mib	u're executing touch on the external ntfs?
2009-01-29T14:40:00.000Z	dayo	mib	hang on
2009-01-29T14:45:00.000Z	dayo	mib	try to copy something that is larger than 1KB
2009-01-29T14:46:00.000Z	dayo	mib	is it possible for u to reformat the external to fat32 or even ext3?
2009-01-29T14:52:00.000Z	dayo	mib	u still there?
