2009-09-25T02:05:00.000Z	shawn_		Alright so this is what I have in my computer a Core2 duo , a P965 motherboard and 6GB of DDR2 RAM... I just switched to the 64 bit version of Ubuntu why is my RAM not showing up in the System Monitor tool thing on my toolbar
2009-09-25T02:06:00.000Z	ActionParsnip	shawn_	try the command: free
2009-10-12T18:22:00.000Z	shawn_	ActionParsnip	Newest stable yeah 3.5 is the one I think
2011-09-25T22:05:00.000Z	ActionParsnip	shawn_	run: alsamixer   are all levels unmuted and cranked?
2011-09-25T22:07:00.000Z	ActionParsnip	shawn_	can you give the url generated by: wget -O alsa-info.sh http://www.alsa-project.org/alsa-info.sh; chmod +x ./alsa-info.sh; ./alsa-info.sh
2011-09-25T22:11:00.000Z	ActionParsnip	shawn_	i'd add the text from the generated link to your forum
2011-09-25T22:16:00.000Z	ActionParsnip	shawn_	try: options snd-hda-intel model=targa-dig-8ch    in /etc/modprobe.d/alsa-base.conf  and reboot, may help
2011-09-25T22:16:00.000Z	ActionParsnip	shawn_	you need to find the option to make yours work
2012-02-21T12:45:00.000Z	ActionParsnip	shawn_	most will be
2012-02-21T12:47:00.000Z	ActionParsnip	shawn_	what video have you seen?
2012-02-21T12:47:00.000Z	ActionParsnip	shawn_	oh you mean flash isn't working?
2012-02-21T12:48:00.000Z	ActionParsnip	shawn_	can you use a PASTEBIN and give the output of:  lsb_release -a; uname -a; dpkg -l | egrep 'flash|gnash|swf|spark'
2012-02-21T12:49:00.000Z	ActionParsnip	shawn_	I said pastebin. I even put it in caps...
2012-02-21T12:50:00.000Z	ActionParsnip	shawn_	think about it....
2012-02-21T12:50:00.000Z	ActionParsnip	shawn_	I put it in caps
2012-02-21T12:50:00.000Z	ActionParsnip	shawn_	why did you STILL paste in here
2012-02-21T12:51:00.000Z	ActionParsnip	shawn_	If yo make a pastebin that wont't happen, which is why I said to make a pastebin...
2012-02-21T12:53:00.000Z	ActionParsnip	shawn_	paste the text in the pastebin, and click the paste button. When the screen changes copy the new url in the address bar and paste THAT in the channel
2012-02-21T12:56:00.000Z	ActionParsnip	shawn_	if you dodn't know, why didn't you ask how to use the pastebin?
2012-02-21T12:57:00.000Z	ActionParsnip	shawn_	what is the output of:    dpkg -l | egrep 'flash|gnash|swf|spark'
2012-02-21T12:57:00.000Z	ActionParsnip	shawn_	good enogh :)
2012-02-21T12:59:00.000Z	ActionParsnip	shawn_	http://paste.ubuntu.com/851037/
