2008-01-06T15:08:00.000Z	khermans	blacklines	no
2008-01-06T15:03:00.000Z	khermans	blacklines	?
2008-01-06T15:07:00.000Z	blacklines	khermans	did you get my message?
2008-01-06T15:09:00.000Z	khermans	blacklines	what chopset of model pc?
2008-01-06T15:11:00.000Z	khermans	blacklines	thats not the model
2008-01-06T15:12:00.000Z	khermans	blacklines	how about sudo lshw ?
2008-01-06T15:13:00.000Z	blacklines	khermans	"        *-multimedia
2008-01-06T15:15:00.000Z	khermans	blacklines	should work on gusty
2008-01-06T15:15:00.000Z	khermans	blacklines	time to upgrade :-)
2008-01-06T15:16:00.000Z	khermans	blacklines	what changed, kernel update?
2008-01-06T15:16:00.000Z	khermans	blacklines	you can try an older kernel
2008-01-06T15:20:00.000Z	khermans	blacklines	http://ubuntuforums.org/showthread.php?p=4076647
2008-01-06T15:30:00.000Z	khermans	blacklines	if you got $$$ you can buy support contract from canonical if you cant figure it out
2008-01-06T15:31:00.000Z	blacklines	khermans	ill pass :p
2008-01-06T15:58:00.000Z	blacklines	khermans	I dont know if itll help at all, but im getting an error when compiling the drivers for my soundcard--I saved the output from the buildlog and posted it here: http://ubuntuforums.org/showthread.php?t=656008
2008-01-06T15:58:00.000Z	khermans	blacklines	why are you doing that if it worked before?
2008-01-06T16:00:00.000Z	khermans	blacklines	did you build from latest source?
2008-01-06T16:00:00.000Z	blacklines	khermans	i checked it on alsa project
2008-01-06T16:00:00.000Z	khermans	blacklines	then the source may be too new for your old feisty kernel?
2008-01-06T16:01:00.000Z	blacklines	khermans	what does flash have to do with this?  sorry--i think im missing something here
2008-01-06T16:02:00.000Z	khermans	blacklines	i would either figure out why it broke from thinking what you did or check logs -- otherwise upgrade ot gutsy
2008-01-06T16:02:00.000Z	khermans	blacklines	sudo do-release-upgrade
