2007-07-23T10:14:00.000Z	rampy		but i don't see any option for WPA-PSK
2007-07-23T10:14:00.000Z	rampy		i downloaded wpasupplicant
2007-07-23T10:14:00.000Z	rampy		but still it does not work
2007-07-23T10:15:00.000Z	rampy		Does anyone know how to configure intel prowireless 2200 for WPA-PSK
2007-07-23T10:15:00.000Z	rampy		does anyone know to to add mac like panel in ubuntu?
2007-07-23T10:17:00.000Z	rampy		i am using  6.06 LTS
2007-07-23T10:17:00.000Z	rampy		and how to configure intel prowireless 2200 for WPA-PSk?
2007-07-23T10:17:00.000Z	rampy		can anyone help me for WPA-PSK configuration?
2007-07-23T10:18:00.000Z	rampy		can anyone help me for WPA-PSK configuration?
2007-07-23T10:19:00.000Z	rampy		can anyone help me  with  WPA-PSK configuration, My WEP works?
2007-07-23T10:19:00.000Z	triden1	rampy	What do you use to connect now?
2007-07-23T10:19:00.000Z	rampy	triden1	 i am using ethernet now
2007-07-23T10:20:00.000Z	rampy	triden1	 my wep works..i am using intel pro wireless 2200 with  6.06 lts system
2007-07-23T10:20:00.000Z	triden1	rampy	Hum, I'll try to go look too.
2007-07-23T10:21:00.000Z	rampy	triden1	i  tried some solutions online but nothing seems to work including wpa supplicant
2007-07-23T10:21:00.000Z	triden1	rampy	Try installing the beta network manager: https://help.ubuntu.com/community/WifiDocs/NetworkManager
2007-07-23T10:22:00.000Z	rampy	triden1	i tried network manager too but nothing works...i don't get the WPA-PSK option at all
2007-07-23T10:23:00.000Z	triden1	rampy	Hm, sorry I'm of no help, my connection to WPA works with my atheroscard.
2007-07-23T10:23:00.000Z	rampy	triden1	 do u get WPA option?
2007-07-23T10:23:00.000Z	triden1	rampy	 Yup, connected to my WPA router right now.
2007-07-23T10:46:00.000Z	rampy	triden1	 finally my wpa works ...do u know how to install firefox 2 in 6.06
2007-07-23T10:46:00.000Z	triden1	rampy	Try searching for firefox 2 .deb.
