2007-09-26T07:25:00.000Z	NotSure		how do i recompile hid-core.c?
2007-09-26T07:25:00.000Z	NotSure		i need it because i included my device in the black list
2007-09-26T07:27:00.000Z	NotSure		yes!!!
2007-09-26T07:27:00.000Z	NotSure		Idiocracy will become the CULT MOVIE of all times
2007-09-26T07:27:00.000Z	NotSure		no it was absolutely forever AWESOME!!
2007-09-26T07:29:00.000Z	NotSure		all right, back to business, Pres. Komacho, how do i compile hid-core.c w/o erros? it gives me about a 1000 dependency errors after i place hid-core.c into my own directory. Tell me how to configure it properly
2007-09-26T07:31:00.000Z	NotSure		ok folks, here it comes again: how do i properly compile hid-core.c?
2007-09-26T07:32:00.000Z	NotSure		hid-core.c ?! How do I compile it?
2007-09-26T07:32:00.000Z	NotSure		all right, but what should i do?
2007-09-26T07:33:00.000Z	NotSure		yes, just wait, what is paste bin?
2007-09-26T07:33:00.000Z	peabody	NotSure	pastebin is a web site where you can post text
2007-09-26T07:34:00.000Z	NotSure		ok, wait, i will post it there, but it is really because i placed it in my own directory
2007-09-26T07:34:00.000Z	NotSure		wait, let me see what happens if i compile it when it is in the directory with other files from linux source
2007-09-26T07:35:00.000Z	NotSure		wait! what configure?
2007-09-26T07:35:00.000Z	peabody	NotSure	what gamepad are you trying to get working again?
2007-09-26T07:35:00.000Z	NotSure		Rumble Pad 2 Logitech USB
2007-09-26T07:35:00.000Z	NotSure		I wrote my own driver
2007-09-26T07:35:00.000Z	NotSure		but HID takes over
2007-09-26T07:36:00.000Z	NotSure		i need to modify hid-core.c
2007-09-26T07:36:00.000Z	NotSure		so it does not take over my driver
2007-09-26T07:36:00.000Z	peabody	NotSure	Okay nevermind, if your writing your own drivers then that's over my head, good luck :)
2007-09-26T07:36:00.000Z	NotSure	peabody	ok docy..
