2007-01-15T06:55:00.000Z	BenFP		why  is it so complicated to get apps on here that aren't in the add/remove section?
2007-01-15T06:55:00.000Z	BenFP		how do i get this ntfs-3g driver?
2007-01-15T06:57:00.000Z	BenFP		ahhh thank you :)
2007-01-15T06:58:00.000Z	BenFP		eh how do i open all repos??
2007-01-15T06:58:00.000Z	BenFP		OoOo and where is that?
2007-01-15T06:59:00.000Z	BenFP		lol i am on ubuntu.. but extremely new :P
2007-01-15T06:59:00.000Z	BenFP		ok i found it :P
2007-01-15T07:00:00.000Z	bruenig	BenFP	close synaptic and run the following command to add all repos, sudo sed -e 's/# deb/deb/g' -e 's/edgy universe/edgy universe multiverse/g' -e 's/edgy-security universe/edgy-security universe multiverse/g' -i.backup /etc/apt/sources.list && sudo apt-get update
2007-01-15T07:00:00.000Z	bruenig	BenFP	applications>accessories>terminal
2007-01-15T07:00:00.000Z	bruenig	BenFP	just paste it in there
2007-01-15T07:02:00.000Z	bruenig	BenFP	hopefully more letter than numbers
2007-01-15T07:03:00.000Z	bruenig	BenFP	close synaptic
2007-01-15T07:04:00.000Z	bruenig	BenFP	then run sudo apt-get update in terminal again
2007-01-15T07:04:00.000Z	bruenig	BenFP	synaptic package manager needs to be closed
2007-01-15T07:05:00.000Z	bruenig	BenFP	synaptic is a program that you are running, it should be on the bottom in the task list
2007-01-15T07:05:00.000Z	bruenig	BenFP	when you close that, run sudo apt-get update
2007-01-15T07:06:00.000Z	bruenig	BenFP	apt-get is a command line program that synaptic uses, so you can't have synaptic open while you are doing apt-get commands
2007-01-15T07:07:00.000Z	bruenig	BenFP	do what it says copy and paste "sudo apt-get update"
2007-01-15T07:11:00.000Z	bruenig	BenFP	do sudo apt-get install ntfs-3g
2007-01-15T07:12:00.000Z	bruenig	BenFP	restart on linux.... no
2007-01-15T07:20:00.000Z	bruenig	BenFP	mount -a mounts all of the drives in the fstab
2007-01-15T07:21:00.000Z	bruenig	BenFP	yes
