2011-08-03T10:51:00.000Z	haikaido		said your nick twice
2011-08-03T10:51:00.000Z	haikaido		my bad
2011-08-03T10:51:00.000Z	haikaido		xD
2011-08-03T10:52:00.000Z	haikaido		i alraedy installed CompizControl Settings Manager
2011-08-03T10:53:00.000Z	haikaido		well i asked in #compiz
2011-08-03T10:53:00.000Z	haikaido		but they seem to be dead at the moment
2011-08-03T10:53:00.000Z	haikaido		heh
2011-08-03T10:55:00.000Z	haikaido		theres a line in sources.list it doesnt like magpii
2011-08-03T10:55:00.000Z	haikaido		or
2011-08-03T10:55:00.000Z	haikaido		a line is missing
2011-08-03T10:55:00.000Z	magpii	haikaido	how can i resolve it?
2011-08-03T10:56:00.000Z	magpii	haikaido	trying to update the wine repo but the #winehq channel sent me here instead
2011-08-03T10:57:00.000Z	magpii	haikaido	?
2011-08-03T11:06:00.000Z	magpii	haikaido	 this is the link to the error and the sources.list file opened in text editor. http://paste.ubuntu.com/657703/
2011-08-03T11:06:00.000Z	magpii	haikaido	can you tell me whats wrong?
2011-08-03T11:08:00.000Z	magpii	haikaido	 yeah, when i try installing the ppa for wine, it wont let me
2011-08-03T11:08:00.000Z	magpii	haikaido	the ppa for wine is from the winehq official site too
2011-08-03T11:11:00.000Z	magpii	haikaido	 i have tried half a dozon times now, even rebooted my system, this is a link to my terminal imput http://paste.ubuntu.com/657705/
2011-08-03T11:11:00.000Z	magpii	haikaido	 i tried the winehq channel and they shoved me on here
2011-08-03T11:14:00.000Z	magpii	haikaido	no worries, thanks anyway
2011-08-03T11:15:00.000Z	magpii	haikaido	 will try now
2011-08-03T11:20:00.000Z	magpii	haikaido	 do u know if i can reset my software sources to the ubuntu default?
