2012-05-05T17:36:00.000Z	neweruser123		yes its a UK keyboard but the layout is not familiar
2012-05-05T17:37:00.000Z	neweruser123		oh ok
2012-05-05T17:38:00.000Z	neweruser123		I looked at a youtube video it showed how to open Gparted but the menu is different on mine
2012-05-05T17:38:00.000Z	neweruser123		where is the old menu gone?
2012-05-05T17:39:00.000Z	neweruser123		unity looks for tablets? or is it for desktops
2012-05-05T17:39:00.000Z	neweruser123		how can i switch back to the old one
2012-05-05T17:40:00.000Z	neweruser123		oh
2012-05-05T17:40:00.000Z	neweruser123		latest ubuntu 64bit
2012-05-05T17:40:00.000Z	neweruser123		What is kubuntu is it for me?
2012-05-05T17:41:00.000Z	neweruser123		What is KDE? a different interface or different OS ?
2012-05-05T17:41:00.000Z	MonkeyDust	neweruser123	 it looks a bit more like windows
2012-05-05T17:42:00.000Z	MonkeyDust	neweruser123	 yes, it's just a different 'jacket'
2012-05-05T17:43:00.000Z	MonkeyDust	neweruser123	 what you see is different, underneath it's the same
2012-05-05T17:47:00.000Z	MonkeyDust	neweruser123	 linu is just a kernel, a distro is everything around that kernel
2012-05-05T17:50:00.000Z	MonkeyDust	neweruser123	 yes, you can do that in the menu called lightdm
2012-05-05T17:55:00.000Z	MonkeyDust	neweruser123	 using gparted? ntfs is windows
2012-05-05T17:56:00.000Z	MonkeyDust	neweruser123	 don't delete anything if you're not sure
2012-05-05T17:57:00.000Z	MonkeyDust	neweruser123	 in a terminal, type sudo fdisk -l|pastebinit and paste the url in the channel
2012-05-05T17:58:00.000Z	MonkeyDust	neweruser123	 sudo fdisk -l
2012-05-05T18:01:00.000Z	MonkeyDust	neweruser123	 that's three ntfs partitions, normally windows is on sda1, but we have to be sure
2012-05-05T18:03:00.000Z	MonkeyDust	neweruser123	 in a terminal type mkdir windows;sudo mount /dev/sda2 windows
2012-05-06T18:09:00.000Z	MonkeyDust	neweruser123	 in a terminal, type alsamixer - if you see MM (mute), go there and press m
