2011-04-05T15:48:00.000Z	epzil0n		for what satya?
2011-04-05T15:48:00.000Z	satya	epzil0n	wireless could not connect in ubuntu maverick
2011-04-05T15:49:00.000Z	satya	epzil0n	wireless network could not connect in ubuntu maverick
2011-04-05T15:50:00.000Z	epzil0n	satya	ok have you checked that you are using the same encryption as the router does?
2011-04-05T15:50:00.000Z	satya	epzil0n	yes
2011-04-05T15:53:00.000Z	epzil0n		ok, maybe enabling backports could solve it
2011-04-05T15:57:00.000Z	satya	epzil0n	 the output  of lshw is http://pastebin.com/fbbqjgZ5
2011-04-05T15:59:00.000Z	satya	epzil0n	 the output of iwconfig, does not show the wireless interface
2011-04-05T16:02:00.000Z	satya		iwconfig output does not show  wireless interface
2011-04-05T16:02:00.000Z	satya		how to do it
2011-04-05T16:04:00.000Z	epzil0n	satya	if you run sudo lshw -C network does it show your wireless interface?
2011-04-05T16:09:00.000Z	satya	epzil0n	no. the output of sudo lshw -C network does not show the wireless interface.
2011-04-05T16:11:00.000Z	epzil0n	satya	ok, have to look into that.. did it work under 10.04 or is this the first Ubuntu you have on it?
2011-04-05T16:14:00.000Z	satya	epzil0n	it is the first ubuntu
2011-04-05T16:16:00.000Z	satya	epzil0n	it is the first ubuntu on this laptop
2011-04-05T16:16:00.000Z	epzil0n	satya	ok
2011-04-05T16:18:00.000Z	satya	epzil0n	how to do it?
2011-04-05T16:18:00.000Z	epzil0n	satya	some suggest this: sudo rfkill unblock all and then check the output of sudo lshw -C network again
2011-04-05T16:20:00.000Z	satya	epzil0n	same output. no change
2011-04-05T16:22:00.000Z	satya	epzil0n	the output of sudo lshw -C network is http://pastebin.com/YFrTQ6Q7
2011-04-05T16:23:00.000Z	epzil0n	satya	ok no luck with that.. your wifi card is BCM4312 802.11b/g LP-PHY so try googling that
2011-04-05T16:23:00.000Z	satya	epzil0n	ok
