2006-03-15T17:54:00.000Z	dan_		haha
2006-03-15T06:10:00.000Z	dan_		umm
2006-03-15T06:10:00.000Z	dan_		hmm
2006-03-15T06:10:00.000Z	dan_		does anyone know how to install firefox 1.5?
2006-03-15T06:10:00.000Z	dan_		I don't wanna run inferior firefox anymore
2006-03-15T06:11:00.000Z	dan_		thank you
2006-03-15T06:12:00.000Z	dan_		umm, why would you hate firefox 1.5?
2006-03-15T06:13:00.000Z	dan_		also, has anyone here had any experience with installing XGL on ubuntu?
2006-03-15T06:13:00.000Z	dan_		the live CD worked, so it should work for me
2006-03-15T06:13:00.000Z	dan_		but we shall see
2006-03-15T06:13:00.000Z	Amaranth	dan_	it's in dapper
2006-03-15T06:13:00.000Z	dan_	Amaranth	yes, but I want it now =P
2006-03-15T06:14:00.000Z	Amaranth	dan_	so compile Xorg 7.0, xgl, and compiz from source or use dapper
2006-03-15T06:15:00.000Z	dan_	Amaranth	what's dapper?
2006-03-15T06:15:00.000Z	Amaranth	dan_	code name for the next release of ubuntu
2006-03-15T06:15:00.000Z	Amaranth	dan_	You're going to break your system.
2006-03-15T06:16:00.000Z	Amaranth	dan_	I've been doing this stuff for years and I wouldn't trust myself to compile xorg
2006-03-15T06:17:00.000Z	dan_	Amaranth	that sucks, why is it so hard?
2006-03-15T06:18:00.000Z	Amaranth	dan_	because xorg is a bunch of pieces of code that work together in weird ways, but only if you sacrifice your first-born first
2006-03-15T06:18:00.000Z	dan_	Amaranth	haha
2006-03-15T06:23:00.000Z	Amaranth	dan_	firefox, yes
2006-03-15T06:23:00.000Z	Amaranth	dan_	xgl, no
