2010-09-24T08:46:00.000Z	enav		.class files are the binary outcome of compitation procces
2010-09-24T08:47:00.000Z	Esat	enav	are there language codes ?
2010-09-24T08:49:00.000Z	Esat	enav	Java Class Editor is not compilator?
2010-09-24T08:58:00.000Z	enav	Esat	what app you want to translate
2010-09-24T08:59:00.000Z	Esat	enav	Electrical CAD system which in in Ubuntu repositories
2010-09-24T08:59:00.000Z	enav	Esat	and what language?
2010-09-24T09:01:00.000Z	enav	Esat	withc language you want to translate to
2010-09-24T09:01:00.000Z	Esat	enav	Turkish
2010-09-24T09:02:00.000Z	enav	Esat	let me help you with this...  translating is a good way to collaborate with open source comunity
2010-09-24T09:03:00.000Z	Esat	enav	: i am waiting your answer
2010-09-24T09:03:00.000Z	enav	Esat	 im cheking electrical CAD web site
2010-09-24T09:03:00.000Z	enav	Esat	give me a sec
2010-09-24T09:03:00.000Z	Esat	enav	: ok
2010-09-24T09:07:00.000Z	enav	Esat	where you get the source
2010-09-24T09:08:00.000Z	Esat	enav	 i dowanloaded the .deb
2010-09-24T09:08:00.000Z	enav	Esat	are you java programmer?
2010-09-24T09:08:00.000Z	Esat	enav	 no
2010-09-24T09:09:00.000Z	Esat	enav	if you want i can type what folder are there
2010-09-24T09:10:00.000Z	enav	Esat	the best you can do is contac the development team of this software here http://www.gnu.org/software/electric/    and request the language pack to do a new translation... or just request support from the development team to get information about how to translate that software
2010-09-24T09:11:00.000Z	Esat	enav	,  had better to do that
2010-09-24T09:12:00.000Z	enav	Esat	translate a program is not like translate a openoffice document...   is not impossible but need some theoretical firmament to do that....    just contac the development team... im sure they will be happy to have a translator
2010-09-24T09:13:00.000Z	Esat	enav	: i am trying to contact with them
2010-09-24T09:13:00.000Z	Esat	enav	 thank you so much
