2009-06-20T20:02:00.000Z	wizzo50		No one likes to answer my questions on here.
2009-06-20T20:04:00.000Z	wizzo50		FireStart I just happen to see it on mibbit and didn't know what it meant
2009-06-20T20:05:00.000Z	wizzo50		You don't- I tried it with the TAB
2009-06-20T20:05:00.000Z	wizzo50		#ubuntu
2009-06-20T20:05:00.000Z	wizzo50		on here
2009-06-20T20:05:00.000Z	bazhang	wizzo50	xchat? pidgin?
2009-06-20T20:06:00.000Z	bazhang	wizzo50	but which irc app
2009-07-18T13:43:00.000Z	bazhang	wizzo50	you can check the logs via this channels log records
2009-07-18T13:55:00.000Z	bazhang	wizzo50	this is xchat or xchat-gnome
2009-07-18T13:56:00.000Z	bazhang	wizzo50	please keep on this channel, not in PM
2009-07-18T14:11:00.000Z	bazhang	wizzo50	if you have enabled logging they will be in the location that sinbox gave you
2009-07-18T14:13:00.000Z	wizzo50	bazhang	I looked and see a bunch of others that I don't know where they came from but not the one I want so, I'll just ask the person again later on what he told me
2009-07-25T10:50:00.000Z	bazhang	wizzo50	its a bot; asking about pirating movies is not welcome here
2009-07-28T13:20:00.000Z	bazhang	wizzo50	do you have a support question?
2009-07-28T13:22:00.000Z	bazhang	wizzo50	what chat client are you using
2009-07-28T13:23:00.000Z	wizzo50	bazhang	XChat-GNOME IRC Chat
2009-07-28T13:23:00.000Z	bazhang	wizzo50	you have an xserver then
2009-07-28T13:24:00.000Z	wizzo50	bazhang	Then why didn't I see what ActionParsnip was talking about?
2009-07-28T13:24:00.000Z	bazhang	wizzo50	no idea. what is your support question.
2009-07-28T13:25:00.000Z	wizzo50	bazhang	How to access your startup programs when you load Ubuntu
2009-07-28T13:25:00.000Z	bazhang	wizzo50	read the link I give you
2009-07-29T11:30:00.000Z	bazhang	wizzo50	please ask in #ubuntu-offtopic
2009-09-04T12:48:00.000Z	bazhang	wizzo50	from the repos
