2009-01-06T22:37:00.000Z	ohmygod		hello? who knows how to drive the r8168 network card ?
2009-01-06T22:38:00.000Z	jim_p	ohmygod	what module will you need for it?
2009-01-06T22:39:00.000Z	jim_p	ohmygod	i have the very same card, and lspci -k reports that it uses the r8169 module
2009-01-06T22:42:00.000Z	ohmygod	jim_p	I've compiled the module in ubuntu. but when I compile it in debian, I got a error.
2009-01-06T22:43:00.000Z	jim_p	ohmygod	hmmm... why compile? its in the kernel!
2009-01-06T22:43:00.000Z	ohmygod	jim_p	no, there's just r8169, not r8168
2009-01-06T22:43:00.000Z	jim_p	ohmygod	yea, but it can handle the r8168 card
2009-01-06T22:44:00.000Z	ohmygod	jim_p	but it doesn't work in my debian.
2009-01-06T22:45:00.000Z	jim_p	ohmygod	it does work on my ...
2009-01-06T22:46:00.000Z	jim_p	ohmygod	what kernel are you on?
2009-01-06T22:46:00.000Z	ohmygod	jim_p	2.6.18-4-686
2009-01-06T22:47:00.000Z	jim_p	ohmygod	that is debian stable = really ancient kernel. can i pm you a solution?
2009-01-06T22:48:00.000Z	jim_p	ohmygod	install the etchandahalf kernel, its in the repos
2009-01-06T22:48:00.000Z	ohmygod	jim_p	but, I cann't connect to lan ...
2009-01-06T22:48:00.000Z	jim_p	ohmygod	is it a server?
2009-01-06T22:49:00.000Z	ohmygod	jim_p	no, just my box
2009-01-06T22:49:00.000Z	ohmygod	jim_p	It's network card cann't work, how to upgrade
2009-01-06T22:49:00.000Z	jim_p	ohmygod	then debian stavle is a bad selection since its on a desktop pc. try debian testing or unstable
2009-01-06T22:50:00.000Z	jim_p	ohmygod	if you have bandwidth to spend, i can tell you how
2009-01-06T22:50:00.000Z	jim_p	ohmygod	*how to upgrade
2009-01-06T22:51:00.000Z	ohmygod	jim_p	I mean, I cann't use "apt ..." by lan now
2009-01-06T22:51:00.000Z	jim_p	ohmygod	can i please pm you before we will be judged as offtopic?
2009-01-06T22:52:00.000Z	ohmygod	jim_p	ok
