2009-07-04T20:00:00.000Z	grayfox3214		didek?
2009-07-04T20:02:00.000Z	grayfox3214		anyone?
2009-07-04T20:03:00.000Z	grayfox3214		okay xD
2009-07-04T20:03:00.000Z	grayfox3214		what are you trying to sell didek
2009-07-04T20:04:00.000Z	grayfox3214		then why those pici go banana's?
2009-07-04T20:05:00.000Z	Pici	grayfox3214	What happens when you try to open any of these applications that you are having issues with?
2009-07-04T20:06:00.000Z	Pici	grayfox3214	I just looked at the scrollback, I think I know what may be going on
2009-07-04T20:06:00.000Z	Pici	grayfox3214	Did you by chance try to change your hostname recently?
2009-07-04T20:07:00.000Z	Pici	grayfox3214	How?
2009-07-04T20:10:00.000Z	Pici	grayfox3214	Can you tell me what the first line of /etc/hosts says?
2009-07-04T20:10:00.000Z	Pici	grayfox3214	And also the first line of /etc/hostname
2009-07-04T20:14:00.000Z	Pici	grayfox3214	The first one you gave me was from /etc/host.conf I need to see /etc/hosts
2009-07-04T20:17:00.000Z	Pici	grayfox3214	if you open a terminal and type: sudo ls     and then your password, does it work?
2009-07-04T20:19:00.000Z	Pici	grayfox3214	hmm indeed
2009-07-04T20:22:00.000Z	Pici	grayfox3214	I'm not sure what to suggest...
2009-07-04T20:25:00.000Z	Pici	grayfox3214	What is your user's name on your Ubuntu install?
2009-07-04T20:26:00.000Z	Pici	grayfox3214	Okay. Plesae open a terminal, then type:  sudo chown -R Grayfox3214:Grayfox3214 ~/
2009-07-04T20:27:00.000Z	Pici	grayfox3214	After that, try doing: gksudo jockey-gtk
2009-07-04T20:28:00.000Z	Pici	grayfox3214	Are you sure that your username has a capital G?
2009-07-04T20:29:00.000Z	Pici	grayfox3214	what does: echo $USER    say?
2009-07-04T20:32:00.000Z	Pici	grayfox3214	then do: sudo chown -R grayfox3214:grayfox3214 ~/
2009-07-04T20:33:00.000Z	Pici	grayfox3214	Thats fine.  How about: gksudo jockey-gtk
2009-07-04T20:36:00.000Z	Pici	grayfox3214	I'm running out, hopefully someone else can help you get this working. Sorry.
