2006-10-16T16:12:00.000Z	RichardCranium		crud, my dvd isnt mounting
2006-10-16T16:13:00.000Z	RichardCranium		says theres a media error but theres never one in winders
2006-10-16T16:13:00.000Z	RichardCranium		do I have to do something to enable dvd support ?
2006-10-16T16:14:00.000Z	RichardCranium		this is a data dvd
2006-10-16T16:14:00.000Z	Paddy_EIRE	RichardCranium	 oh, then it should work
2006-10-16T16:14:00.000Z	Paddy_EIRE	RichardCranium	what is the content of the disc
2006-10-16T16:17:00.000Z	Paddy_EIRE	RichardCranium	the cd should mount, could you paste the contents of your fstab to pastebin
2006-10-16T16:18:00.000Z	RichardCranium	Paddy_EIRE	it says it has a bad sector
2006-10-16T16:18:00.000Z	Paddy_EIRE	RichardCranium	yet you say it works fine in win
2006-10-16T16:19:00.000Z	RichardCranium	Paddy_EIRE	yeah
2006-10-16T16:21:00.000Z	Paddy_EIRE	RichardCranium	"gksudo gedit /etc/fstab" then copy the cotents of that to http://paste.ubuntu-nl.org/ then give me the link that is created
2006-10-16T16:23:00.000Z	RichardCranium	Paddy_EIRE	that was for you
2006-10-16T16:23:00.000Z	RichardCranium	Paddy_EIRE	I think I have to add something there to add dvd support
2006-10-16T16:25:00.000Z	Paddy_EIRE	RichardCranium	just wondering how many dvd/cd drives you gott
2006-10-16T16:25:00.000Z	RichardCranium	Paddy_EIRE	just one
2006-10-16T16:26:00.000Z	RichardCranium	Paddy_EIRE	they mount when I do it manually
2006-10-16T16:36:00.000Z	RichardCranium	Paddy_EIRE	got any idea what would cause my error?
2006-10-16T16:37:00.000Z	Paddy_EIRE	RichardCranium	sry for not gettin back to u, your entry is the exact same as mine except my cd/dvd is hdd rather that yours hdc
2006-10-16T16:40:00.000Z	RichardCranium	Paddy_EIRE	io_32bit is not enabled -might that have something to do with it or is it supposed to be like that?
2006-10-16T16:41:00.000Z	Paddy_EIRE	RichardCranium	i cant be sure
2006-10-16T05:55:00.000Z	Paddy_EIRE	RichardCranium	win will be in a window
2006-10-16T05:56:00.000Z	Paddy_EIRE	RichardCranium	will work the same except remember you are running 2 os's so performance will be slower
2006-10-16T05:56:00.000Z	Paddy_EIRE	RichardCranium	well that would be you sorted
