2011-05-09T12:37:00.000Z	unity_compiz		hey guys, i have uninstalled compiz (everytihng was ok) but after a reboot all my bars where away (left bar and top bar)
2011-05-09T12:37:00.000Z	ActionParsnip	unity_compiz	left bar needs compiz to exist
2011-05-09T12:38:00.000Z	unity_compiz	ActionParsnip	i have ubuntu 11.04, the left bar was there before i installed compiz
2011-05-09T12:38:00.000Z	ActionParsnip	unity_compiz	you can log in to gnome classic desktop and you should be ok
2011-05-09T12:38:00.000Z	ActionParsnip	unity_compiz	compiz is in a default install
2011-05-09T12:39:00.000Z	unity_compiz	ActionParsnip	so how to i access terminal?
2011-05-09T12:39:00.000Z	ActionParsnip	unity_compiz	CTRL+ALT+T
2011-05-09T12:40:00.000Z	unity_compiz	ActionParsnip	i tired that already, doesent work
2011-05-09T12:41:00.000Z	unity_compiz	ActionParsnip	EGuinn how do i start terminal without ctrl-alt-t
2011-05-09T12:42:00.000Z	ActionParsnip	unity_compiz	could use CTRL+ALT+F1
2011-05-09T12:43:00.000Z	unity_compiz	ActionParsnip	thats the black big fullscreen window, i was there before but what should i do there?
2011-05-09T12:43:00.000Z	ActionParsnip	unity_compiz	its tty, its not a fullscreen window. You can get back with CTRL+ALT+F7
2011-05-09T12:50:00.000Z	unity_compiz	ActionParsnip	k i could acces ctrl-alt-f1 but when i type something in there they want my password, when i type it in the always say it failed
2011-05-09T12:51:00.000Z	ActionParsnip	unity_compiz	its your login pass, you won't get any feedback, just keep typing and hit enter
2011-05-09T12:52:00.000Z	unity_compiz	ActionParsnip	yeah i know that type of login from terminal sudo -i but when i type and press enter it echo bak that the login failed
2011-05-09T12:53:00.000Z	ActionParsnip	unity_compiz	check caps lock :)
2011-05-09T12:54:00.000Z	unity_compiz	ActionParsnip	i checked it, negative
2011-05-09T12:55:00.000Z	ActionParsnip	unity_compiz	not sure then dude
2011-05-09T12:56:00.000Z	unity_compiz	ActionParsnip	could it be that my pass wa reseted, (i have autologin)
2011-05-09T12:57:00.000Z	ActionParsnip	unity_compiz	worth dropping to root recovery mode and set the password again
2011-05-09T12:57:00.000Z	unity_compiz	ActionParsnip	how?
2011-05-09T12:57:00.000Z	ActionParsnip	unity_compiz	hold shift at boot, select recovery mode, select root
2011-05-09T12:58:00.000Z	unity_compiz	ActionParsnip	k thx bye
