2005-10-22T09:11:00.000Z	sn9	martii	you can't compile fglrx. no source
2005-10-22T09:11:00.000Z	martii	sn9	anyway I can use alien + rpm
2005-10-22T09:11:00.000Z	sn9	martii	never use alien for anything
2005-10-22T09:12:00.000Z	martii	sn9	so what do you recommend ?
2005-10-22T09:12:00.000Z	martii	sn9	if my X dies after I even try to browse folders in nautilus
2005-10-22T09:12:00.000Z	martii	sn9	switched from fglrx to ati now
2005-10-22T09:12:00.000Z	martii	sn9	but have no 3D support
2005-10-22T09:12:00.000Z	sn9	martii	get the linux-restricted-modules pkg for your kernel and xorg-driver-fglrx pkg
2005-10-22T09:13:00.000Z	martii	sn9	got them already
2005-10-22T09:13:00.000Z	sn9	martii	it's either those or the open source driver
2005-10-22T09:14:00.000Z	martii	sn9	the same installation but with radeon 9800 works ok
2005-10-22T09:15:00.000Z	sn9	martii	probably a bug in ati's fglrx
2005-10-22T09:15:00.000Z	martii	sn9	might be
2005-10-22T09:15:00.000Z	martii	sn9	I'll try to use 8.18 instead of 8.16 provided by ubuntu
2005-10-22T09:15:00.000Z	martii	sn9	or get back to 8.12 that was provided by 5.04
2005-10-22T09:16:00.000Z	sn9	martii	wait until 8.18 is in ubuntu
2005-10-22T09:16:00.000Z	martii	sn9	when ?
2005-10-22T09:16:00.000Z	martii	sn9	could take some time
2005-10-22T09:16:00.000Z	sn9	martii	should be rather soon
2005-10-22T09:28:00.000Z	martii	sn9	any idea when new ati drivers will come
2005-10-22T09:28:00.000Z	sn9	martii	nope
2005-10-22T09:29:00.000Z	martii	sn9	ok ill use ati driver so far and then
2005-10-22T09:29:00.000Z	martii	sn9	install new drivers if they will come
