2012-08-26T12:28:00.000Z	Joe1		will file trasnfers and things be faster with 64 bit
2012-08-26T12:28:00.000Z	Joe1		or does that not really matter
2012-08-26T12:29:00.000Z	Joe1		i know what it is i just thought maybe that speeds up the processing
2012-08-26T12:29:00.000Z	Joe1		32 bit sees all my ram tho so i guess i dotn really need it
2012-08-26T12:30:00.000Z	Joe1		yea
2012-08-26T12:30:00.000Z	Joe1		i think i wanna use osx again
2012-08-26T12:30:00.000Z	Joe1		lol
2012-08-26T12:30:00.000Z	Joe1		soon as i figure out how to get it back on my comp i was useing lion
2012-08-26T12:30:00.000Z	gogeta	Joe1	apple will bring death squads for that
2012-08-26T12:41:00.000Z	gogeta	Joe1	no suse is rpm based
2012-08-26T12:42:00.000Z	gogeta	Joe1	or redhat
2012-08-26T12:43:00.000Z	gogeta	Joe1	lubuntu xubuntu are all geat
2012-08-26T12:43:00.000Z	gogeta	Joe1	lxde and xfce
2012-08-26T12:45:00.000Z	gogeta	Joe1	yep all those envirments are in the repos
2012-08-26T12:49:00.000Z	gogeta	Joe1	at login slect envirment then lxde
2012-08-26T12:51:00.000Z	gogeta	Joe1	guess  you found it
2012-08-26T12:52:00.000Z	gogeta	Joe1	could be a waring not a error
2012-08-26T12:52:00.000Z	gogeta	Joe1	odd enough
2012-08-26T12:53:00.000Z	gogeta	Joe1	could be trying to load the old theme and not likeing its not there
2012-08-26T12:53:00.000Z	gogeta	Joe1	:)
2012-08-26T12:54:00.000Z	gogeta	Joe1	lxde and xfce at least to me and most older users are great alts
2012-08-26T12:55:00.000Z	gogeta	Joe1	its like everyone thinks the start menu is some sort of eveil now
2012-08-26T12:56:00.000Z	gogeta	Joe1	well thats always the good thing abught linux is the choice
