2005-09-17T05:25:00.000Z	winner		it's pretty nice to have a transparent terminal window.
2005-09-17T05:25:00.000Z	abuntic	winner	is it a true transparency?
2005-09-17T05:26:00.000Z	winner	abuntic	no :(
2005-09-17T05:26:00.000Z	winner	abuntic	do you know of a true transprent term?
2005-09-17T05:26:00.000Z	abuntic	winner	oh ya I have been trying to get a true one
2005-09-17T05:26:00.000Z	abuntic	winner	no luck
2005-09-17T05:27:00.000Z	abuntic	winner	apparently x org has the possibility but no info on it enywhere
2005-09-17T05:27:00.000Z	winner	abuntic	damn :(
2005-09-17T05:27:00.000Z	abuntic	winner	I dont mean to bother you but do you know anything about apt?
2005-09-17T05:27:00.000Z	winner	abuntic	apt-get?
2005-09-17T05:28:00.000Z	abuntic	winner	ya
2005-09-17T05:28:00.000Z	winner	abuntic	sudo apt-get install (package)
2005-09-17T05:28:00.000Z	abuntic	winner	It gives me an error
2005-09-17T05:28:00.000Z	winner	abuntic	what error do you get?
2005-09-17T05:28:00.000Z	abuntic		I installed debian packages and it is confused I think
2005-09-17T05:29:00.000Z	winner	abuntic	hm. i really have no idea. sorry.
2005-09-17T05:30:00.000Z	winner		do you think its wise to compile kernel with optimizations?
2005-09-17T05:30:00.000Z	abuntic		winnerL: the error is: "the following packages have unmet dependencies"
2005-09-17T05:30:00.000Z	winner	abuntic	hm..... what are you trying to install?
2005-09-17T05:31:00.000Z	abuntic	winner	dvdrip and java
2005-09-17T05:32:00.000Z	winner	abuntic	i don't know, maybe this would help: https://wiki.ubuntu.com/AptGetHowto
2005-09-17T05:32:00.000Z	abuntic	winner	ok thanks
2005-09-17T05:34:00.000Z	winner	abuntic	np :)
