2005-03-03T06:20:00.000Z	universal	LinuxJones	do u know how to close down the X?
2005-03-03T06:21:00.000Z	LinuxJones	universal	yeah /etc/init.d/gdm stop
2005-03-17T11:01:00.000Z	LinuxJones	universal	are you using warty ?
2005-03-17T11:01:00.000Z	universal	LinuxJones	yes
2005-03-17T11:02:00.000Z	LinuxJones	universal	I';m runnign Hoary and when I run gdesklets it opens a nice gui for adding gdesklets to the desktop.
2005-03-17T11:02:00.000Z	universal	LinuxJones	ok, hmm it doesent come up for me ;)
2005-03-17T11:10:00.000Z	LinuxJones	universal	andrewski I just installed gdesklets cause you guys were talking about it...very cool
2005-03-17T11:11:00.000Z	universal	LinuxJones	u know the problem?
2005-03-17T11:11:00.000Z	LinuxJones	universal	no sorry dude
2005-03-17T11:12:00.000Z	universal	LinuxJones	ok ;)
2005-03-19T17:01:00.000Z	LinuxJones	universal	change the country and closest major city if your not living in 1
2005-03-19T17:06:00.000Z	universal	LinuxJones	i tried, but nothing were detected
2005-03-19T17:07:00.000Z	LinuxJones	universal	it worked for me :(
2005-03-19T17:07:00.000Z	universal	LinuxJones	so, for me i shoulc actually type Copenhagen, Denmark...?
2005-03-19T17:08:00.000Z	LinuxJones	universal	yeah make sure each is Capitalized
2005-03-19T17:08:00.000Z	LinuxJones	universal	1 sec lemme try
2005-03-19T17:09:00.000Z	LinuxJones	universal	Copenhagen is mostly cloudy 1 degree celcius
2005-03-19T17:09:00.000Z	LinuxJones	universal	start each name with a capital letter for country and city
2005-03-19T17:10:00.000Z	universal	LinuxJones	yeah, like a big D or a big C
2005-03-19T17:11:00.000Z	LinuxJones	universal	yeah that's what I put in and it updated ok for me
2005-03-19T17:11:00.000Z	universal	LinuxJones	hmm wierd, but u dont know any kind of direct url?
2005-03-19T17:12:00.000Z	LinuxJones	universal	nope
2005-03-19T17:12:00.000Z	universal	LinuxJones	ok, thx anyway
